user_input,response,reference,retrieved_contexts,reference_contexts,faithfulness,answer_relevancy,context_precision,context_recall
What are the effects and considerations of Liraglutide as a GLP-1 receptor agonist in the treatment of obesity and diabetes?,"주어진 컨텍스트에서는 Liraglutide의 구체적인 효과와 고려사항에 대한 정보가 제공되지 않습니다. 따라서, Liraglutide에 대한 임상 효과나 특별한 고려사항에 대한 질문에 대해 답변할 수 없습니다. 모른다고 하겠습니다.","Liraglutide, as a GLP-1 receptor agonist, increases glucose-dependent insulin secretion, decreases postprandial glucagon secretion, and inhibits gastric emptying, leading to improved postprandial blood sugar levels. It is administered via subcutaneous injection, either once or twice daily, and is associated with weight loss. However, it has potential side effects such as gastrointestinal disturbances and is contraindicated in patients with a history of medullary thyroid carcinoma or multiple endocrine neoplasia type 2. Caution is advised in patients with pancreatitis, acute kidney injury, severe liver impairment, and severe gastrointestinal diseases.","['- 43. Taheri S, Zaghloul H, Chagoury O, et al. Effect of intensive lifestyle intervention on\n- bodyweight and glycaemia in early type 2 diabetes (DIADEM-I): an open-label,\n- parallel-group, randomised controlled trial. Lancet Diabetes Endocrinol 2020;8(6):477-489.\n- 44. American Diabetes Association. 9. Pharmacologic approaches to glycemic treatment:\n- standards of medical care in diabetes. 2019. Diabetes Care 2021;44(1):S111-S124.\n- 45. Marso SP, Bain SC, Consoli A, et al. Semaglutide and cardiovascular outcomes in\n- patients with type 2 diabetes. N Engl J Med 2016;375:1834-1844.\n- 46. Cai X, Gao X, Yang W, et al. Efficacy and safety of initial combination therapy in\n- treatment-naive type 2 diabetes patients: a systematic review and meta-analysis.\n- Diabetes Ther 2018;9:1995-2014.\n- 47. Gerstein HC, Colhoun HM, Dagenais GR, et al. REWIND Investigators. Dulaglutide and\n- cardiovascular outcomes in type 2 diabetes (REWIND): a double-blind, randomised\n- placebo-controlled trial. Lancet 2019;394:121-130.\n- 48. Ji J, He Z, Yang Z, et al. Comparing the efficacy and safety of insulin detemir versus\n- neutral protamine hagedorn insulin in treatment of diabetes during pregnancy: a\n- randomized, controlled study. BMJ Open Diabetes Res Care 2020;8(1):e001155.\n- 49. Khan RMA, Mukhtar A, Khawar A. Comparison of metformin with insulin in the\n- management of gestational diabetes. Medical forum monthly 2017;28(1 1):105-109.\n- 50. Lee C, Joseph L, Colosimo A, et al. Mortality in diabetes compared with previous\n- cardiovascular disease: a gender-specific meta-analysis. Diabetes Metab 2012;38(5):\n- 420-427.\n- 51. Lee G, Oh SW, Hwang SS, et al. Comparative effectiveness of oral antidiabetic drugs in\n- preventing cardiovascular mortality and morbidity: a network meta-analysis. PLoS One\n- 2017;12:e0177646.\n- 52. Marso SP, Daniels GH, Brown-Frandsen K, et al. LEADER Steering Committee; LEADER\n- Trial Investigators. Liraglutide and cardiovascular outcomes in type 2 diabetes. N Engl J\n- Med 2016;375:311-322.\n- 53. Maruthur NM, Tseng E, Hutfless S, et al. Diabetes medications as monotherapy or\n- metformin- based combination therapy for type 2 diabetes: a systematic review and\n- meta-analysis. Ann Intern Med 2016;164(11):740-751.\n- 54. Palmer SC, Mavridis D, Nicolucci A, et al. Comparison of clinical outcomes and adverse\n- events associated with glucose-lowering drugs in patients with type 2 diabetes: a\n- meta-analysis. JAMA 2016;316:313-324.\n- 55. Perkovic V, Heerspink HL, Chalmers J, et al. Intensive glucose control improves kidney\n- outcomes in patients with type 2 diabetes. Kidney International 2013;83(3):517-523.\n- 56. Qian D, Zhang T, Zheng P, et al. Comparison of oral antidiabetic drugs as add-on\n- treatments in patients with type 2 diabetes uncontrolled on metformin: a network\n- meta-analysis. Diabetes Ther 2018;9:1945-1958.', '|  | 작용기전 및 복용법 | 체중 변화 | 저혈당 (단독) | 당화혈색소 감소(단독) | 부작용 | 주의점 |\n| --- | --- | --- | --- | --- | --- | --- |\n| Meglitinides Repaglinide Nateglinide Mitiglinide | - 췌장 베타세포에서 인슐린분비 증가 - 식후 혈당 개선 - 하루 2-4회 식사 전 복용 또는 매 식사 직전 복용 | 증가 | 있음 | 0.5-1.5% | 상기도감염, 변비 | - 금기: 중증감염, 수술전후, 중증 간기능장애, 임신 및 수유 - 겜피브로질과 병용 투여 금기(repaglinide) - 투석을 필요로 하는 중증 신장기능장애 (nateglinide) - 주의: 중증의 신장기능 장애(repaglinide/ mitiglinide) |\n| Thiazolidi- nediones Pioglitazone Lobeglitazone | - 근육, 지방 인슐린민감성 개선 - 간에서 당신생성 감소 - 식사에 관계없이 1일 1회 복용 | 증가 | 없음 | 0.5-1.4% | 부종, 체중증가, 골절, 심부전 | - 금기: 심부전, 유당불내성, 활동성 방광암 및 방광암 병력(pioglitazone), 원인이 불명확한 육안적 혈뇨(pioglitazone) |\n| DPP-4 inhibitors Sitagliptin Vildagliptin Saxagliptin Linagliptin Gemigliptin Alogliptin Teneligliptin Anagliptin Evogliptin | - 인크레틴(GLP-1, GIP) 증가 - 포도당의존 인슐린 분비 증가 - 식후 글루카곤분비 감소 - 식후혈당 개선 - 식사에 관계없이 복용 | 없음 | 없음 | 0.5-1.0% | - 비인두염, 상기도감염, 혈관부종-아나필락시스, 혈관부종 및 스티븐스- 존슨증후군을 포함한 박리성 피부질환, 수포성 유사천포창, 중증의 관절통(sitagliptin) - 유사천포창(linagliptin, vildagliptin) | - 금기: 유당불내성(saxagliptin, vildagliptin) - 주의: 췌장염, 췌장암, 심부전의 병력 또는 중등도-중증의 신장장애, 심부전으로 인한 입원의 위험 요소가 있는 환자(saxagliptin) 심부전 NYHA III-IV: 임상경험이 없어 권장되지 않음(alogliptin, teneligliptin, evogliptin, anagliptin, linagliptin, gemigliptin) 심부전 NYHA IV: 임상경험이 없어 권장되지 않음(vildagliptin) |', '- 1. American Diabetes Association. Standards of Medical Care in Diabetes-2021. Diabetes\n- Care 2021;44(suppl 1):S1-S232.\n- 2. Tamborlane WV, Barrientos-Perez M, Fainberg U, et al. Liraglutide in children and\n- adolescents with type 2 diabetes. N Engl J Med 2019;381(7):637-646.\n- 3. Copeland KC, Silverstein J, Moore KR, et al. American Academy of Pediatrics.\n- Management of newly diagnosed type 2 Diabetes Mellitus (T2DM) in children and\n- adolescents. Pediatrics 2013;131 (2):364-382.\n- 4. Panagiotopoulos C, Riddell MC, Sellers EA. Canadian Diabetes Association Clinical Practice\n- Guidelines Expert Committee. Type 2 diabetes in children and adolescents. Can J\n- Diabetes 2013;37:S163-S167.', '- 9. Yeo D, Yeo C, Low TY, et al. Outcomes AFTER METABOLIC SURGery in Asians-a\n- meta-analysis. Obes Surg 2019;29:114-126.\n- 10. Espeland MA, Glick HA, Bertoni A, et al. Impact of an intensive lifestyle intervention on\n- use and cost of medical services among overweight and obese adults with type 2\n- diabetes: the action for health in diabetes. Diabetes Care 2014;37:2548-2556.\n- 11. Lean ME, Leslie WS, Barnes AC, et al. Primary care-led weight management for\n- remission of type 2 diabetes (DiRECT): an open-label, cluster-randomised trial. Lancet\n- 2018;391:541-551.\n- 12. Davies MJ, Bergenstal R, Bode B, et al. Efficacy of liraglutide for weight loss among\n- patients with type 2 diabetes: The SCALE diabetes randomized clinical trial. JAMA\n- 2015;314(7):687-699.\n- 13. Hollander P, Gupta AK, Plodkowski R, et al. Effects of naltrexone sustained-\n- release/bupropion sustained-release combination therapy on body weight and glycemic\n- parameters in overweight and obese patients with type 2 diabetes. Diabetes Care\n- 2013;36(12):4022-4029.\n- 14. Schauer PR, Bhatt DL, Kirwan JP, et al. Bariatric surgery versus intensive medical\n- therapy for diabetes - 5-year outcomes. N Engl J Med 2017;376(7):641-651.\n- 15. Mingrone G, Panunzi S, De Gaetano A, et al. Bariatric-metabolic surgery versus\n- conventional medical treatment in obese patients with type 2 diabetes: 5 year follow-up\n- of an open-label, single-centre, randomised controlled trial. Lancet 2015;386(9997):\n- 964-973.\n- 16. Chong K, Ikramuddin S, Lee WJ, et al. National differences in remission of type 2\n- diabetes mellitus after roux-en-y gastric bypass surgery-subgroup analysis of 2-year\n- results of the diabetes surgery study comparing taiwanese with Americans with Mild\n- Obesity (BMI 30-35 kg/m2). Obes Surg 2017;27:1189-1195.\n- 17. Aminian A, Zajichek A, Arterburn DE, et al. Association of metabolic surgery with major\n- adverse cardiovascular outcomes in patients with type 2 diabetes and obesity. JAMA\n- 2019;322:1271-1282.\n- 18. Billeter AT, Scheurlen KM, Probst P, et al. Meta-analysis of metabolic surgery versus\n- medical treatment for microvascular complications in patients with type 2 diabetes\n- mellitus. Br J Surg 2018;105:168-181.\n- 19. Gregg EW, Jakicic JM, Blackburn G, et al. Look AHEAD Research Group. Association of\n- the magnitude of weight loss and changes in physical fitness with long-term\n- cardiovascular disease outcomes in overweight or obese people with type 2 diabetes: a\n- post-hoc analysis of the Look AHEAD randomised clinical trial. Lancet Diabetes\n- Endocrinol 2016;4:913-921.\n- 20. Ji G, Li P, Li W, et al. The effect of bariatric surgery on asian patients with type 2\n- diabetes mellitus and body mass index < 30 kg/m2: a systematic review and meta-\n- analysis. Obes Surg 2019;29(8):2492-2502.']","['<1-hop>\n\n- b) 현재 국내 허가된 약물치료로는 4주 이내 단기간 투여가 허가된 펜터민과 12주 이상 장기간 투여가 허가된\n- orlistat(제니칼), Liraglutide(삭센다), Phentermine/topiramate 복합제(큐시미아), Naltrexone/bupropion\n- 복합제(콘트라브)가 있다.1.4 비만 약물치료는 일반적으로 약 3-7%의 체중감량 효과가 있다.1 비만 약물치료의\n- 유효성과 안전성은 대규모 연구를 통해 입증되어 있으나, 기존의 연구 대상자는 체질량지수 30 kg/m2 이상인\n- 경우, 혹은 27.5 kg/m2 이상이면서 고혈압, 당뇨병, 이상지질혈증이나 수면무호흡증이 동반된 경우로 한정된다. 1.4\n- 체질량지수 25.0 kg/m2 이상인 2형당뇨병 환자에게서 비만 약물치료의 이득과 위해의 균형을 평가할 수 있는\n- 근거는 제한적이다.1', '<2-hop>\n\n|  | 작용기전 및 복용법 | 체중 변화 | 저혈당 (단독) | 당화혈색소 감소(단독) | 부작용 | 주의점 |\n| --- | --- | --- | --- | --- | --- | --- |\n| SGLT2 inhibitors Dapagliflozin Empagliflozin Ipragliflozin Ertugliflozin | - 신장에서 포도당 재흡수 억제 - 소변으로 당 배설 증가 - 식사에 관계없이 복용 | 감소 | 없음 | 0.5-1.0% | 체중감소, 요로감염, 생식기감염, 회음부 괴저, 배뇨 증가, 추정사구체여과율 감소, 적혈구용적률 증가, 케토산증, 하지절단 | - 금기: 유당불내성(dapagliflozin, empagliflozin), eGFR1) 30 미만, 말기 신장질환 또는 투석 중인 환자. 주의: 급성신장손상 및 신장기능 장애, 고령자(75세이상 주의), 중증 간장애 (권장되지 않음), 저혈압(ertugliflozin) |\n| GLP-1 receptor agonists Exenatide Liraglutide Dulaglutide | - 포도당의존 인슐린 분비 증가 - 식후 글루카곤 분비 감소 - 위배출 억제 - 식후혈당 개선 - 식사와 관계없이 피하주사(일 1-2회 또는 주 1회) | 감소 | 없음 | 0.8-1.5% | 위장관 장애 | - 금기: 갑상선수질암의 과거력 또는 가족력, MEN2 - 주의: 췌장염, 과민반응, 급성신장손상, 중증 간장애, 신장장애, 중증 위마비를 포함한 중증 위장관질환(권장되지 않음) |']",0.0,0.0,0.99999999995,1.0
"과체중 소아에서 2형당뇨병 환자의 대사 증후군 평가를 위해 어떤 검사가 필요하며, 그 빈도는 어떻게 결정되나요?","과체중 소아에서 2형당뇨병 환자의 대사 증후군 평가를 위해 필요한 검사는 첫 방문 시 신체계측과 혈액검사입니다. 이 검사를 통해 대사 증후군을 평가하는 것이 고려됩니다. 

검사의 빈도는 과체중 소아에서 당뇨병 위험요인이 있는 경우, 3년에 한 번씩 공복혈당 검사를 실시해야 한다는 권고가 있습니다.","과체중 소아에서 2형당뇨병 환자의 대사 증후군 평가를 위해 신체계측과 혈액검사를 고려해야 하며, 이는 첫 방문 시에 이루어져야 한다. 또한, 과체중 소아에서 당뇨병 위험요인이 있는 경우, 소아청소년기 당뇨병을 예방하고 조기진단하기 위해 3년에 한 번씩 공복혈당 검사가 필요하다. 체질량지수 백분위수가 증가하면 검사를 더 자주 실시해야 한다.","['| 권고 내용 | 권고등급 | 근거수준 | 권고도출 자료원 |\n| --- | --- | --- | --- |\n| · 2형당뇨병 환자의 첫 방문 시에 신체계측과 혈액검사로 대사 증후군 평가를 고려한다. | II a | B | 17-19 |\n| · 아래 기준 중 3개 이상에 해당될 때 대사증후군으로 진단할 것을 고려한다. ① 복부비만(허리둘레 남자 ≥ 90 cm, 여자 ≥ 85cm)a) ② 고중성지방혈증(중성지방 ≥ 150 mg/dL 또는 이상지질혈증약 복용) ③ 낮은 HDL 콜레스테롤(남자 < 40 mg/dL, 여자 < 50 mg/dL 또는 이상지질혈증약 복용) ④ 고혈압(혈압 ≥ 130/85 mmHg 또는 고혈압약 복용) ⑤ 고혈당(공복혈장포도당 ≥ 100 mg/dL 또는 당뇨병약 복용) | II a | A | 20-24 |', '| 진료 시 고려할 점 |\n| --- |\n| · 과체중 소아에서 당뇨병 위험요인이 있는 경우, 3년에 한 번씩 공복혈당 검사가 필요하다. · 소아청소년기 당뇨병 발병 시 1형과 2형당뇨병의 구별이 쉽지 않으므로 췌장 자가항체 검사 확인이 필요하다. · 진료 의뢰: 소아청소년 당뇨병 진단 환자는 당뇨병 전문의에게 의뢰 |', '| 권고 적용군 | 2형당뇨병 환자 | 진료환경 | 진료실 |\n| --- | --- | --- | --- |\n| 중재/실행지표 | 대사증후군 평가 시행 | 대사증후군 평가 시행 | 대사증후군 평가 시행 |\n| 비교지표 | 대사증후군 평가 미시행 | 대사증후군 평가 미시행 | 대사증후군 평가 미시행 |\n| 결과물 | 심뇌혈관질환 예방 | 심뇌혈관질환 예방 | 심뇌혈관질환 예방 |', '- b) 2형당뇨병과 대사증후군은 인슐린 저항성이 중심이 되는 질환으로 매우 밀접한 관련성을 보인다. 우리나라\n- 2형당뇨병 환자에서 대사증후군을 동반하고 있는 비율은 80%에 달하며,5 이러한 환자에서 심혈관계 질환의\n- 발생 및 사망률이 더욱 증가하리라는 것은 지극히 당연하다. 대사증후군이 있는 환자에서 대사증후군이 없는\n- 환자에 비해 심혈관계 질환으로 인한 사망률이 1.6배 증가하며, 이러한 사망률의 증가에는 당뇨병이 주된\n- 기여를 하는 것으로 보고되었다.6 또한 2형당뇨병 환자에서 대사증후군이 동반되었을 때 대혈관합병증뿐만\n- 아니라 미세혈관합병증의 발생 역시 증가되었다.7 잘 알려진 바와 같이 대사증후군의 주된 인자들인 비만,\n- 이상지질혈증 및 고혈압은 2형당뇨병 환자의 심혈관질환 발생에 중요한 위험인자로 작용한다. 따라서 2형\n- 당뇨병 환자의 초기 평가 시 신체 계측과 혈액검사를 통하여 대사증후군을 평가하는 것은 심혈관질환의 발생\n- 위험도를 미리 예측하고 위험인자들을 관리하는 차원에서 매우 중요하다.']","['<1-hop>\n\n- b) 과체중 소아에서 당뇨병 위험요인이 있는 경우, 소아청소년기 당뇨병을 예방하고, 조기진단하여 향후 당뇨병합\n- 병증을 감소시키기 위해 3년에 한 번씩 공복혈당 검사가 필요하다.3.4 체질량지수 백분위수가 증가하면 검사를\n- 더 자주 실시해야 한다.', '<2-hop>\n\n| 권고 내용 | 권고등급 | 근거수준 | 권고도출 자료원 |\n| --- | --- | --- | --- |\n| · 2형당뇨병 환자의 첫 방문 시에 신체계측과 혈액검사로 대사 증후군 평가를 고려한다. | II a | B | 17-19 |\n| · 아래 기준 중 3개 이상에 해당될 때 대사증후군으로 진단할 것을 고려한다. ① 복부비만(허리둘레 남자 ≥ 90 cm, 여자 ≥ 85cm)a) ② 고중성지방혈증(중성지방 ≥ 150 mg/dL 또는 이상지질혈증약 복용) ③ 낮은 HDL 콜레스테롤(남자 < 40 mg/dL, 여자 < 50 mg/dL 또는 이상지질혈증약 복용) ④ 고혈압(혈압 ≥ 130/85 mmHg 또는 고혈압약 복용) ⑤ 고혈당(공복혈장포도당 ≥ 100 mg/dL 또는 당뇨병약 복용) | II a | A | 20-24 |']",1.0,0.8116343704771568,0.9166666666361111,0.6666666666666666
"What are the recommended management strategies for hypertension in patients with gestational diabetes, considering the importance of lifestyle management and the combination of antihypertensive medications?",주어진 컨텍스트에는 임신성 당뇨병 환자의 고혈압 관리와 관련된 권장 전략에 대한 구체적인 정보가 포함되어 있지 않습니다. 따라서 해당 질문에 대한 명확한 답변은 제공할 수 없습니다.,"The management of hypertension in patients with gestational diabetes emphasizes the importance of lifestyle management as a fundamental approach. All mothers with gestational diabetes should receive clinical nutrition therapy education from experienced dietitians to ensure adequate nutrient intake, appropriate weight gain, and maintenance of normal blood sugar levels. Additionally, it is recommended to avoid excessive caloric restriction to prevent ketosis. For hypertension management, the ACCORD study indicates that many hypertensive patients do not achieve control with a single medication and may benefit from combining medications with different mechanisms at lower doses, which can enhance blood pressure-lowering effects and adherence while reducing side effects. Specifically, combining a renin-angiotensin system inhibitor with a calcium channel blocker has shown relatively good results compared to combinations with diuretics. However, the combination of an ACE inhibitor and an angiotensin II receptor blocker is not recommended due to increased risks of side effects such as hyperkalemia and acute kidney injury. Therefore, when managing hypertension in gestational diabetes, both lifestyle modifications and careful consideration of antihypertensive medication combinations are crucial.","['- 18. Song C, Li J, Leng J, et al. Lifestyle intervention can reduce the risk of gestational\n- diabetes: a meta-analysis of randomized controlled trials. Obesity reviews 2016;17:\n- 960-969.\n- 19. Hernandez TL, Friedman JE, Van Pelt RE, et al. Patterns of glycemia in normal\n- pregnancy should the current therapeutic targets be challenged?. Diabetes Care 2011;\n- 34(7):1660-1668.\n- 20. Kjos SL, Schaefer-Graf U, Sardesi S, et al. A randomized controlled trial using glycemic\n- plus fetal ultrasound parameters versus glycemic parameters to determine insulin therapy\n- in gestational diabetes with fasting hyperglycemia. Diabetes Care 2001;24(1 1):1904-1910.\n- 21. de Veciana M, Major CA, Morgan MA, et al. Postprandial versus preprandial blood\n- glucose monitoring in women with gestational diabetes mellitus requiring insulin therapy.\n- N Engl J Med 1995;333:1237-1241.\n- 22. Abell SK, Boyle JA, Earnest A, et al. Impact of different glycaemic treatment targets on\n- pregnancy outcomes in gestational diabetes. Diabetic medicine 2019;36(2):177-183.\n- 23. Crowther CA, Hughes R, Brown J, et al. Tight or less tight glycaemic targets for women\n- with gestational diabetes mellitus for reducing maternal and perinatal morbidity? the\n- target trial. J Paediatr Child Health 2019;55(1):3-55.\n- 24. Napoli A. Insulin therapy and diabetic pregnancy. Am J Ther 2020;27(1):e91-e105.\n- 25. Brown J, Grzeskowiak L, Williamson K, et al. Insulin for the treatment of women with\n- gestational diabetes. Cochrane Database Syst Rev 2017;11(11):CD012037.\n- 26. Tian Y, Zhang S, Huang F, et al. Glycemic qualification rate and frequency of\n- self-monitoring blood glucose glycemic qualification rate and frequency of self-monitoring\n- blood glucose (SMBG) in women with gestational diabetes mellitus (GDM). Diabetes Res\n- Clin Pract 2020;170:108482.\n- 27. Egi M, Furushima N, Makino S, et al. Glycemic control in acute illness. Korean J\n- Anesthesiol 2017;70(6):591-595.', '- 1. Crowther CA, Hiller JE, Moss JR, et al. Effect of treatment of gestational diabetes\n- mellitus on pregnancy outcomes. N Engl J Med 2005;352(24):2477-2486.\n- 2. Persson B, Swahn ML, Hjertberg R, et al. Insulin lispro therapy in pregnancies\n- complicated by type 1 diabetes mellitus. Diabetes Res Clin Pract 2002;58(2):115-121.\n- 3. Pettitt DJ, Ospina P, Kolaczynski JW, et al. Comparison of an insulin analog, insulin\n- aspart, and regular human insulin with no insulin in gestational diabetes mellitus. Diabetes\n- Care 2003;26(1):183-186.\n- 4. Mathiesen ER, Hod M, Ivanisevic M, et al. Maternal efficacy and safety outcomes in a\n- randomized, controlled trial comparing insulin detemir with NPH insulin in 310 pregnant\n- women with type 1 diabetes. Diabetes Care 2012;35(1 0):2012-2017.\n- 5. American Diabetes Association. Standards of Medical Care in Diabetes-2021. Diabetes\n- Care 2021;44(suppl 1):S1-S232.\n- 6. Kitzmiller JL, Block JM, Brown FM, et al. Managing preexisting diabetes for pregnancy:\n- summary of evidence and consensus recommendations for care. Diabetes Care 2008;\n- 31(5):1060-1079.\n- 7. American Diabetes Association Position statement: gestational diabetes mellitus. Diabetes\n- Care 2003;26(1):S103-S105.\n- 8. 박보경, 박정은, 장학철, 등. 임신성당뇨병 임신부에서 탄수화물 제한 식사요법이 임신 중 혈당에 미치는\n- 영향. 대한영양의학회지 2001;3:137-147.\n- 9. 장학철, 박정은, 임창훈, 등. 경증 임신성당뇨병 임신부에서 자가혈당측정이 임신 성적에 미치는 영향. 당\n- 뇨병 2001;25:93-102.\n- 10. Castorino K, Jovanovic L. Pregnancy and diabetes management: advances and controversies.\n- Clin Chem 2011;57(2):221-230.\n- 11. de Veciana M, Major CA, Morgan MA, et al. Postprandial versus preprandial blood\n- glucose monitoring in women with gestational diabetes mellitus requiring insulin therapy.\n- N Engl J Med 1995;333:1237-1241.', '- 16. Khalifeh A, Eckler R, Felder L, et al. One-step versus two-step diagnostic testing for\n- gestational diabetes: a randomized controlled trial. Journal of maternal-fetal & neonatal\n- medicine 2020;33(4):612-617.\n- 17. Kim TH, Kim DJ, Lim S, et al. Prevalence of the metabolic syndrome in type 2 diabetic\n- patients. Korean Diabetes J 2009;33(1):40-47.\n- 18. Sung KC, Rhee EJ, Ryu S, et al. Increased cardiovascular mortality in subjects with\n- metabolic syndrome is largely attributable to diabetes and hypertension in 159,971\n- Korean adults. J Clin Endocrinol Metab 2015;100(7):2606-2612.\n- 19. Chung HS, Seo JA, Kim SG, et al. Relationship between metabolic syndrome and risk of\n- chronic complications in Koreans with type 2 diabetes. Korean Diabetes J 2009;33(5):\n- 392-400.\n- 20. Expert Panel on Detection, Evaluation, and Treatment of High Blood Cholesterol in\n- Adults. Executive Summary of The Third Report of The National Cholesterol Education\n- Program (NCEP) Expert Panel on Detection, Evaluation, And Treatment of High Blood\n- Cholesterol In Adults (Adult Treatment Panel III). JAMA 2001;285:2486-2497.\n- 21. Alberti KG, Eckel RH, Grundy SM, et al. Harmonizing the metabolic syndrome: a joint\n- interim statement of the International Diabetes Federation Task Force on Epidemiology\n- and Prevention; National Heart, Lung, and Blood Institute; American Heart Association;\n- World Heart Federation; International Atherosclerosis Society; and International\n- Association for the Study of Obesity. Circulation 2009;120:1640-1645.\n- 22. Seo MH, Lee WY, Kim SS, et al. 2018 Korean society for the study of obesity guideline\n- for the management of obesity in Korea. J Obes Metab Syndr 2019;28(1):40-45.\n- 23. Kim HY, Kim JK, Shin GG, et al. Association between abdominal obesity and\n- cardiovascular risk factors in adults with normal body mass index: based on the sixth\n- Korea National Health and Nutrition Examination Survey. J Obes Metab Syndr 2019;28(4):\n- 262-270.\n- 24. Shiferaw WS, Akalu TY, Gedefaw M, et al. Metabolic syndrome among type 2 diabetic\n- patients in Sub-Saharan African countries: a systematic review and meta-analysis.\n- Diabetes Metab Syndr 2020;14(5):1403-1411.\n- 25. Peer N, Balakrishna Y, Durao S. Screening for type 2 diabetes mellitus. Cochrane\n- Database of Systematic Reviews 2020;5:CD005266.\n- 26. Hoyer A, Rathmann W, Kuss O. Utility of HbA(1c) and fasting plasma glucose for\n- screening of Type 2 diabetes: a meta-analysis of full ROC curves. Diabet Med 2018;\n- 35(3):317-322.\n- 27. Thavorasak T, Kamkaen P, Rattanasri A, et al. Diabetic risk score and fasting plasma\n- glucose testing in the screening for type 2 diabetes mellitus risk. International journal of\n- pharmaceutical and clinical research 2017;9(6):435-438.\n- 28. Knowler WC, Barrett-Connor E, Fowler SE, et al. Diabetes prevention program research', '- 43. Taheri S, Zaghloul H, Chagoury O, et al. Effect of intensive lifestyle intervention on\n- bodyweight and glycaemia in early type 2 diabetes (DIADEM-I): an open-label,\n- parallel-group, randomised controlled trial. Lancet Diabetes Endocrinol 2020;8(6):477-489.\n- 44. American Diabetes Association. 9. Pharmacologic approaches to glycemic treatment:\n- standards of medical care in diabetes. 2019. Diabetes Care 2021;44(1):S111-S124.\n- 45. Marso SP, Bain SC, Consoli A, et al. Semaglutide and cardiovascular outcomes in\n- patients with type 2 diabetes. N Engl J Med 2016;375:1834-1844.\n- 46. Cai X, Gao X, Yang W, et al. Efficacy and safety of initial combination therapy in\n- treatment-naive type 2 diabetes patients: a systematic review and meta-analysis.\n- Diabetes Ther 2018;9:1995-2014.\n- 47. Gerstein HC, Colhoun HM, Dagenais GR, et al. REWIND Investigators. Dulaglutide and\n- cardiovascular outcomes in type 2 diabetes (REWIND): a double-blind, randomised\n- placebo-controlled trial. Lancet 2019;394:121-130.\n- 48. Ji J, He Z, Yang Z, et al. Comparing the efficacy and safety of insulin detemir versus\n- neutral protamine hagedorn insulin in treatment of diabetes during pregnancy: a\n- randomized, controlled study. BMJ Open Diabetes Res Care 2020;8(1):e001155.\n- 49. Khan RMA, Mukhtar A, Khawar A. Comparison of metformin with insulin in the\n- management of gestational diabetes. Medical forum monthly 2017;28(1 1):105-109.\n- 50. Lee C, Joseph L, Colosimo A, et al. Mortality in diabetes compared with previous\n- cardiovascular disease: a gender-specific meta-analysis. Diabetes Metab 2012;38(5):\n- 420-427.\n- 51. Lee G, Oh SW, Hwang SS, et al. Comparative effectiveness of oral antidiabetic drugs in\n- preventing cardiovascular mortality and morbidity: a network meta-analysis. PLoS One\n- 2017;12:e0177646.\n- 52. Marso SP, Daniels GH, Brown-Frandsen K, et al. LEADER Steering Committee; LEADER\n- Trial Investigators. Liraglutide and cardiovascular outcomes in type 2 diabetes. N Engl J\n- Med 2016;375:311-322.\n- 53. Maruthur NM, Tseng E, Hutfless S, et al. Diabetes medications as monotherapy or\n- metformin- based combination therapy for type 2 diabetes: a systematic review and\n- meta-analysis. Ann Intern Med 2016;164(11):740-751.\n- 54. Palmer SC, Mavridis D, Nicolucci A, et al. Comparison of clinical outcomes and adverse\n- events associated with glucose-lowering drugs in patients with type 2 diabetes: a\n- meta-analysis. JAMA 2016;316:313-324.\n- 55. Perkovic V, Heerspink HL, Chalmers J, et al. Intensive glucose control improves kidney\n- outcomes in patients with type 2 diabetes. Kidney International 2013;83(3):517-523.\n- 56. Qian D, Zhang T, Zheng P, et al. Comparison of oral antidiabetic drugs as add-on\n- treatments in patients with type 2 diabetes uncontrolled on metformin: a network\n- meta-analysis. Diabetes Ther 2018;9:1945-1958.']","['<1-hop>\n\n- e) ACCORD 연구에서 많은 고혈압환자는 한 가지 약제로 조절되지 않고, 기전이 서로 다른 약제를 병용하였다. 13\n- 처음 사용한 일차약제에 효과가 없거나 목표혈압에 도달하지 못하는 경우 일차약제의 용량을 증가시키는 것보다\n- 서로 다른 기전의 약제를 저용량으로 병용하는 것이 혈압강하 효과와 순응도를 높이면서 부작용을 줄일 수\n- 있다. 14 두 가지 이상의 약제를 사용할 때 모든 조합의 병용이 가능하고, 어떻게 병용하는 것이 장기적인\n- 관점에서 이득이 있을 것인지는 아직 명확하지 않다. 레닌-안지오텐신계억제제, 칼슘 통로 차단제, 이뇨제\n- 중에서 두 가지 약을 병용하는 경우 비교적 좋은 결과를 보이고, 이 중 레닌-안지오텐신계억제제를 칼슘 통로\n- 차단제와 병용할 때 이뇨제와 복용하는 경우보다 우월하다는 보고가 있다.15 그러나 안지오텐신전환효소억제제와\n- 안지오텐신II수용체차단제를 함께 복용하는 경우 심혈관질환 예방에 추가적인 장점이 없고, 고칼륨혈증과 급성\n- 신손상 등 부작용이 증가할 수 있어, 이 두 약제의 병용은 권고하지 않는다. 16-18\n- 여러 연구결과들에서 혈압이 160/100 mmHg를 초과할 때는 강압효과를 극대화하고 혈압을 빠르게 조절하기\n- 위해 처음부터 서로 다른 기전을 가진 두 가지 이상 약물들의 병용요법을 고려한다. 19-21', '<2-hop>\n\n- a) 생활습관 관리는 임신성당뇨병 관리의 기본이다.5 모든 임신성당뇨병 산모는 경험 있는 영양사로부터 임상영양\n- 요법 교육을 받아야 한다.7 임신 중에는 필요한 영양소를 제공하며 적절한 체중 증가와 정상혈당을 유지하는\n- 것이 중요하며 특히 케톤증이 발생하지 않도록 지나친 열량 제한은 피하는 것을 권고한다. 식후 혈당을 적절\n- 하게 조절하기 위해서 탄수화물 제한식이가 도움이 되며 총열량을 당질 40-50%, 단백질 20%, 지방\n- 30-40%로 배분하도록 권고한다.8 임신성당뇨병에서 운동은 혈당을 개선시킬 수 있음이 확인되었으며 20-30분\n- 정도의 가벼운 운동도 혈당조절과 과도한 태아 성장을 예방하는 데에 도움이 된다. 금기사항(임신성 고혈압,\n- 조기양막파수, 조기 진통, 자궁경관 무력증, 자궁출혈, 자궁내성장지연, 조산의 과거력 등)이 없다면 모든 임신성\n- 당뇨병 산모에게 권장되어야 한다.7']",1.0,0.0,0.99999999995,0.2857142857142857
당뇨병 진단기준은 뭐에요?,"당뇨병 진단기준은 다음과 같습니다. 4가지 기준 중 하나 이상 만족할 경우 당뇨병으로 진단됩니다:

1. 당화혈색소 ≥ 6.5%
2. 8시간 이상 공복 후 혈장포도당 ≥ 126 mg/dL
3. 75 g 경구포도당부하검사 2시간 후 혈장포도당 ≥ 200 mg/dL
4. 당뇨병의 전형적인 증상(다뇨, 다음, 설명되지 않는 체중감소)과 무작위 혈장포도당 ≥ 200 mg/dL

이 기준들은 대한당뇨병학회의 진료지침에 포함되어 있습니다.","당뇨병 진단기준은 4가지 기준 중 한 가지 이상 만족 시 진단됩니다. 이 기준은 ① 당화혈색소 ≥ 6.5%, ② 8시간 이상 공복 후 혈장포도당 ≥ 126 mg/dL, ③ 75 g 경구포도당부하검사 2시간 후 혈장포도당 ≥ 200 mg/dL, ④ 당뇨병의 전형적인 증상과 무작위 혈장포도당 ≥ 200 mg/dL입니다.","['| 진료 시 고려할 점 |\n| --- |\n| · 노인에게서의 진단기준은 별도로 확정되어 있지 않다. · 당화혈색소는 표준화된 방법으로 측정해야 한다. · 당뇨병 진단기준 [c]1[c]~3[c] 중 하나를 만족하나 명백한 고혈당이 아니라면, 동일한 검사를 반복하거나 다른 검사를 추가해서 당뇨병 진단기준에 합당한 경우 당뇨병으로 확진한다. |', '- a) 선별검사의 목적은 어떤 질병을 가지고 있을 가능성이 높은 대상을 찾아내는 것으로 당뇨병은 선별검사와\n- 진단검사가 동일하다.\n- 2형당뇨병은 진단 시점 이전 상당 기간 동안 대사 이상들이 진행되어 진단 시 합병증이 동반되는 경우가 많아\n- 적극적인 선별검사가 필요하며, 특히 고위험군에서는 더욱 철저하게 시행되어야 한다. 한국인에 적절한 2형\n- 당뇨병의 위험인자는 권고요약본에 정리되어 있다.\n- b) 대한당뇨병학회에서는 공복혈당장애 혹은 당화혈색소에 따라 두 단계로 나누어 추가 검사를 시행하도록 하고\n- 있다. 즉 [1단계] 공복혈당 100-109 mg/dL, 당화혈색소 5.7-6.0%인 경우 매년 공복혈당 및 당화혈색소\n- 측정을 하고, [2단계] 공복혈당 110-125 mg/dL, 당화혈색소 6.1-6.4%인 경우 경구당부하검사를 시행하도록\n- 권고하고 있다.1\n- 2009년 국제전문가위원회에서는 당화혈색소가 장기적인 혈당 상태를 보다 정확히 반영하고, 당뇨병합병증의\n- 위험도와 좋은 상관관계를 보이며, 혈당 측정보다 안정적이라는 이유로 NGSP (National Glycohemoglobin\n- Standardization Program)에 의해 인증되고 DCCT (Diabetes Control and Complication Trial) assay에\n- 표준화된 방법을 사용했을 경우 당화혈색소 6.5% 이상을 당뇨병의 새로운 진단기준으로 포함시킬 것을 권고\n- 하였다.2 이 진단기준은 2010년 미국당뇨병학회의 진료지침에 반영되었고, 대한당뇨병학회는 2011년 진료지침\n- 에서 진단기준에 포함시켰다.', '| 진단기준 | 권고 등급 | 근거 수준 | 권고도출 자료원 |\n| --- | --- | --- | --- |\n| 91 정상혈당 기준 | 91 정상혈당 기준 | 91 정상혈당 기준 | 91 정상혈당 기준 |\n| · 8시간 이상 음식을 섭취하지 않은 상태에서 ▶ 공복혈장포도당 100 mg/dL 미만 ▶ 75g 경구포도당부하 2시간 후 혈장포도당 140 mg/dL 미만 | | | A | 2, 3, 5 |\n| 91 당뇨병 진단기준a) (4가지 기준 중 한 가지 이상 만족 시) | 91 당뇨병 진단기준a) (4가지 기준 중 한 가지 이상 만족 시) | 91 당뇨병 진단기준a) (4가지 기준 중 한 가지 이상 만족 시) | 91 당뇨병 진단기준a) (4가지 기준 중 한 가지 이상 만족 시) |\n| ① 당화혈색소 ≥ 6.5% | | | A | 2-5 |\n| ② 8시간 이상 공복 후 혈장포도당 ≥ 126 mg/dL | | | A | 2-5 |\n| ③ 75 g 경구포도당부하검사 2시간 후 혈장포도당 ≥ 200 mg/dL | | | A | 2-5 |\n| ④ 당뇨병의 전형적인 증상(다뇨, 다음, 설명되지 않는 체중감소)과 무작위 혈장포도당 ≥ 200 mg/dL | | | A | 2-5 |\n| 91 당뇨병전단계 진단기준 | 91 당뇨병전단계 진단기준 | 91 당뇨병전단계 진단기준 | 91 당뇨병전단계 진단기준 |\n| ① 공복혈장포도당 100-125 mg/dL (공복혈당장애) | | | A | 2, 3, 5 |\n| ② 75g 경구포도당부하 2시간 후 혈장포도당 140-199 mg/dL (내당능장애) | | | A | 2, 3, 5 |\n| 당화혈색소 5.7-6.4% | | | A | 2, 3, 5 |', '| 권고 내용 | 권고 등급 | 근거 수준 | 권고도출 자료원 |\n| --- | --- | --- | --- |\n| · 2형당뇨병 성인에게 당뇨병 진단 시 그리고 적어도 매년 당뇨병신장 질환의 선별검사를 권고한다. a),1) | | | A | 1, 3, 29-35 |\n| · 선별검사로는 알부민뇨를 확인하기 위한 소변알부민/크레이티닌비와 혈청 크레아티닌을 이용한 추정사구체여과율(eGFR)을 권고 한다. b),2) | | | A | 1, 3, 29-35, 49 |\n| · 3개월 이상 소변알부민/크레이티닌비가 30 mg/g 이상이거나 추정사구체여과율이 60 mL/min/1.73 m2 미만인 경우 당뇨병 신장질환 진단한다. c),3) | | | B | 1, 3, 34-48, 49 |\n| · 아래의 경우, 당뇨병이 아닌 다른 질환에 의한 신장질환을 고려 한다.d) ① 당뇨병망막병증이 없는 경우 ② 사구체여과율이 급속히 떨어지는 경우 ③ 단백뇨가 급격히 증가하거나 신증후군의 양상을 보이는 경우 ④ 고혈압이 조절되지 않는 경우 ⑤ 소변검사에서 혈뇨 등의 이상을 보이는 경우 ⑥ 다른 전신질환의 증세가 보이는 경우 ⑦ 안지오텐신전환효소억제제나 안지오텐신II수용체차단제 사용 2-3개월 이내에 사구체여과율이 30% 이상 감소하는 경우 | lla | B | 34, 35, 49, 50, 51 |']","['| 진단기준 | 권고 등급 | 근거 수준 | 권고도출 자료원 |\n| --- | --- | --- | --- |\n| 91 정상혈당 기준 | 91 정상혈당 기준 | 91 정상혈당 기준 | 91 정상혈당 기준 |\n| · 8시간 이상 음식을 섭취하지 않은 상태에서 ▶ 공복혈장포도당 100 mg/dL 미만 ▶ 75g 경구포도당부하 2시간 후 혈장포도당 140 mg/dL 미만 | | | A | 2, 3, 5 |\n| 91 당뇨병 진단기준a) (4가지 기준 중 한 가지 이상 만족 시) | 91 당뇨병 진단기준a) (4가지 기준 중 한 가지 이상 만족 시) | 91 당뇨병 진단기준a) (4가지 기준 중 한 가지 이상 만족 시) | 91 당뇨병 진단기준a) (4가지 기준 중 한 가지 이상 만족 시) |\n| ① 당화혈색소 ≥ 6.5% | | | A | 2-5 |\n| ② 8시간 이상 공복 후 혈장포도당 ≥ 126 mg/dL | | | A | 2-5 |\n| ③ 75 g 경구포도당부하검사 2시간 후 혈장포도당 ≥ 200 mg/dL | | | A | 2-5 |\n| ④ 당뇨병의 전형적인 증상(다뇨, 다음, 설명되지 않는 체중감소)과 무작위 혈장포도당 ≥ 200 mg/dL | | | A | 2-5 |\n| 91 당뇨병전단계 진단기준 | 91 당뇨병전단계 진단기준 | 91 당뇨병전단계 진단기준 | 91 당뇨병전단계 진단기준 |\n| ① 공복혈장포도당 100-125 mg/dL (공복혈당장애) | | | A | 2, 3, 5 |\n| ② 75g 경구포도당부하 2시간 후 혈장포도당 140-199 mg/dL (내당능장애) | | | A | 2, 3, 5 |\n| 당화혈색소 5.7-6.4% | | | A | 2, 3, 5 |']",1.0,0.8292266141318904,0.999999999975,1.0
Hypertension management과 저혈당의 관계는 무엇인가요?,주어진 컨텍스트에는 고혈압 관리와 저혈당의 관계에 대한 정보가 포함되지 않았습니다. 따라서 이 둘의 관계에 대해서는 알지 못합니다.,"Hypertension management에서 저혈당은 혈당 조절에 영향을 미칠 수 있습니다. 저혈당은 혈장포도당 농도가 50-70 mg/dL 이하로 떨어지는 경우를 말하며, 이는 당뇨병 치료의 중요한 부분입니다. 고혈압 환자가 저혈당을 경험할 경우, 혈당 조절에 대한 부정적인 생각으로 인해 혈압 관리가 어려워질 수 있습니다. 따라서, 저혈당 예방 및 관리는 고혈압 환자에게도 중요한 요소가 될 수 있습니다.","['- 1. Williams B, Mancia G, Spiering W, et al. 2018 ESC/ESH guidelines for the management\n- of arterial hypertension: The Task Force for the Management of Arterial Hypertension of\n- the European Society of Cardiology and the European Society of Hypertension. J\n- Hypertens 2018;36:1953-2041.\n- 2. Lewis EJ, Hunsicker LG, Bain RP, et al. The Collaborative Study Group. The effect of\n- angiotensin-converting-enzyme inhibition on diabetic nephropathy. N Engl J Med\n- 1993;329:1456-1462.\n- 3. Lewis EJ, Hunsicker LG, Clarke WR, et al. Renoprotective effect of the angiotensin-\n- receptor antagonist irbesartan in patients with nephropathy due to type 2 diabetes. N Eng\n- J Med 2001;345:851-860.\n- 4. Krop JS, Coresh J, Chambless LE, et al. A community-based study of explanatory factors\n- for the excess risk for early renal function decline in blacks VS. whites with diabetes: the', '- e) 무작위대조연구와 메타분석연구에서 당뇨병말초 및 자율신경병증의 치료에서 근본 원인인 혈당을 조절하는 것이\n- 중요하며, 여러 연구들에서 고혈당과 당뇨병말초신경병증의 중증도는 서로 밀접한 상관관계가 있고, 적극적인\n- 혈당조절은 1형당뇨병 환자에서 당뇨병신경병증을 예방 및 발생 지연시켰다. 1형당뇨병 환자를 대상으로 한\n- Diabetes Control and Complications Trial (DCCT) 연구에서 적극적인 혈당조절은 말초 및 자율신경병증\n- 이환율을 50-60% 정도까지 감소시켰다. 11 2형당뇨병 환자에서는 적극적인 혈당조절의 신경병증에 대한 효과가\n- 뚜렷하지는 않으나 일부에서는 감소시킨다는 보고가 있다. 12,13', '- a) 일반적으로 저혈당은 혈장포도당 농도가 50-70 mg/dL 이하로 떨어지는 경우를 말하나 저혈당이 발생하는\n- 혈당의 역치는 매우 다양하게 나타난다. 일부에서는 평소 높은 혈당에서 갑자기 혈당이 떨어지면서 정상 수준의\n- 혈당 수치임에도 불구하고 증상이 발생하기도 한다.1 저혈당 예방 및 관리는 당뇨병 치료의 중요한 부분이다.\n- 저혈당으로 인해 사회생활이 힘들어지거나 혈당조절에 대한 부정적 생각으로 철저한 혈당관리를 하는 것이 힘\n- 들어질 수 있다. 또한 저혈당에 대한 과잉치료는 반동성 고혈당과 체중 증가를 초래할 수 있어 추후 혈당\n- 조절을 어렵게 하는 주된 요인이 되기도 하므로 미리 저혈당을 교육하고 예방하는 것이 중요하다.', '- d) 당뇨병 환자에서 저혈당무감지증이나 저혈당 관련 자율신경장애는 엄격한 혈당조절을 어렵게 하며 저혈당에\n- 의해 유발 및 악화되기도 한다. 이러한 악순환을 방지하기 위해 적어도 몇 주일 동안 저혈당을 피하면 많은\n- 환자에서 인슐린길항호르몬 및 저혈당 감지 능력이 향상된다는 보고가 있다.4 그러므로 한 번 이상의 심한\n- 저혈당을 겪은 환자는 최소한 몇 주간의 단기간이라도 혈당 목표를 상향 조정하여 유지하는 것을 고려한다.']","['<1-hop>\n\n- e) ACCORD 연구에서 많은 고혈압환자는 한 가지 약제로 조절되지 않고, 기전이 서로 다른 약제를 병용하였다. 13\n- 처음 사용한 일차약제에 효과가 없거나 목표혈압에 도달하지 못하는 경우 일차약제의 용량을 증가시키는 것보다\n- 서로 다른 기전의 약제를 저용량으로 병용하는 것이 혈압강하 효과와 순응도를 높이면서 부작용을 줄일 수\n- 있다. 14 두 가지 이상의 약제를 사용할 때 모든 조합의 병용이 가능하고, 어떻게 병용하는 것이 장기적인\n- 관점에서 이득이 있을 것인지는 아직 명확하지 않다. 레닌-안지오텐신계억제제, 칼슘 통로 차단제, 이뇨제\n- 중에서 두 가지 약을 병용하는 경우 비교적 좋은 결과를 보이고, 이 중 레닌-안지오텐신계억제제를 칼슘 통로\n- 차단제와 병용할 때 이뇨제와 복용하는 경우보다 우월하다는 보고가 있다.15 그러나 안지오텐신전환효소억제제와\n- 안지오텐신II수용체차단제를 함께 복용하는 경우 심혈관질환 예방에 추가적인 장점이 없고, 고칼륨혈증과 급성\n- 신손상 등 부작용이 증가할 수 있어, 이 두 약제의 병용은 권고하지 않는다. 16-18\n- 여러 연구결과들에서 혈압이 160/100 mmHg를 초과할 때는 강압효과를 극대화하고 혈압을 빠르게 조절하기\n- 위해 처음부터 서로 다른 기전을 가진 두 가지 이상 약물들의 병용요법을 고려한다. 19-21', '<2-hop>\n\n- a) 일반적으로 저혈당은 혈장포도당 농도가 50-70 mg/dL 이하로 떨어지는 경우를 말하나 저혈당이 발생하는\n- 혈당의 역치는 매우 다양하게 나타난다. 일부에서는 평소 높은 혈당에서 갑자기 혈당이 떨어지면서 정상 수준의\n- 혈당 수치임에도 불구하고 증상이 발생하기도 한다.1 저혈당 예방 및 관리는 당뇨병 치료의 중요한 부분이다.\n- 저혈당으로 인해 사회생활이 힘들어지거나 혈당조절에 대한 부정적 생각으로 철저한 혈당관리를 하는 것이 힘\n- 들어질 수 있다. 또한 저혈당에 대한 과잉치료는 반동성 고혈당과 체중 증가를 초래할 수 있어 추후 혈당\n- 조절을 어렵게 하는 주된 요인이 되기도 하므로 미리 저혈당을 교육하고 예방하는 것이 중요하다.']",1.0,0.0,0.6388888888675925,1.0
당뇨병합병증 예방은 어떤 권고 적용군에서 이루어지나요?,"당뇨병 합병증 예방은 중재/실행지표로서 진단기준에 적용되는 모든 권고 적용군에서 이루어집니다. 이는 당뇨병 발생위험군, 진료환경에서의 진료실 등을 포함합니다.",당뇨병합병증 예방은 모든 권고 적용군에서 이루어집니다.,"['| 권고 적용군 | 당뇨병 발생위험군 | 진료환경 | 진료실 |\n| --- | --- | --- | --- |\n| 중재/실행지표 | 진단기준 적용 | 진단기준 적용 | 진단기준 적용 |\n| 비교지표 | 진단기준 적용하지 않음 | 진단기준 적용하지 않음 | 진단기준 적용하지 않음 |\n| 결과물 | 당뇨병합병증 예방 | 당뇨병합병증 예방 | 당뇨병합병증 예방 |', 'a) Diabetes Prevention Program,7 Finnish Diabetes Prevention,8 Da Qing Diabetes Prevention9 연구\n등에서 공복혈당장애 혹은 내당능장애 군이 식사, 운동요법과 체중감량을 했을 때 대조군에 비해 약 30-\n50% 이상 당뇨병 발생률이 감소되었다. 이상 세 가지 연구 모두 종료된 후에도 당뇨병 발생 예방효과는 최소\n3년에서 10년 이상까지 지속되었다.\n발생위험이 높은 군에서 매년 선별검사 시행을 통해 당뇨병전단계 상태를 조기에 찾아내 적극적 중재 노력을\n기울임으로써 당뇨병으로의 진행을 예방하고, 이미 당뇨병으로 진행된 환자를 빨리 발견해 합병증 증가를\n억제할 수 있다. 조절되지 않은 당뇨병과 당뇨병합병증으로 인한 막대한 사회적, 재정적 비용을 조기 선별,\n조기진단, 조기 중재를 통해 줄일 수 있다는 것을 생각하면 고위험군에 대한 적극적 선별검사를 시행할 수 있는\n여건 마련, 즉 관계 당국의 이해와 전향적 보험급여확대 정책이 필요하다.', '| 권고 적용군 | 고위험군, 당뇨병전단계 환자 | 진료환경 | 진료실/지역사회 |\n| --- | --- | --- | --- |\n| 중재/실행지표 | 생활습관교정 및 체중감량 | 생활습관교정 및 체중감량 | 생활습관교정 및 체중감량 |\n| 비교지표 | 생활습관교정 및 체중감량 안함 | 생활습관교정 및 체중감량 안함 | 생활습관교정 및 체중감량 안함 |\n| 결과물 | 당뇨병 예방 | 당뇨병 예방 | 당뇨병 예방 |', '| 권고 내용 | 권고등급 | 근거수준 | 권고도출 자료원 |\n| --- | --- | --- | --- |\n| · 당뇨병 발생 위험이 높은 군(내당능장애, 공복혈당장애, 당화 혈색소 5.7-6.4%인 경우)에서 당뇨병 발생을 감소시키기 위하여 생활습관의 개선(식사조절과 운동)을 적극적으로 조언할 것을 권고한다.a) | | | A | 1, 3, 28-40 |\n| · 비만한 고위험군에서 생활습관교정으로 체중을 감량하고자 할 때 최초 체중의 5-10% 감소를 목표로 할 것을 권고한다. | | | A | 1, 3, 28-40 |']",['| 권고 적용군 | 당뇨병 발생위험군 | 진료환경 | 진료실 |\n| --- | --- | --- | --- |\n| 중재/실행지표 | 진단기준 적용 | 진단기준 적용 | 진단기준 적용 |\n| 비교지표 | 진단기준 적용하지 않음 | 진단기준 적용하지 않음 | 진단기준 적용하지 않음 |\n| 결과물 | 당뇨병합병증 예방 | 당뇨병합병증 예방 | 당뇨병합병증 예방 |'],0.6666666666666666,0.8013649982185402,0.99999999995,0.0
당뇨병의 진단 기준은 무엇인가요?,"당뇨병의 진단 기준은 다음과 같습니다. 아래의 4가지 기준 중 하나 이상을 만족해야 합니다:

1. 당화혈색소 ≥ 6.5%
2. 8시간 이상 공복 후 혈장포도당 ≥ 126 mg/dL
3. 75 g 경구포도당부하검사 2시간 후 혈장포도당 ≥ 200 mg/dL
4. 당뇨병의 전형적인 증상(다뇨, 다음, 설명되지 않는 체중감소)과 무작위 혈장포도당 ≥ 200 mg/dL

이 외에도 당뇨병 전단계 진단 기준으로는 공복혈장포도당 100-125 mg/dL (공복혈당장애), 75g 경구포도당부하 2시간 후 혈장포도당 140-199 mg/dL (내당능장애), 당화혈색소 5.7-6.4%가 있습니다.",당뇨병의 진단 기준은 공복혈당이 126 mg/dL 이상이거나 식후 2시간 혈당이 200 mg/dL 이상일 때 확정됩니다.,"['| 진료 시 고려할 점 |\n| --- |\n| · 노인에게서의 진단기준은 별도로 확정되어 있지 않다. · 당화혈색소는 표준화된 방법으로 측정해야 한다. · 당뇨병 진단기준 [c]1[c]~3[c] 중 하나를 만족하나 명백한 고혈당이 아니라면, 동일한 검사를 반복하거나 다른 검사를 추가해서 당뇨병 진단기준에 합당한 경우 당뇨병으로 확진한다. |', '- a) 선별검사의 목적은 어떤 질병을 가지고 있을 가능성이 높은 대상을 찾아내는 것으로 당뇨병은 선별검사와\n- 진단검사가 동일하다.\n- 2형당뇨병은 진단 시점 이전 상당 기간 동안 대사 이상들이 진행되어 진단 시 합병증이 동반되는 경우가 많아\n- 적극적인 선별검사가 필요하며, 특히 고위험군에서는 더욱 철저하게 시행되어야 한다. 한국인에 적절한 2형\n- 당뇨병의 위험인자는 권고요약본에 정리되어 있다.\n- b) 대한당뇨병학회에서는 공복혈당장애 혹은 당화혈색소에 따라 두 단계로 나누어 추가 검사를 시행하도록 하고\n- 있다. 즉 [1단계] 공복혈당 100-109 mg/dL, 당화혈색소 5.7-6.0%인 경우 매년 공복혈당 및 당화혈색소\n- 측정을 하고, [2단계] 공복혈당 110-125 mg/dL, 당화혈색소 6.1-6.4%인 경우 경구당부하검사를 시행하도록\n- 권고하고 있다.1\n- 2009년 국제전문가위원회에서는 당화혈색소가 장기적인 혈당 상태를 보다 정확히 반영하고, 당뇨병합병증의\n- 위험도와 좋은 상관관계를 보이며, 혈당 측정보다 안정적이라는 이유로 NGSP (National Glycohemoglobin\n- Standardization Program)에 의해 인증되고 DCCT (Diabetes Control and Complication Trial) assay에\n- 표준화된 방법을 사용했을 경우 당화혈색소 6.5% 이상을 당뇨병의 새로운 진단기준으로 포함시킬 것을 권고\n- 하였다.2 이 진단기준은 2010년 미국당뇨병학회의 진료지침에 반영되었고, 대한당뇨병학회는 2011년 진료지침\n- 에서 진단기준에 포함시켰다.', '| 진단기준 | 권고 등급 | 근거 수준 | 권고도출 자료원 |\n| --- | --- | --- | --- |\n| 91 정상혈당 기준 | 91 정상혈당 기준 | 91 정상혈당 기준 | 91 정상혈당 기준 |\n| · 8시간 이상 음식을 섭취하지 않은 상태에서 ▶ 공복혈장포도당 100 mg/dL 미만 ▶ 75g 경구포도당부하 2시간 후 혈장포도당 140 mg/dL 미만 | | | A | 2, 3, 5 |\n| 91 당뇨병 진단기준a) (4가지 기준 중 한 가지 이상 만족 시) | 91 당뇨병 진단기준a) (4가지 기준 중 한 가지 이상 만족 시) | 91 당뇨병 진단기준a) (4가지 기준 중 한 가지 이상 만족 시) | 91 당뇨병 진단기준a) (4가지 기준 중 한 가지 이상 만족 시) |\n| ① 당화혈색소 ≥ 6.5% | | | A | 2-5 |\n| ② 8시간 이상 공복 후 혈장포도당 ≥ 126 mg/dL | | | A | 2-5 |\n| ③ 75 g 경구포도당부하검사 2시간 후 혈장포도당 ≥ 200 mg/dL | | | A | 2-5 |\n| ④ 당뇨병의 전형적인 증상(다뇨, 다음, 설명되지 않는 체중감소)과 무작위 혈장포도당 ≥ 200 mg/dL | | | A | 2-5 |\n| 91 당뇨병전단계 진단기준 | 91 당뇨병전단계 진단기준 | 91 당뇨병전단계 진단기준 | 91 당뇨병전단계 진단기준 |\n| ① 공복혈장포도당 100-125 mg/dL (공복혈당장애) | | | A | 2, 3, 5 |\n| ② 75g 경구포도당부하 2시간 후 혈장포도당 140-199 mg/dL (내당능장애) | | | A | 2, 3, 5 |\n| 당화혈색소 5.7-6.4% | | | A | 2, 3, 5 |', '| 권고 내용 | 권고 등급 | 근거 수준 | 권고도출 자료원 |\n| --- | --- | --- | --- |\n| · 2형당뇨병 성인에게 당뇨병 진단 시 그리고 적어도 매년 당뇨병신장 질환의 선별검사를 권고한다. a),1) | | | A | 1, 3, 29-35 |\n| · 선별검사로는 알부민뇨를 확인하기 위한 소변알부민/크레이티닌비와 혈청 크레아티닌을 이용한 추정사구체여과율(eGFR)을 권고 한다. b),2) | | | A | 1, 3, 29-35, 49 |\n| · 3개월 이상 소변알부민/크레이티닌비가 30 mg/g 이상이거나 추정사구체여과율이 60 mL/min/1.73 m2 미만인 경우 당뇨병 신장질환 진단한다. c),3) | | | B | 1, 3, 34-48, 49 |\n| · 아래의 경우, 당뇨병이 아닌 다른 질환에 의한 신장질환을 고려 한다.d) ① 당뇨병망막병증이 없는 경우 ② 사구체여과율이 급속히 떨어지는 경우 ③ 단백뇨가 급격히 증가하거나 신증후군의 양상을 보이는 경우 ④ 고혈압이 조절되지 않는 경우 ⑤ 소변검사에서 혈뇨 등의 이상을 보이는 경우 ⑥ 다른 전신질환의 증세가 보이는 경우 ⑦ 안지오텐신전환효소억제제나 안지오텐신II수용체차단제 사용 2-3개월 이내에 사구체여과율이 30% 이상 감소하는 경우 | lla | B | 34, 35, 49, 50, 51 |']","['a) 세계에서 당뇨병 유병률이 가장 높은 민족들 중의 하나인 피마인디언을 대상으로 한 연구에서, 공복혈당이\n116 mg/dL 이상과 식후 2시간 혈당 185 mg/dL 이상일 때 당뇨병망막증의 발생이 급격히 증가하였다. 1\n이 연구와 연계하여 고혈당으로 인한 합병증이 발생할 수 있는 기준을 당뇨병 진단 기준으로 확정하였다.\n공복혈당 126 mg/dL에 해당하는 식후 2시간 혈당 평균이 200 mg/dL이며, 이런 정도의 혈당이 안정적으로\n유지될 경우 당화혈색소치 6.5%에 해당하게 된다.']",1.0,0.8369697223688624,0.9999999999666667,1.0
What are the diagnostic criteria for metabolic syndrome in 2형당뇨병 환자 and how do they relate to the overall diabetes diagnosis standards?,"2형당뇨병 환자의 대사증후군 진단 기준은 다음과 같습니다. 환자가 아래의 기준 중 3개 이상에 해당될 때 대사증후군으로 진단할 수 있습니다:

1. 복부비만: 허리둘레 남자 ≥ 90 cm, 여자 ≥ 85 cm
2. 고중성지방혈증: 중성지방 ≥ 150 mg/dL 또는 이상지질혈증약 복용
3. 낮은 HDL 콜레스테롤: 남자 < 40 mg/dL, 여자 < 50 mg/dL 또는 이상지질혈증약 복용
4. 고혈압: 혈압 ≥ 130/85 mmHg 또는 고혈압약 복용
5. 고혈당: 공복혈장포도당 ≥ 100 mg/dL 또는 당뇨병약 복용

이 기준은 대한당뇨병학회의 권고에 기초하고 있으며, 대사증후군의 진단과 관련하여 2형당뇨병 환자의 첫 방문 시 신체계측과 혈액검사로 평가하는 것이 고려되어야 합니다. 

2형당뇨병의 진단 기준은 공복혈당, 당화혈색소 등으로 설정되어 있으며, 대사증후군의 진단 기준은 이러한 당뇨병의 요소와 상당히 겹칩니다. 따라서 대사증후군의 진단은 당뇨병의 관리 및 합병증 예방에서도 중요한 역할을 할 수 있습니다.","The diagnostic criteria for metabolic syndrome in 2형당뇨병 환자 include meeting three or more of the following criteria: abdominal obesity (waist circumference ≥ 90 cm for men and ≥ 85 cm for women), high triglycerides (≥ 150 mg/dL or on medication for dyslipidemia), low HDL cholesterol (men < 40 mg/dL, women < 50 mg/dL or on medication for dyslipidemia), high blood pressure (≥ 130/85 mmHg or on antihypertensive medication), and high blood glucose (fasting plasma glucose ≥ 100 mg/dL or on diabetes medication). These criteria are part of the broader diabetes diagnosis standards, which also include specific thresholds for blood glucose levels and other factors that help in identifying diabetes and its types.","['- 1. 대한당뇨병학회. 2021 당뇨병 진료지침. 2021.\n- 2. American Diabetes Association. Standards of Medical Care in Diabetes-2021. Diabetes\n- Care 2021;44(suppl 1):S1-S232.\n- 3. Diabetes Canada. Diabetes Canada 2018 clinical practice guidelines for the prevention and\n- management of diabetes in Canada. Can J Diabetes 2018;42:S1-S352.\n- 4. Stevens RJ, Kothari V, Adler AI, et al. United Kingdom Prospective Diabetes Study\n- (UKPDS) Group. The UKPDS risk engine: a model for the risk of coronary heart disease in\n- Type II diabetes (UKPDS 56). Clin Sci (Lond) 2001;101:671-679.\n- 5. Lawlor DA, Smith GD, Ebrahim S. Does the new International Diabetes Federation\n- definition of the metabolic syndrome predict CHD any more strongly than older\n- definitions? Findings from the British Womens Heart and Health Study. Diabetologia\n- 2006;49:41-48.\n- 6. Ryden L, Standl E, Bartnik M, et al. Task Force on Diabetes and Cardiovascular Diseases\n- of the European Society of Cardiology (ESC); European Association for the Study of\n- Diabetes (EASD): Guidelines on diabetes, pre-diabetes, and cardiovascular diseases:\n- executive summary. The Task Force on Diabetes and Cardiovascular Diseases of the\n- European Society of Cardiology (ESC) and of the European Association for the Study of\n- Diabetes (EASD). Eur Heart J 2007;28:88-136.\n- 7. Scognamiglio R, Negut C, Ramondo A, et al. Detection of coronary artery disease in\n- asymptomatic patients with type 2 diabetes mellitus. J Am Coll Cardiol 2006;47:65-71.\n- 8. Cushman WC, Evans GW, Byington RP, et al. ACCORD Study Group. Effects of intensive\n- blood-pressure control in type 2 diabetes mellitus. N Engl J Med 2010;362:1575-1585.\n- 9. Shah BR, Bhattacharyya O, Yu C, et al. Evaluation of a toolkit to improve cardiovascular\n- disease screening and treatment for people with type 2 diabetes: protocol for a\n- cluster-randomized pragmatic trial. Trials 2010;11:44.\n- 10. Hansen LJ, Siersma V, Beck-Nielsen H, et al. Structured personal care of type 2\n- diabetes: A 19 year follow-up of the study Diabetes Care in General Practice (DCGP).\n- Diabetologia 2013;56(6):1243-1253.\n- 11. Noble D, Mathur R, Dent T, et al. Risk models and scores for type 2 diabetes:\n- systematic review. BMJ (Online) 2011;343(7836):1243.\n- 12. Chung TN, Andy HL, Colin WB. Components and validity of risk scores for screening for\n- Type 2 diabetes mellitus. Diabetes Management 2012;2(5):419-425.\n- 13. Seidu S, Achana FA, Gray LJ, et al. Effects of glucose-lowering and multifactorial\n- interventions on cardiovascular and mortality outcomes: a meta-analysis of randomized\n- control trials. Diabet Med 2015;33:280-289.\n- 14. Zinman B, Wanner C, Lachin JM, et al. Empagliflozin, cardiovascular outcomes, and\n- mortality in type 2 diabetes. N Engl J Med 2015;373(22):2117-2128.\n- 15. Monami M, Dicembrini 1, Mannucci E. Effects of SGLT-2 inhibitors on mortality and', '- a) 선별검사의 목적은 어떤 질병을 가지고 있을 가능성이 높은 대상을 찾아내는 것으로 당뇨병은 선별검사와\n- 진단검사가 동일하다.\n- 2형당뇨병은 진단 시점 이전 상당 기간 동안 대사 이상들이 진행되어 진단 시 합병증이 동반되는 경우가 많아\n- 적극적인 선별검사가 필요하며, 특히 고위험군에서는 더욱 철저하게 시행되어야 한다. 한국인에 적절한 2형\n- 당뇨병의 위험인자는 권고요약본에 정리되어 있다.\n- b) 대한당뇨병학회에서는 공복혈당장애 혹은 당화혈색소에 따라 두 단계로 나누어 추가 검사를 시행하도록 하고\n- 있다. 즉 [1단계] 공복혈당 100-109 mg/dL, 당화혈색소 5.7-6.0%인 경우 매년 공복혈당 및 당화혈색소\n- 측정을 하고, [2단계] 공복혈당 110-125 mg/dL, 당화혈색소 6.1-6.4%인 경우 경구당부하검사를 시행하도록\n- 권고하고 있다.1\n- 2009년 국제전문가위원회에서는 당화혈색소가 장기적인 혈당 상태를 보다 정확히 반영하고, 당뇨병합병증의\n- 위험도와 좋은 상관관계를 보이며, 혈당 측정보다 안정적이라는 이유로 NGSP (National Glycohemoglobin\n- Standardization Program)에 의해 인증되고 DCCT (Diabetes Control and Complication Trial) assay에\n- 표준화된 방법을 사용했을 경우 당화혈색소 6.5% 이상을 당뇨병의 새로운 진단기준으로 포함시킬 것을 권고\n- 하였다.2 이 진단기준은 2010년 미국당뇨병학회의 진료지침에 반영되었고, 대한당뇨병학회는 2011년 진료지침\n- 에서 진단기준에 포함시켰다.', '| 권고 내용 | 권고등급 | 근거수준 | 권고도출 자료원 |\n| --- | --- | --- | --- |\n| · 2형당뇨병 환자의 첫 방문 시에 신체계측과 혈액검사로 대사 증후군 평가를 고려한다. | II a | B | 17-19 |\n| · 아래 기준 중 3개 이상에 해당될 때 대사증후군으로 진단할 것을 고려한다. ① 복부비만(허리둘레 남자 ≥ 90 cm, 여자 ≥ 85cm)a) ② 고중성지방혈증(중성지방 ≥ 150 mg/dL 또는 이상지질혈증약 복용) ③ 낮은 HDL 콜레스테롤(남자 < 40 mg/dL, 여자 < 50 mg/dL 또는 이상지질혈증약 복용) ④ 고혈압(혈압 ≥ 130/85 mmHg 또는 고혈압약 복용) ⑤ 고혈당(공복혈장포도당 ≥ 100 mg/dL 또는 당뇨병약 복용) | II a | A | 20-24 |', '- b) 2형당뇨병은 인슐린저항성(인슐린의 작용 감소)과 인슐린의 분비량 부족으로 초래되는 질환이다. 이 두 가지\n- 병인은 모든 당뇨병 환자들에게서 반드시 존재한다. 하지만 인슐린저항성이 좀 더 우세한 경우(예를 들면\n- 비만증 동반)와 인슐린 분비결핍(예를 들면 저체중인 경우)이 더 우세한 경우로 나누어지기도 한다.1 복잡한\n- 병인을 고려하면 모든 환자들에게서 인슐린저항성과 인슐린분비능을 같이 고려하면서 치료해야 장기적인 혈당\n- 관리가 가능하다.']","['<1-hop>\n\n| 권고 내용 | 권고등급 | 근거수준 | 권고도출 자료원 |\n| --- | --- | --- | --- |\n| · 2형당뇨병 환자의 첫 방문 시에 신체계측과 혈액검사로 대사 증후군 평가를 고려한다. | II a | B | 17-19 |\n| · 아래 기준 중 3개 이상에 해당될 때 대사증후군으로 진단할 것을 고려한다. ① 복부비만(허리둘레 남자 ≥ 90 cm, 여자 ≥ 85cm)a) ② 고중성지방혈증(중성지방 ≥ 150 mg/dL 또는 이상지질혈증약 복용) ③ 낮은 HDL 콜레스테롤(남자 < 40 mg/dL, 여자 < 50 mg/dL 또는 이상지질혈증약 복용) ④ 고혈압(혈압 ≥ 130/85 mmHg 또는 고혈압약 복용) ⑤ 고혈당(공복혈장포도당 ≥ 100 mg/dL 또는 당뇨병약 복용) | II a | A | 20-24 |', '<2-hop>\n\n- 1. 당뇨병 분류\n- 2. 당뇨병 진단기준\n- 3. 임신당뇨병 진단기준\n- 4. 대사증후군 진단기준\n- 5. 당뇨병 선별검사\n- 6. 당뇨병 예방']",1.0,0.9388171853880211,0.9999999999666667,1.0
"What considerations should be made for patients with type 2 diabetes regarding metabolic syndrome assessment during their first visit, and how does the duration of diabetes influence the need for insulin therapy?","2형당뇨병 환자의 첫 방문 시 대사증후군 평가에 대한 고려사항은 다음과 같습니다. 신체계측과 혈액검사를 통해 대사증후군을 평가하는 것이 권장되며, 이 때 다음 기준 중 3개 이상에 해당될 때 대사증후군으로 진단할 것을 고려해야 합니다: 복부비만, 고중성지방혈증, 낮은 HDL 콜레스테롤, 고혈압, 고혈당입니다[1].

당뇨병 유병기간이 경과함에 따라, 경구혈당강하제만으로 조절되던 2형당뇨병 환자도 인슐린 사용이 필요할 수 있습니다. 특히, 당뇨병 유병기간이 15년 이상인 환자의 경우 50%에서 인슐린 치료가 필요하게 되는 연구 결과가 있습니다. 또한, 생활습관 교정과 충분한 경구혈당하제 투여에도 불구하고 혈당조절 목표에 도달하지 못할 경우 인슐린 요법이 권장됩니다[3].","During the first visit of patients with type 2 diabetes, it is recommended to consider the assessment of metabolic syndrome through physical measurements and blood tests. Specifically, a diagnosis of metabolic syndrome should be considered if three or more of the following criteria are met: abdominal obesity (waist circumference ≥ 90 cm for men and ≥ 85 cm for women), high triglycerides (≥ 150 mg/dL or on medication for dyslipidemia), low HDL cholesterol (men < 40 mg/dL, women < 50 mg/dL or on medication for dyslipidemia), high blood pressure (≥ 130/85 mmHg or on antihypertensive medication), and high blood glucose (fasting plasma glucose ≥ 100 mg/dL or on diabetes medication). Furthermore, as the duration of diabetes progresses, patients who were previously managed with oral hypoglycemic agents may require insulin therapy. Research indicates that after 15 years of diabetes, 50% of patients may need insulin due to persistent insulin resistance and decreased insulin secretion from pancreatic beta cells, especially if they have not achieved blood glucose control despite lifestyle modifications and adequate oral medication.","['| 권고 내용 | 권고등급 | 근거수준 | 권고도출 자료원 |\n| --- | --- | --- | --- |\n| · 2형당뇨병 환자의 첫 방문 시에 신체계측과 혈액검사로 대사 증후군 평가를 고려한다. | II a | B | 17-19 |\n| · 아래 기준 중 3개 이상에 해당될 때 대사증후군으로 진단할 것을 고려한다. ① 복부비만(허리둘레 남자 ≥ 90 cm, 여자 ≥ 85cm)a) ② 고중성지방혈증(중성지방 ≥ 150 mg/dL 또는 이상지질혈증약 복용) ③ 낮은 HDL 콜레스테롤(남자 < 40 mg/dL, 여자 < 50 mg/dL 또는 이상지질혈증약 복용) ④ 고혈압(혈압 ≥ 130/85 mmHg 또는 고혈압약 복용) ⑤ 고혈당(공복혈장포도당 ≥ 100 mg/dL 또는 당뇨병약 복용) | II a | A | 20-24 |', '- 17. UK Prospective Diabetes Study (UKPDS) Group. Intensive blood-glucose control with\n- sulphonylureas or insulin compared with conventional treatment and risk of complications\n- in patients with type 2 diabetes (UKPDS 33). Lancet 1998;352:837-853.\n- 18. Zoungas S, Chalmers J, Ninomiya T, et al. Advance Collaborative Group. Association of\n- HbA1c levels with vascular complications and death in patients with type 2 diabetes:\n- evidence of glycaemic thresholds. Diabetologia 2012;55:636-643.\n- 19. Ajjan RA, Jackson N, Thomson SA, et al. Reduction in HbA1c using professional flash\n- glucose monitoring in insulin-treated type 2 diabetes patients managed in primary and\n- secondary care settings: a pilot, multicentre, randomised controlled trial. Diab Vasc Dis\n- 2019;16(4):385-395.\n- 20. Beck RW, Riddlesworth TD, Ruedy K, et al. Continuous glucose monitoring versus usual\n- care in patients with type 2 diabetes receiving multiple daily insulin injections: a\n- randomized trial. Ann Intern Med 2017;167:365-374.\n- 21. Nathan DM, Genuth S, Lachin J, et al. Diabetes Control and Complications Trial Research\n- Group. The effect of intensive treatment of diabetes on the development and\n- progression of long-term complications in insulin-dependent diabetes mellitus. N Engl J\n- Med 1993;329:977-986.\n- 22. Haak T, Hanaire H, Ajjan R, et al. Flash glucose-sensing technology as a replacement\n- for blood glucose monitoring for the management of insulin-treated type 2 diabetes: a\n- multicenter, open-label randomized controlled trial. Diabetes Ther 2017;8:55-73.\n- 23. Ida S, Kaneko R, Murata K, et al. Utility of real-time and retrospective continuous glucose\n- monitoring in patients with type 2 diabetes mellitus: a meta-analysis of randomized\n- controlled trials. J Diabetes Res 2019;2019:4684815.\n- 24. Mannucci E, Antenore A, Giorgino F, et al. Effects of structured versus unstructured\n- self-monitoring of blood glucose on glucose control in patients with non-insulin-treated\n- type 2 diabetes: a meta-analysis of randomized controlled trials. J Diabetes Sci Technol\n- 2018;12(1):183-189.\n- 25. Xu Y, Tan DHY, Lee JYC, et al. Evaluating the impact of self-monitoring of blood\n- glucose frequencies on glucose control in patients with type 2 diabetes who do not use\n- insulin: a systematic review and meta-analysis. Int J Clin Pract 2019;73(7):e13357.\n- 26. Yaron M, Roitman E, Aharon-Hananel G, et al. Effect of flash glucose monitoring\n- technology on glycemic control and treatment satisfaction in patients with type 2\n- diabetes. Diabetes Care 2019;42(7):1178-1184.\n- 27. Young LA, Buse JB, Weaver MA, et al. Glucose self-monitoring in non-insulin-treated\n- patients with type 2 diabetes in primary care settings: a randomized trial. JAMA Intern\n- Med 2017;177(7):920-929.', '- c) 당뇨병 유병기간이 경과함에 따라 경구혈당강하제만으로 조절되던 2형당뇨병 환자도 인슐린 사용이 필요할 수\n- 있다. 당뇨병 유병기간과 인슐린 사용 연구에서 지속되는 인슐린저항성과 췌도 베타세포의 인슐린 분비능\n- 저하가 계속되어 이환기간이 15년 이상인 환자의 50%에서는 인슐린 치료가 필요하게 된다. 생활습관교정과\n- 충분한 경구혈당하제 투여에도 불구하고 혈당조절 목표에 도달하지 못한 경우 인슐린요법을 권고한다. 심각한', '- 1. 대한당뇨병학회. 2021 당뇨병 진료지침. 2021.\n- 2. American Diabetes Association. Standards of Medical Care in Diabetes-2021. Diabetes\n- Care 2021;44(suppl 1):S1-S232.\n- 3. Diabetes Canada. Diabetes Canada 2018 clinical practice guidelines for the prevention and\n- management of diabetes in Canada. Can J Diabetes 2018;42:S1-S352.\n- 4. Stevens RJ, Kothari V, Adler AI, et al. United Kingdom Prospective Diabetes Study\n- (UKPDS) Group. The UKPDS risk engine: a model for the risk of coronary heart disease in\n- Type II diabetes (UKPDS 56). Clin Sci (Lond) 2001;101:671-679.\n- 5. Lawlor DA, Smith GD, Ebrahim S. Does the new International Diabetes Federation\n- definition of the metabolic syndrome predict CHD any more strongly than older\n- definitions? Findings from the British Womens Heart and Health Study. Diabetologia\n- 2006;49:41-48.\n- 6. Ryden L, Standl E, Bartnik M, et al. Task Force on Diabetes and Cardiovascular Diseases\n- of the European Society of Cardiology (ESC); European Association for the Study of\n- Diabetes (EASD): Guidelines on diabetes, pre-diabetes, and cardiovascular diseases:\n- executive summary. The Task Force on Diabetes and Cardiovascular Diseases of the\n- European Society of Cardiology (ESC) and of the European Association for the Study of\n- Diabetes (EASD). Eur Heart J 2007;28:88-136.\n- 7. Scognamiglio R, Negut C, Ramondo A, et al. Detection of coronary artery disease in\n- asymptomatic patients with type 2 diabetes mellitus. J Am Coll Cardiol 2006;47:65-71.\n- 8. Cushman WC, Evans GW, Byington RP, et al. ACCORD Study Group. Effects of intensive\n- blood-pressure control in type 2 diabetes mellitus. N Engl J Med 2010;362:1575-1585.\n- 9. Shah BR, Bhattacharyya O, Yu C, et al. Evaluation of a toolkit to improve cardiovascular\n- disease screening and treatment for people with type 2 diabetes: protocol for a\n- cluster-randomized pragmatic trial. Trials 2010;11:44.\n- 10. Hansen LJ, Siersma V, Beck-Nielsen H, et al. Structured personal care of type 2\n- diabetes: A 19 year follow-up of the study Diabetes Care in General Practice (DCGP).\n- Diabetologia 2013;56(6):1243-1253.\n- 11. Noble D, Mathur R, Dent T, et al. Risk models and scores for type 2 diabetes:\n- systematic review. BMJ (Online) 2011;343(7836):1243.\n- 12. Chung TN, Andy HL, Colin WB. Components and validity of risk scores for screening for\n- Type 2 diabetes mellitus. Diabetes Management 2012;2(5):419-425.\n- 13. Seidu S, Achana FA, Gray LJ, et al. Effects of glucose-lowering and multifactorial\n- interventions on cardiovascular and mortality outcomes: a meta-analysis of randomized\n- control trials. Diabet Med 2015;33:280-289.\n- 14. Zinman B, Wanner C, Lachin JM, et al. Empagliflozin, cardiovascular outcomes, and\n- mortality in type 2 diabetes. N Engl J Med 2015;373(22):2117-2128.\n- 15. Monami M, Dicembrini 1, Mannucci E. Effects of SGLT-2 inhibitors on mortality and']","['<1-hop>\n\n| 권고 내용 | 권고등급 | 근거수준 | 권고도출 자료원 |\n| --- | --- | --- | --- |\n| · 2형당뇨병 환자의 첫 방문 시에 신체계측과 혈액검사로 대사 증후군 평가를 고려한다. | II a | B | 17-19 |\n| · 아래 기준 중 3개 이상에 해당될 때 대사증후군으로 진단할 것을 고려한다. ① 복부비만(허리둘레 남자 ≥ 90 cm, 여자 ≥ 85cm)a) ② 고중성지방혈증(중성지방 ≥ 150 mg/dL 또는 이상지질혈증약 복용) ③ 낮은 HDL 콜레스테롤(남자 < 40 mg/dL, 여자 < 50 mg/dL 또는 이상지질혈증약 복용) ④ 고혈압(혈압 ≥ 130/85 mmHg 또는 고혈압약 복용) ⑤ 고혈당(공복혈장포도당 ≥ 100 mg/dL 또는 당뇨병약 복용) | II a | A | 20-24 |', '<2-hop>\n\n- c) 당뇨병 유병기간이 경과함에 따라 경구혈당강하제만으로 조절되던 2형당뇨병 환자도 인슐린 사용이 필요할 수\n- 있다. 당뇨병 유병기간과 인슐린 사용 연구에서 지속되는 인슐린저항성과 췌도 베타세포의 인슐린 분비능\n- 저하가 계속되어 이환기간이 15년 이상인 환자의 50%에서는 인슐린 치료가 필요하게 된다. 생활습관교정과\n- 충분한 경구혈당하제 투여에도 불구하고 혈당조절 목표에 도달하지 못한 경우 인슐린요법을 권고한다. 심각한']",1.0,0.9003220998976071,0.999999999975,1.0
2형당뇨병은 뭐에요?,"2형당뇨병은 인슐린저항성과 인슐린의 분비량 부족으로 초래되는 질환입니다. 이 병인은 모든 당뇨병 환자에게 존재하지만, 인슐린저항성이 주로 우세한 경우(예: 비만증 동반)와 인슐린 분비결핍이 우세한 경우(예: 저체중)로 나누어질 수 있습니다. 치료를 위해서는 대사 이상을 함께 고려하면서 관리해야 합니다.","2형당뇨병은 인슐린저항성과 인슐린의 분비량 부족으로 초래되는 질환입니다. 이 두 가지 병인은 모든 당뇨병 환자들에게서 반드시 존재하며, 인슐린저항성이 더 우세한 경우와 인슐린 분비결핍이 더 우세한 경우로 나누어질 수 있습니다.","['- b) 2형당뇨병은 인슐린저항성(인슐린의 작용 감소)과 인슐린의 분비량 부족으로 초래되는 질환이다. 이 두 가지\n- 병인은 모든 당뇨병 환자들에게서 반드시 존재한다. 하지만 인슐린저항성이 좀 더 우세한 경우(예를 들면\n- 비만증 동반)와 인슐린 분비결핍(예를 들면 저체중인 경우)이 더 우세한 경우로 나누어지기도 한다.1 복잡한\n- 병인을 고려하면 모든 환자들에게서 인슐린저항성과 인슐린분비능을 같이 고려하면서 치료해야 장기적인 혈당\n- 관리가 가능하다.', '- a) 2형당뇨병 환자들은 당뇨병의 발병시기가 모호하며, 진단 당시부터 신증을 동반할 수 있으며, 한 연구에 의하면\n- 진단 당시부터 7-8%의 환자에서 미량알부민뇨(microalbuminuria)나 다량알부민뇨가 동반되며, 고혈압 및\n- 심혈관질환을 가지고 있는 경우도 흔하고, 신증의 동반 시 심혈관질환의 위험도가 2-3배 증가하게 된다. 메\n- 타분석에서 2형당뇨병 환자에서 미량알부민뇨를 포함한 알부민뇨의 연간 발생률은 약 8%이며, 추정 사구체\n- 여과율이 60 mL/min/1.73 m2 미만으로 감소하는 만성콩팥병의 연간 발생률이 약 2-4%로 보고되었다.\n- 따라서, 조기진단 및 치료를 위하여 처음 병원을 방문했을 때부터 당뇨병신장질환의 선별을 위해 처음 병원을\n- 방문했을 때부터 매년 요알부민배설량과 추정 사구체 여과율 검사를 시행해야 한다. 1', '- a) 모든 새롭게 진단된 제2형 소아청소년 당뇨병 환자에서는 생활습관조절, 당뇨병의 자가 조절 교육 및 약물\n- 치료를 모두 고려해야 한다. 치료 초기에는 당뇨병의 임상양상이 1형인지 2형인지 불분명할 수 있어서, 치료를\n- 시작할 때에는 고혈당 정도뿐 만 아니라 대사 이상의 정도에 따라 추후의 치료방침을 결정해야 한다.1', '- a) 선별검사의 목적은 어떤 질병을 가지고 있을 가능성이 높은 대상을 찾아내는 것으로 당뇨병은 선별검사와\n- 진단검사가 동일하다.\n- 2형당뇨병은 진단 시점 이전 상당 기간 동안 대사 이상들이 진행되어 진단 시 합병증이 동반되는 경우가 많아\n- 적극적인 선별검사가 필요하며, 특히 고위험군에서는 더욱 철저하게 시행되어야 한다. 한국인에 적절한 2형\n- 당뇨병의 위험인자는 권고요약본에 정리되어 있다.\n- b) 대한당뇨병학회에서는 공복혈당장애 혹은 당화혈색소에 따라 두 단계로 나누어 추가 검사를 시행하도록 하고\n- 있다. 즉 [1단계] 공복혈당 100-109 mg/dL, 당화혈색소 5.7-6.0%인 경우 매년 공복혈당 및 당화혈색소\n- 측정을 하고, [2단계] 공복혈당 110-125 mg/dL, 당화혈색소 6.1-6.4%인 경우 경구당부하검사를 시행하도록\n- 권고하고 있다.1\n- 2009년 국제전문가위원회에서는 당화혈색소가 장기적인 혈당 상태를 보다 정확히 반영하고, 당뇨병합병증의\n- 위험도와 좋은 상관관계를 보이며, 혈당 측정보다 안정적이라는 이유로 NGSP (National Glycohemoglobin\n- Standardization Program)에 의해 인증되고 DCCT (Diabetes Control and Complication Trial) assay에\n- 표준화된 방법을 사용했을 경우 당화혈색소 6.5% 이상을 당뇨병의 새로운 진단기준으로 포함시킬 것을 권고\n- 하였다.2 이 진단기준은 2010년 미국당뇨병학회의 진료지침에 반영되었고, 대한당뇨병학회는 2011년 진료지침\n- 에서 진단기준에 포함시켰다.']",['- b) 2형당뇨병은 인슐린저항성(인슐린의 작용 감소)과 인슐린의 분비량 부족으로 초래되는 질환이다. 이 두 가지\n- 병인은 모든 당뇨병 환자들에게서 반드시 존재한다. 하지만 인슐린저항성이 좀 더 우세한 경우(예를 들면\n- 비만증 동반)와 인슐린 분비결핍(예를 들면 저체중인 경우)이 더 우세한 경우로 나누어지기도 한다.1 복잡한\n- 병인을 고려하면 모든 환자들에게서 인슐린저항성과 인슐린분비능을 같이 고려하면서 치료해야 장기적인 혈당\n- 관리가 가능하다.'],1.0,0.7257107467474206,0.7499999999625,1.0
"What are the recommended lifestyle modifications for elderly diabetes patients, and how do these relate to the management of their overall health conditions?","노인당뇨병 환자에게 권장되는 생활습관 개선은 건강수준에 적합한 영양요법 및 운동 요법을 포함합니다. 이러한 개선은 노인 환자의 기능 상태, 인지기능, 동반질환 등을 고려하여 개별화되어야 합니다. 또한 혈당 목표는 건강한 성인과 다르지 않지만, 노인의 특성에 맞게 조정되어야 합니다.

따라서, 노인당뇨병 환자의 생활습관 개선은 당뇨병 관리뿐만 아니라 전반적인 건강 상태의 평가와 치료에 중요한 역할을 하며, 노인증후군과 같은 문제를 예방하거나 관리하는 데 기여할 수 있습니다.","For elderly diabetes patients, it is recommended to adopt lifestyle modifications that are appropriate for their health status, including nutritional therapy and exercise. Additionally, it is important to evaluate and consider the overall functionality of elderly patients, taking into account factors such as sensory impairments, malnutrition, sarcopenia, incontinence, mobility issues, cognitive and emotional functions, and polypharmacy. The blood sugar targets for elderly patients should be individualized, reflecting their unique characteristics, while also considering the potential risks of hypoglycemia. Therefore, managing blood sugar levels effectively is crucial, but it should be done in conjunction with a comprehensive assessment of the patient's overall health and functional capabilities.","['| 권고 내용 | 권고 등급 | 근거 수준 | 권고도출 자료원 |\n| --- | --- | --- | --- |\n| · 노인당뇨병 환자에게는 건강수준에 적합한 생활습관교정(영양요법 및 운동 요법)을 권고한다.a) | | | Guideline | 13, 14, 15 |\n| · 노인증후군의 개념에서 시청각 장애, 영양실조 및 근감소, 요실금, 보행 장애, 인지 및 정서기능, 신체기능, 다약제 사용 등 전반적인 기능을 평가하고 치료에 반영하는 것을 고려한다.b) | II a | Guideline | 2 |\n| · 혈당목표는 건강한 성인에서와 다르지 않으나 노인의 특성에 맞게 개별화하는 것을 고려한다.c) | II a | D | 2 |\n| · 작용시간이 긴 약제의 사용을 피하거나 약제의 상호작용 또는 부 작용에 대해 자주 모니터링하는 것을 적극적으로 고려한다. c) | II a | D | 2 |\n| · 심혈관질환의 얻을 수 있는 이득과 환자의 개별상황을 감안해 심 혈관위험인자들에 대한 치료를 고려할 수 있다.d) | llb | Guideline | 2 |', '- 29. Tuomilehto J, Lindstrom J, Eriksson JG, et al. Finnish Diabetes Prevention Study Group.\n- Prevention of type 2 diabetes mellitus by changes in lifestyle among subjects with\n- impaired glucose tolerance. N Engl J Med 2001;3:1343-1350.\n- 30. Pan XR, Li GW, Hu YH, et al. Effects of diet and exercise in preventing NIDDM in\n- people with impaired glucose tolerance. The Da Qing IGT and Diabetes Study Diabetes\n- Care 1997;20:537-544.\n- 31. Kosaka K, Noda M, Kuzuya T. Prevention of type 2 diabetes by lifestyle intervention: a\n- Japanese trial in IGT males. Diabetes Res Clin Pract 2005;67:152-162.\n- 32. Ramachandran A, Snehalatha C, Mary S, et al. Indian Diabetes Prevention Programme\n- (IDPP): The Indian Diabetes Prevention Programme shows that lifestyle modification and\n- metformin prevent type 2 diabetes in Asian Indian subjects with impaired glucose\n- tolerance (IDPP-1). Diabetologia 2006;49:289-297.\n- 33. Ramachandran A, Snehalatha C, Yamuna A, et al. Cost-effectiveness of the interventions\n- in the primary prevention of diabetes among Asian Indians: within-trial results of the\n- Indian Diabetes Prevention Programme (IDPP). Diabetes Care 2007;30:2548-2552.\n- 34. Gerstein HC, Yusuf S, Bosch J, et al. DREAM (Diabetes REduction Assessment with\n- ramipril and rosiglitazone Medication) Trial Investigators. Effect of rosiglitazone on the\n- frequency of diabetes in patients with impaired glucose tolerance or impaired fasting\n- glucose: a randomised controlled trial. Lancet 2006;23:1096-1105.\n- 35. Chiasson JL, Josse RG, Gomis R, et al. STOP-NIDDM Trial Research Group: Acarbose\n- for prevention of type 2 diabetes mellitus: the STOP-NIDDM randomised trial. Lancet\n- 2002;15:2072-2077.\n- 36. Jenum AK, Brekke I, Mdala 1, et al. Effects of dietary and physical activity interventions\n- on the risk of type 2 diabetes in South Asians: meta-analysis of individual participant\n- data from randomised controlled trials. Diabetologia 2019;62(8):1337-1348.\n- 37. Glechner A, Keuchel L, Affengruber L, et al. Effects of lifestyle changes on adults with\n- prediabetes: a systematic review and meta-analysis. Prim Care Diabetes\n- 2018;12(5):393-408.\n- 38. Nah EH, Chu J, Kim S, et al. Efficacy of lifestyle interventions in the reversion to\n- normoglycemia in Korean prediabetics: one-year results from a randomised controlled\n- trial. Primary care diabetes 2019;13(3):212-220.\n- 39. Sathish T, Oldenburg B, Lotfalian M, et al. Effectiveness of lifestyle intervention in\n- prevention of type 2 diabetes in India: a cluster randomised controlled trial of the Kerala\n- diabetes prevention program. Diabetes 2017;66:A458.\n- 40. Cha SA, Lim SY, Kim KR, et al. Community-based randomized controlled trial of diabetes\n- prevention study for high-risk individuals of type 2 diabetes: lifestyle intervention using\n- web-based system. BMC public health 2017;17(1):387.', '- a) 노인당뇨병 환자의 생활습관 관리 및 교육은 환자의 기능 상태, 인지기능, 치아, 소화기능, 합병증, 동반질환\n- 등 환자의 건강 상태와 환경적 요소들을 고려하여 개별화되어야 한다. 1,2,3', '- 1. 대한당뇨병학회. 2015 당뇨병 진료지침. 2015.\n- 2. 대한당뇨병학회. 2021 당뇨병 진료지침. 2021.\n- 3. American Diabetes Association. Standards of Medical Care in Diabetes-2021. Diabetes\n- Care 2021;44(suppl 1):S1-S232.\n- 4. Diabetes Canada. Diabetes Canada 2018 clinical practice guidelines for the prevention\n- and management of diabetes in Canada. Can J Diabetes 2018;42:S1-S352.\n- 5. AACE/ACE. American Association of Clinical Endocrinologists and American College of\n- Endocrinology-clinical practice guidelines for developing a diabetes mellitus\n- comprehensive care plan 2015. Endocrine Practice 2015;21(1):1-87.\n- 6. National Kidney Foundation. KDOQI clinical practice guideline for diabetes and CKD:2012\n- update. Am J Kidney Dis 2012;60(5):850-886.\n- 7. American Diabetes Association. Standards of Medical Care in Diabetes-cardiovascular\n- disease and risk management. Diabetes Care 2017;40(1):S75-S87.\n- 8. Patrick McGowan. The efficacy of diabetes patient education and self-management\n- education in type 2 diabetes. Canadian Journal of Diabetes 2011;35(1):46-53.\n- 9. Koutoukidis DA, Astbury NM, Tudor KE, et al. Association of weight loss interventions\n- with changes in biomarkers of nonalcoholic fatty liver disease: a systematic review and\n- meta-analysis. JAMA Intern Med 2019;179:1262-1271.\n- 10. Franz MJ, Boucher JL, Rutten-Ramos S, et al. Lifestyle weight-loss intervention\n- outcomes in overweight and obese adults with type 2 diabetes: a systematic review and\n- meta-analysis of randomized clinical trials. J Acad Nutr Diet 2015;115:1447-1463.\n- 11. Cannon CP, Blazing MA, Giugliano RP, et al. Ezetimibe added to statin therapy after\n- acute coronary syndromes. N ENGL J MED 2015;372(25):2387-2397.\n- 12. Avery L, Flynn D, van Wersch A, et al. Changing physical activity behavior in type 2\n- diabetes: a systematic review and meta-analysis of behavioral interventions. Diabetes\n- Care 2012;35(12):2681-2689.\n- 13. Holman RR, Paul SK, Bethel MA, et al. 10-year follow-up of intensive glucose control in\n- type 2 diabetes. N Engl J Med 2008;359:1577-1589.\n- 14. Nathan DM, Cleary PA, Backlund JY, et al. Diabetes Control and Complications\n- Trial/Epidemiology of Diabetes Interventions and Complications (DCCT/EDIC) Study\n- Research Group. Intensive diabetes treatment and cardiovascular disease in patients with\n- type 1 diabetes. N Engl J Med 2005;353:2643-2653.\n- 15. Ohkubo Y, Kishikawa H, Araki E, et al. Intensive insulin herapy prevents the progression\n- of diabetic microvascular complications in Japanese patients with non-insulin-dependent\n- diabetes mellitus: a randomized prospective 6-year study. Diabetes Res Clin Pract 1995;\n- 28(2):103-117.\n- 16. Skyler JS, Bergenstal R, Bonow RO, et al. American Diabetes Association; American\n- College of Cardiology Foundation; American Heart Association. Intensive glycemic control']","['<1-hop>\n\n| 이익 및 불이익† |\n| --- |\n| · 이 익 - 개별화된 혈당 목표 달성 - 개별화된 합병증 관리 - 삶의 질 개선 · 불이익 - 없음 · 노인당뇨병 환자에서도 일반 환자와 마찬가지로 혈당조절이 불량할 경우, 합병증이 발생할 가능성이 높으므로, 혈당조절이 매우 중요하다. 그러나 노인당뇨병 환자에서는 당뇨병과 연관된 동반질환(고혈압, 관상동맥질환, 뇌졸중 등) 및 노인증후군(다약제 복용, 우울, 인지장애, 요실금, 낙상, 통증 등)과 관련된 여러 기능장애가 빈번히 동반되며, 저혈당의 발생 위험이 높기 때문에 이러한 특성에 따라 기대여명이 매우 다양할 수 있으며, 치료방법이나 치료효과가 달라질 수 있다. 따라서 노인당뇨병 환자는 혈당 이외에 전반적인 기능을 평가하고 치료에 반영하는 것을 고려할 수 있다. 이를 고려하면, 혈당조절을 양호하게 하는 것에 대해서는 저혈당의 잠재적 위해 이외에 특별한 위해는 없다. 1,2,3 |', '<2-hop>\n\n| 권고 내용 | 권고 등급 | 근거 수준 | 권고도출 자료원 |\n| --- | --- | --- | --- |\n| · 노인당뇨병 환자에게는 건강수준에 적합한 생활습관교정(영양요법 및 운동 요법)을 권고한다.a) | | | Guideline | 13, 14, 15 |\n| · 노인증후군의 개념에서 시청각 장애, 영양실조 및 근감소, 요실금, 보행 장애, 인지 및 정서기능, 신체기능, 다약제 사용 등 전반적인 기능을 평가하고 치료에 반영하는 것을 고려한다.b) | II a | Guideline | 2 |\n| · 혈당목표는 건강한 성인에서와 다르지 않으나 노인의 특성에 맞게 개별화하는 것을 고려한다.c) | II a | D | 2 |\n| · 작용시간이 긴 약제의 사용을 피하거나 약제의 상호작용 또는 부 작용에 대해 자주 모니터링하는 것을 적극적으로 고려한다. c) | II a | D | 2 |\n| · 심혈관질환의 얻을 수 있는 이득과 환자의 개별상황을 감안해 심 혈관위험인자들에 대한 치료를 고려할 수 있다.d) | llb | Guideline | 2 |']",0.6,0.9456919608891668,0.9999999999666667,1.0
What are the recommended screening methods for diabetic autonomic neuropathy and how do they aim to improve patient quality of life?,"당뇨병 자율 신경병증의 권장되는 선별 검사 방법에는 다음이 포함됩니다: 당뇨병 신경병증 설문지(Michigan Neuropathy Screening Instrument Questionnaire, MNSIQ), 10 g 모노필라멘트 검사, 온도 및 진동 감각 검사(128-Hz tuning fork), 발목 반사 검사 및 핀찌르기 검사 등이 있습니다. 이들 검사를 통해 원위부 대칭형 다발성 신경병증에 대한 민감도를 87% 이상으로 높일 수 있습니다. 

이러한 검사들은 환자의 전형적인 증상 및 징후와 함께 신경학적인 검사를 통해 진단을 수립합니다. 이러한 선별 방법들은 조기에 문제를 발견하고 적절한 관리를 통해 환자의 삶의 질을 향상시킬 수 있는 중요한 역할을 하며, 당뇨병으로 인한 합병증 예방에 기여합니다.","The recommended screening methods for diabetic autonomic neuropathy include conducting a screening test at the time of diabetes diagnosis and annually thereafter. The Michigan Neuropathy Screening Instrument Questionnaire (MNSIQ) and neurological physical examinations, such as the 10 g monofilament test, vibration sensation test, ankle reflex test (MNSIE), pinprick test, and temperature sensation test, are considered for neuropathy screening. Additionally, if the clinical presentation of diabetic neuropathy is atypical or requires differential diagnosis, electrophysiological testing methods may be considered. The primary goal of these screenings and evaluations is to assess symptoms and signs of diabetic autonomic neuropathy at the time of diagnosis and annually thereafter, ultimately aiming to enhance the patient's quality of life and alleviate symptoms through various categories of pharmacological treatments.","['- 76. Wong TY, Sun J, Kawasaki R, et al. Guidelines on diabetic eye care: the international\n- council of ophthalmology recommendations for screening, follow-up, referral, and\n- treatment based on resource settings. Ophthalmology 2018;125:1608-1622.\n- 77. Taylor-Phillips S, Mistry H, Leslie R, et al. Extending the diabetic retinopathy screening\n- interval beyond 1 year: systematic review. Br J Ophthalmol 2016;100:105-114.\n- 78. Wright AD, Dodson PM. Medical management of diabetic retinopathy: fenofibrate and\n- ACCORD Eye studies. Eye (Lond) 2011;25:843-849.\n- 79. Keech AC, Mitchell P, Summanen PA, et al. Effect of fenofibrate on the need for laser\n- treatment for diabetic retinopathy (FIELD study): a randomised controlled trial. Lancet\n- 2007;370:1687-1697.\n- 80. Ismail-Beigi F, Craven T, Banerji MA, et al. ACCORD Trial Group. Effect of intensive\n- treatment of hyperglycaemia on microvascular outcomes in type 2 diabetes: an analysis\n- of the ACCORD randomised trial. Lancet 2010;376:419-430.\n- 81. Boulton AJ, Vinik AI, Arezzo JC, et al. American Diabetes Association. Diabetic\n- neuropathies: a statement by the American Diabetes Association. Diabetes Care 2005;28:\n- 956-962.\n- 82. Vinik AI, Maser RE, Mitchell BD, et al. Diabetic autonomic neuropathy. Diabetes Care\n- 2003;26:1553-1579.\n- 83. Spallone V, Bellavere F, Scionti L, et al. Diabetic Neuropathy Study Group of the Italian\n- Society of Diabetology. Recommendations for the use of cardiovascular tests in\n- diagnosing diabetic autonomic neuropathy. Nutr Metab Cardiovasc Dis 2011;21:69-78.\n- 84. Bril V, England J, Franklin GM, et al. American Academy of Neurology; American\n- Association of Neuromuscular and Electrodiagnostic Medicine; American Academy of\n- Physical Medicine and Rehabilitation. Evidence-based guideline: treatment of painful\n- diabetic neuropathy: report of the American Academy of Neurology, the American\n- Association of Neuromuscular and Electrodiagnostic Medicine, and the American Academy\n- of Physical Medicine and Rehabilitation. Neurology 2011;76:1758-1765.\n- 85. CW Lee. Diagnosis and Management of Diabetic Foot. J Korean Diabetes 2018;19:\n- 168-174\n- 86. Boulton AJM, Armstrong DG, Albert SF, et al. American Diabetes Association; American\n- Association of Clinical Endocrinologists. Comprehensive foot examination and risk\n- assessment: a report of the task force of the foot care interest group of the American\n- Diabetes Association, with endorsement by the American Association of Clinical\n- Endocrinologists. Diabetes Care 2008;31:1679-1685.\n- 87. Ziegler D, Papanas N, Schnell O, et al. Current concepts in the management of diabetic\n- polyneuropathy. J Diabetes Investig 2021;12:464-475.\n- 88. Pop-Busui R, Boulton AJM, Feldman EL, et al. Diabetic neuropathy: a position statement\n- by the American Diabetes Association. Diabetes Care 2017;40:136-154.\n- 89. Callaghan BC, Little AA, Feldman EL, et al. Enhanced glucose control for preventing and', '- 7. Boulton AJM, Vinik AI, Arezzo JC, et al. Diabetic neuropathies: a statement by the\n- American Diabetes Association. Diabetes Care 2005;28:956-962.\n- 8. Vinik AI, Maser RE, Mitchell BD, et al. Diabetic autonomic neuropathy. Diabetes Care\n- 2003;26:1553-1579.\n- 9. Vinik AI, Ziegler D. Diabetic cardiovascular autonomic neuropathy. Circulation 2007;115:\n- 387-397.\n- 10. Rodica PB. Cardiac autonomic neuropathy in diabetes. Diabetes Care 2010;33:434-441.\n- 11. Albers JW, Herman WH, Pop-Busui R, et al. Diabetes control and complications trial\n- /epidemiology of diabetes interventions and complications research group. Effect of prior\n- intensive insulin treatment during the Diabetes Control and Complications Trial (DCCT) on\n- peripheral neuropathy in type 1 diabetes during the Epidemiology of Diabetes\n- Interventions and Complications (EDIC) study. Diabetes Care 2010;33:1090-1096.\n- 12. Callaghan BC, Little AA, FeldmanEL, et al. Enhanced glucose control for preventing and\n- treating diabetic neuropathy. Cochrane Database Syst Rev 2012;6:CD007543.\n- 13. Pop-Busui R, Lu J, Brooks MM, et al. BARI 2D Study Group. Impact of glycemic control\n- strategies on the progression of diabetic peripheral neuropathy in the Bypass Angioplasty\n- Revascularization Investigation 2 Diabetes (BARI 2D) cohort. Diabetes Care 2013;36:3208-\n- 3215.\n- 14. Vinik AI, Mehrabyan A. Diabetic neuropathies. Med Clin Notrh AM 2004;88:947-999.', '당뇨병 환자들은 1년에 한 번씩 당뇨병신경병증 설문(Michigan Neuropathy Screening Instrument\nQuestionnaire, MNSIQ)와 신경학적 신체검사인 10 g 모노필라멘트 검사, 온도/진동감각 검사(128-Hz\ntuning fork), 발목반사검사, 핀찌르기검사 등으로 원위부 대칭형 다발성신경병증에 대한 선별검사를 시행한다. 1-4\n2개 이상의 검사를 시행하면 원위부 대칭형 다발성신경병증에 대한 진단적인 민감도를 87% 이상 높일 수\n있다.6.8 당뇨병말초신경병증 진단은 환자의 전형적인 증상과 징후와 신경학적인 검사를 시행하여 진단할 수\n있다(그림 1).', '- 1. Wong TY, Sun J, Kawasaki R, et al. Guidelines on diabetic eye care: the international\n- council of ophthalmology recommendations for screening, follow-up, referral, and treatment\n- based on resource settings. Ophthalmology 2018;125:1608-1622.\n- 2. Taylor-Phillips S, Mistry H, Leslie R, et al. Extending the diabetic retinopathy screening\n- interval beyond 1 year: systematic review. Br J Ophthalmol 2016;100:105-114.\n- 3. UK Prospective Diabetes Study Group. Intensive blood-glucose control with sulphonylureas\n- or insulin compared with conventional treatment and risk of complications in patients with\n- type 2 diabetes (UKPDS 33). Lancet 1998;352:837-853.\n- 4. UK Prospective Diabetes Study Group. Effect of intensive blood-glucose control with\n- metformin on complications in overweight patients with type 2 diabetes (UKPDS 34).\n- Lancet 1998;352:854-865.\n- 5. UK Prospective Diabetes Study Group. Tight blood pressure control and risk of macrovascular\n- and microvascular complications in type 2 diabetes (UKPDS 38). BMJ 1998;317:703-713.\n- 6. The Diabetic Retinopathy Study (DRS) Research Group. Preliminary report on the effects\n- of photocoagulation therapy: DRS Report #1. Am J Ophthalmol 1976;81:383-396.\n- 7. Early Treatment Diabetic Retinopathy Study Research Group. Photocoagulation for diabetic\n- macular edema: Early Treatment Diabetic Retinopathy Study Report No. 1. Arch Ophthalmol\n- 1985;103:1796-1806.\n- 8. Early Treatment Diabetic Retinopathy Study Research Group. Treatment techniques and\n- clinical guidelines for photocoagulation of diabetic macular edema: Early Treatment\n- Diabetic Retinopathy Study Report No. 2. Ophthalmology 1987;94:761-774.\n- 9. 대한당뇨병학회. 2021 당뇨병 진료지침. 2021.\n- 10. Ciulla TA, Amador AG, Zinman B: Diabetic retinopathy and diabetic macular edema:\n- pathophysiology, screening, and novel therapies. Diabetes Care 2003;26:2653-2664.\n- 11. Klein R. Hyperglycemia and microvascular and macrovascular disease in diabetes.\n- Diabetes Care 1995;18:258-268.\n- 12. Estacio RO, McFarling E, Biggerstaff S, et al. Overt albuminuria predicts diabetic\n- retinopathy in Hispanics with NIDDM. Am J Kidney Dis 1998;31:947-953.\n- 13. Leske MC, Wu SY, Hennis A, et al. Hyperglycemia, blood pressure, and the 9-year\n- incidence of diabetic retinopathy: the Barbados Eye Studies. Ophthalmology 2005;112:799-805.\n- 14. Chew EY, Klein ML, Ferris FL III, et al. Association of elevated serum lipid levels with\n- retinal hard exudate in diabetic retinopathy: Early Treatment of Diabetic Retinopathy Study\n- (ETDRS) Report No 22. Arch Ophthalmol 1996;114:1079-1084.\n- 15. Wright AD, Dodson PM. Medical management of diabetic retinopathy: fenofibrate and\n- ACCORD Eye Studies. Eye (Lond) 2011;25:843-849.']","['<1-hop>\n\n위마비 환자에게서 위장관 운동 개선제를 사용하거나 방광기능 장애나 발기부전을 동반한 경우 관련 치료제를\n사용하는 등 자율신경병증의 증상을 호전시키기 위하여 다양한 약제들을 사용할 수 있다.2.3.14 당뇨병자율신경\n병증에서 각종 약제의 사용은 환자 자신의 증상과 삶의 질을 향상시키기 위한 것에 가장 큰 목적을 두고 있다.', '<2-hop>\n\n| 권고 내용 | 권고등급 | 근거수준 | 권고도출 자료원 |\n| --- | --- | --- | --- |\n| · 당뇨병말초신경병증에 대한 선별검사는 당뇨병 진단 당시에 시행 하고 그 이후 매년 선별검사 시행한다. a),1) | | | B | 1, 2, 80, 81 |\n| · 신경병증의 선별검사로 당뇨병신경병증 설문(Michigan Neuropathy Screening Instrument Questionnaire, MNSIQ)과 신경학적 신체검사(10 g 모노필라멘트검사, 진동감각검사, 발목반사검사 (Michigan Neuropathy Screening Instrument Examination, MNSIE), 핀찌르기검사, 온도감각검사)를 고려한다. b),1) | II a | B | 1, 2, 80, 81 |\n| · 당뇨병신경병증의 임상양상이 비전형적이거나 감별진단이 필요한 경우 전기생리학적 검사방법을 고려할 수 있다. c),1) | llb | D | 1, 2 81 |\n| · 당뇨병자율신경병증에 대한 증상과 징후를 당뇨병 진단 당시, 그리고 이후에는 매년 평가할 것을 고려한다. d),2) | II a | B | 1, 2, 82, 83, 88 |\n| · 당뇨병신경병증의 발생 및 진행을 지연시키기 위하여 철저한 혈당 조절을 권고한다. e),3) | | | B | 89, 90 |\n| · 당뇨병신경병증의 증상을 경감시키고, 환자의 삶의 질을 향상시키기 위해서 다양한 범주의 약물치료를 고려한다. f),4) | II a | B | 1, 2, 81, 84, 87 |\n| · 매년 궤양과 절단의 위험요인을 확인하기 위해 포괄적인 발 평가를 하고, 발관리 교육을 권고한다. | | | D | 85, 86 |']",0.6,0.9695975931359023,0.8333333332916666,0.5
당뇨병합병증의 이익과 불이익에 대해 설명해 주세요.,"당뇨병 합병증에 대한 이익과 불이익은 다음과 같습니다.

### 이익
- 혈당 조절 목표 도달
- 삶의 질 향상
- 당뇨병 합병증 예방
- 당뇨병 합병증에 의한 사망률 감소
- 당뇨병 관리 비용 감소

### 불이익
- 약물 치료에 따른 부작용 가능성 (예: 저혈당)
- 특별한 위험은 없음

또한, 진단 시부터 적극적인 생활습관 교정과 개별화된 약물 치료로 목표 혈당에 도달하면 장기적으로 당뇨병 합병증을 예방할 수 있으며, 이러한 이익이 발생 가능한 불이익보다 매우 클 것으로 판단되고 있습니다.","당뇨병합병증의 이익으로는 합병증 예방, 합병증에 의한 사망률 감소, 그리고 당뇨병 관리 비용 감소가 있습니다. 불이익은 없으며, 당뇨병은 진단 후 질병 경과가 지속적으로 악화되기 때문에 당뇨병 전단계부터 관리가 필요하고, 당뇨병 단계로 진행한 경우에는 더욱더 적극적인 관리가 필요합니다. 다학제 임상진료지침 개발위원회에서는 이익과 불이익 연계 근거를 검토한 결과, 권고 관련 얻을 수 있는 이익이 크고 발생 가능한 불이익이 거의 없을 것으로 판단하였습니다.","['| 이익 및 불이익† |\n| --- |\n| · 이 익 - 혈당조절 목표 도달 - 삶의 질 향상 - 당뇨병합병증 예방 · 불이익 - 약물치료 부작용 가능성 · 진단 시부터 적극적인 생활습관교정과 개별화된 약물치료로 목표혈당에 도달하면 장기적으로 당뇨병 합병증을 예방할 수 있음이 여러 임상연구에서 밝혀졌다. 더불어 삶의 질도 향상시킬 수 있다. 저혈당 등 약물치료에 따른 잠재적인 부작용 이외에 특별한 위해는 없다. |\n| 十 다학제 임상진료지침 개발위원회에서는 이익과 불이익 연계 근거를 검토하고 전문가 의견을 취합하여 논의한 결과, 권고 관련 얻을 수 있는 이익이 발생 가능한 불이익보다 매우 클 것으로 판단함. |', '| 이익 및 불이익† |\n| --- |\n| · 이 익 - 당뇨병 발생률 감소 - 동반 성인질환 감소 - 의료비용 감소 · 불이익 - 없음 · 당뇨병은 그 자체로 많은 합병증을 유발할 수 있으며 다른 퇴행성질환과 동반하여 더욱 심각한 질병 상태로 이환되기 쉬운 질환이다. 당뇨병 발생을 예방하기 위한 노력은 당뇨병뿐 아니라 다른 성인 질환의 발생이나 악화를 예방할 수 있는 방법이다. 1-6 |\n| 十 다학제 임상진료지침 개발위원회에서는 이익과 불이익 연계 근거를 검토하고 전문가 의견을 취합하여 논의한 결과, 권고 관련 얻을 수 있는 이익이 크고 발생 가능한 불이익이 거의 없을 것으로 판단함. |', '| 이익 및 불이익† |\n| --- |\n| · 이 익 - 당뇨병합병증 예방 - 합병증에 의한 사망률 감소 - 당뇨병 관리 비용 감소 · 불이익 - 없음 · 당뇨병은 진단 후 질병 경과가 지속적으로 악화되는 병이기 때문에, 당뇨병전단계부터 관리가 필요 하지만 당뇨병 단계로 진행한 경우 더욱더 적극적인 관리가 필요하다. |\n| 十 다학제 임상진료지침 개발위원회에서는 이익과 불이익 연계 근거를 검토하고 전문가 의견을 취합하여 논의한 결과, 권고 관련 얻을 수 있는 이익이 크고 발생 가능한 불이익이 거의 없을 것으로 판단함. |', '| 이익 및 불이익† |\n| --- |\n| · 이 익 - 심혈관질환과 관련된 위험요소 감소 - 당뇨병합병증 진행 지연 - 간 내 지방축적 감소 및 염증, 섬유화 지연 - 의료비용 감소1 · 불이익 - 지방간질환 악화 |']","['| 이익 및 불이익† |\n| --- |\n| · 이 익 - 당뇨병합병증 예방 - 합병증에 의한 사망률 감소 - 당뇨병 관리 비용 감소 · 불이익 - 없음 · 당뇨병은 진단 후 질병 경과가 지속적으로 악화되는 병이기 때문에, 당뇨병전단계부터 관리가 필요 하지만 당뇨병 단계로 진행한 경우 더욱더 적극적인 관리가 필요하다. |\n| 十 다학제 임상진료지침 개발위원회에서는 이익과 불이익 연계 근거를 검토하고 전문가 의견을 취합하여 논의한 결과, 권고 관련 얻을 수 있는 이익이 크고 발생 가능한 불이익이 거의 없을 것으로 판단함. |']",1.0,0.7525213516580277,0.999999999975,1.0
What are the recommended applications of 당뇨병 선별검사 in the context of prenatal care?,"당뇨병 선별검사의 추천 적용은 임신부에 대한 검사로, 다음과 같은 내용을 포함합니다. 임신 24-28주에 이전에 당뇨병이나 임신당뇨병으로 진단받지 않은 임부는 75 g 경구포도당부하검사를 받아야 하며, 첫 산전 방문 시 당뇨병 여부에 대한 검사(공복혈장포도당, 무작위 혈장포도당 혹은 당화혈색소)도 권고됩니다. 이 검사는 태아와 임산부의 주산기 합병증 예방을 목적으로 하고 있습니다.",The recommended application of 당뇨병 선별검사 is to prevent perinatal complications for both the fetus and the pregnant woman.,"['| 권고 적용군 | 임부 | 진료환경 | 진료실 |\n| --- | --- | --- | --- |\n| 중재/실행지표 | 당뇨병 선별검사 | 당뇨병 선별검사 | 당뇨병 선별검사 |\n| 비교지표 | 당뇨병 선별검사 미시행 | 당뇨병 선별검사 미시행 | 당뇨병 선별검사 미시행 |\n| 결과물 | 태아와 임산부 주산기 합병증 예방 | 태아와 임산부 주산기 합병증 예방 | 태아와 임산부 주산기 합병증 예방 |', '| 진료 시 고려할 점 |\n| --- |\n| · 이전에 당뇨병이나 임신당뇨병으로 진단받지 않은 임신부는 24-28주에 임신당뇨병 선별검사를 받아야 한다. · 임신을 계획 중인 당뇨병 여성은 임신 전부터 적절하게 혈당조절을 해야 하며, 임신 초기부터는 더욱 엄격하게 혈당을 관리해야 한다. · 진료 의뢰: 임신당뇨병 환자 혹은 당뇨병 환자가 임신한 경우, 혈당조절이 적절히 되지 않을 시에는 당뇨병 전문의에게 의뢰 |', '- a) 선별검사의 목적은 어떤 질병을 가지고 있을 가능성이 높은 대상을 찾아내는 것으로 당뇨병은 선별검사와\n- 진단검사가 동일하다.\n- 2형당뇨병은 진단 시점 이전 상당 기간 동안 대사 이상들이 진행되어 진단 시 합병증이 동반되는 경우가 많아\n- 적극적인 선별검사가 필요하며, 특히 고위험군에서는 더욱 철저하게 시행되어야 한다. 한국인에 적절한 2형\n- 당뇨병의 위험인자는 권고요약본에 정리되어 있다.\n- b) 대한당뇨병학회에서는 공복혈당장애 혹은 당화혈색소에 따라 두 단계로 나누어 추가 검사를 시행하도록 하고\n- 있다. 즉 [1단계] 공복혈당 100-109 mg/dL, 당화혈색소 5.7-6.0%인 경우 매년 공복혈당 및 당화혈색소\n- 측정을 하고, [2단계] 공복혈당 110-125 mg/dL, 당화혈색소 6.1-6.4%인 경우 경구당부하검사를 시행하도록\n- 권고하고 있다.1\n- 2009년 국제전문가위원회에서는 당화혈색소가 장기적인 혈당 상태를 보다 정확히 반영하고, 당뇨병합병증의\n- 위험도와 좋은 상관관계를 보이며, 혈당 측정보다 안정적이라는 이유로 NGSP (National Glycohemoglobin\n- Standardization Program)에 의해 인증되고 DCCT (Diabetes Control and Complication Trial) assay에\n- 표준화된 방법을 사용했을 경우 당화혈색소 6.5% 이상을 당뇨병의 새로운 진단기준으로 포함시킬 것을 권고\n- 하였다.2 이 진단기준은 2010년 미국당뇨병학회의 진료지침에 반영되었고, 대한당뇨병학회는 2011년 진료지침\n- 에서 진단기준에 포함시켰다.', '| 권고 내용 | 권고등급 | 근거수준 | 권고도출 자료원 |\n| --- | --- | --- | --- |\n| 91 선별검사 | 91 선별검사 | 91 선별검사 | 91 선별검사 |\n| · 모든 임부를 대상으로 첫 산전 방문 시 기왕의 당뇨병 여부에 대한 검사(공복혈장포도당, 무작위 혈장포도당 혹은 당화혈색소)를 하도록 권고한다. | | | A | 1, 2, 6-10 |\n| · 이전에 당뇨병이나 임신당뇨병a)으로 진단받지 않은 임부인 경우 임신 24-28주에 2시간 75 g 경구포도당부하검사를 권고한다 (1단계 접근법, one step approach). | | | A | 1, 2, 11-13 |\n| · 기존의 2단계 접근법(two step approach)을 이용할 경우는 50 g 경구포도당부하 후 1시간 혈장포도당 140 mg/dL (고위험 임부의 경우 130 mg/dL)이상이면 선별검사 양성으로 판정하여 100 g 경구포도당부하검사를 권고한다. | | | A | 1, 11-13 |\n| 91 진단기준 | 91 진단기준 | 91 진단기준 | 91 진단기준 |\n| · 첫 산전 방문 검사 시 당뇨병의 일반 진단기준 적용을 권고한다. | | | A | 1, 2, 6, 14 |\n| · 임신 24-28주 사이에 시행한 75 g 경구포도당부하검사b)에서 다음 중 하나 이상을 만족하는 경우 임신당뇨병으로 진단할 수 있다. ① 공복혈장포도당 ≥ 92 mg/dL ② 포도당부하 후 1시간 혈장포도당 ≥ 180 mg/dL ③ 포도당부하 후 2시간 혈장포도당 ≥ 153 mg/dL | lla | B | 1, 2, 6, 15 |\n| · 기존의 2단계 접근법c)으로 100 g 경구포도당부하검사를 시행한 경우는 다음 기준 중 두 가지 이상을 만족하는 경우 임신당뇨병 으로 진단할 수 있다. ① 공복혈장포도당 ≥ 95 mg/dL ② 포도당부하 후 1시간 혈장포도당 ≥ 180 mg/dL ③ 포도당부하 후 2시간 혈장포도당 ≥ 155 mg/dL ④ 포도당부하 후 3시간 혈장포도당 ≥ 140 mg/dL | lla | A | 1, 16 |']",['| 권고 적용군 | 임부 | 진료환경 | 진료실 |\n| --- | --- | --- | --- |\n| 중재/실행지표 | 당뇨병 선별검사 | 당뇨병 선별검사 | 당뇨병 선별검사 |\n| 비교지표 | 당뇨병 선별검사 미시행 | 당뇨병 선별검사 미시행 | 당뇨병 선별검사 미시행 |\n| 결과물 | 태아와 임산부 주산기 합병증 예방 | 태아와 임산부 주산기 합병증 예방 | 태아와 임산부 주산기 합병증 예방 |'],1.0,0.7353813886835264,0.999999999975,1.0
What are the recommendations for blood lipid tests in diabetes patients and how should abnormal lipid levels be managed according to the guidelines?,"당뇨병 환자의 혈중 지질검사 및 이상지질혈증 관리에 대한 권고 사항은 다음과 같습니다:

1. **혈중 지질검사**: 당뇨병 진단 시와 이후 매년 혈중 지질검사(총 콜레스테롤, HDL 콜레스테롤, 중성지방, LDL 콜레스테롤)를 시행하는 것을 고려해야 합니다. (권고 등급: lla, 근거 수준: B)

2. **생활습관 교정**: 이상지질혈증이 있는 경우, 적극적인 생활습관 교정을 위한 교육을 권고합니다. (권고 등급: A)

3. **치료 목표**: 당뇨병 환자의 혈중 지질이상을 적극적으로 교정해야 하며, 다음과 같은 목표로 조절을 권장합니다:
   - LDL 콜레스테롤 < 100 mg/dL
   - 중성지방 < 150 mg/dL
   - HDL 콜레스테롤 > 40 mg/dL (남자), > 50 mg/dL (여자) (권고 등급: A)

4. **심혈관질환 고위험 환자**: 심혈관 질환이 있거나 심혈관 질환 고위험 당뇨병 환자의 경우 LDL 콜레스테롤을 70 mg/dL 미만으로 조절할 것을 고려해야 합니다. (권고 등급: II a, 근거 수준: B)

5. **약물 치료**: LDL 콜레스테롤 목표치에 도달하지 못한 경우 약물 치료를 하며, 일차 치료약제로 스타틴을 사용하는 것이 권장됩니다. (권고 등급: A) 또한, 스타틴으로 목표치에 도달하지 못한 경우 에제티미브 추가를 고려할 수 있습니다. (권고 등급: II a)

6. **병용요법**: LDL 콜레스테롤 목표치에 도달하였지만 중성 지방이 높거나 HDL 콜레스테롤이 낮은 경우에는 다른 기전의 지질강하제(파이브레이트, 오메가-3 지방산)와의 병용요법을 고려할 수 있습니다. (권고 등급: llb)

이와 같은 권고사항을 통해 당뇨병 환자의 혈중 지질을 효과적으로 관리할 수 있습니다.","The recommendations for blood lipid tests in diabetes patients include conducting blood lipid tests (total cholesterol, HDL cholesterol, triglycerides, LDL cholesterol) at the time of diabetes diagnosis and annually thereafter. For managing abnormal lipid levels, it is advised to actively correct dyslipidemia in diabetes patients, with specific targets: LDL cholesterol should be less than 100 mg/dL, triglycerides should be less than 150 mg/dL, and HDL cholesterol should be greater than 40 mg/dL for men and greater than 50 mg/dL for women. In cases of cardiovascular disease or high-risk diabetes patients, it is recommended to consider controlling LDL cholesterol to below 70 mg/dL.","['| 권고 내용 | 권고 등급 | 근거 수준 | 권고도출 자료원 |\n| --- | --- | --- | --- |\n| · 혈중 지질검사(총 콜레스테롤, HDL 콜레스테롤, 중성지방, LDL 콜레스테롤)는 당뇨병 진단 당시와 이후 매년 시행하는 것을 고려 한다.a) | lla | B | 81, 87 |\n| · 이상지질혈증이 있는 경우 적극적인 생활습관교정을 위한 교육을 권고한다. b) | | | A | 2, 3, 10, 79 |\n| · 당뇨병 환자의 혈중 지질이상은 적극적으로 교정하며, 다음과 같은 목표로 조절을 권고한다. 1) ① LDL 콜레스테롤 < 100 mg/dL ② 중성지방 < 150 mg/dL ③ HDL 콜레스테롤 > 40 mg/dL (남자), > 50 mg/dL (여자) | | | A | 2, 3, 77, 82 |\n| · 심혈관질환이 있거나 심혈관질환 고위험 당뇨병 환자의 경우 LDL 콜레스테롤을 70 mg/dL 미만으로 조절할 것을 고려한다. c) | II a | B | 2, 3, 76, 78, 85, 86 |\n| · 당뇨병 환자의 혈중 지질이상의 치료 시 non-HDL 콜레스테롤, Apo B 등도 치료 목표로 사용을 고려할 수 있다.d) | llb | D | 2, 3 |\n| · LDL 콜레스테롤 목표치 도달을 우선시하고, 도달하지 못한 경우 약물 치료를 하며, 일차치료약제로는 스타틴을 권고한다.e) | | | A | 84 |\n| · 적정용량의 스타틴으로 LDL 콜레스테롤 목표치에 도달하지 못한 경우 에제티미브 추가를 고려한다. f).2) | II a | A | 11, 80 |\n| · 스타틴 투여로 LDL 콜레스테롤은 목표치에 도달하였으나 중성 지방이 높거나 HDL 콜레스테롤이 낮은 경우 다른 기전의 지질강하제 (파이브레이트, 오메가-3지방산)와 병용요법을 고려할 수 있다.g) | llb | C | 2, 7, 11, 75, 83 |', '- 1. 대한당뇨병학회. 2015 당뇨병 진료지침. 2015.\n- 2. 대한당뇨병학회. 2021 당뇨병 진료지침. 2021.\n- 3. American Diabetes Association. Standards of Medical Care in Diabetes-2021. Diabetes\n- Care 2021;44(suppl 1):S1-S232.\n- 4. Diabetes Canada. Diabetes Canada 2018 clinical practice guidelines for the prevention\n- and management of diabetes in Canada. Can J Diabetes 2018;42:S1-S352.\n- 5. AACE/ACE. American Association of Clinical Endocrinologists and American College of\n- Endocrinology-clinical practice guidelines for developing a diabetes mellitus\n- comprehensive care plan 2015. Endocrine Practice 2015;21(1):1-87.\n- 6. National Kidney Foundation. KDOQI clinical practice guideline for diabetes and CKD:2012\n- update. Am J Kidney Dis 2012;60(5):850-886.\n- 7. American Diabetes Association. Standards of Medical Care in Diabetes-cardiovascular\n- disease and risk management. Diabetes Care 2017;40(1):S75-S87.\n- 8. Patrick McGowan. The efficacy of diabetes patient education and self-management\n- education in type 2 diabetes. Canadian Journal of Diabetes 2011;35(1):46-53.\n- 9. Koutoukidis DA, Astbury NM, Tudor KE, et al. Association of weight loss interventions\n- with changes in biomarkers of nonalcoholic fatty liver disease: a systematic review and\n- meta-analysis. JAMA Intern Med 2019;179:1262-1271.\n- 10. Franz MJ, Boucher JL, Rutten-Ramos S, et al. Lifestyle weight-loss intervention\n- outcomes in overweight and obese adults with type 2 diabetes: a systematic review and\n- meta-analysis of randomized clinical trials. J Acad Nutr Diet 2015;115:1447-1463.\n- 11. Cannon CP, Blazing MA, Giugliano RP, et al. Ezetimibe added to statin therapy after\n- acute coronary syndromes. N ENGL J MED 2015;372(25):2387-2397.\n- 12. Avery L, Flynn D, van Wersch A, et al. Changing physical activity behavior in type 2\n- diabetes: a systematic review and meta-analysis of behavioral interventions. Diabetes\n- Care 2012;35(12):2681-2689.\n- 13. Holman RR, Paul SK, Bethel MA, et al. 10-year follow-up of intensive glucose control in\n- type 2 diabetes. N Engl J Med 2008;359:1577-1589.\n- 14. Nathan DM, Cleary PA, Backlund JY, et al. Diabetes Control and Complications\n- Trial/Epidemiology of Diabetes Interventions and Complications (DCCT/EDIC) Study\n- Research Group. Intensive diabetes treatment and cardiovascular disease in patients with\n- type 1 diabetes. N Engl J Med 2005;353:2643-2653.\n- 15. Ohkubo Y, Kishikawa H, Araki E, et al. Intensive insulin herapy prevents the progression\n- of diabetic microvascular complications in Japanese patients with non-insulin-dependent\n- diabetes mellitus: a randomized prospective 6-year study. Diabetes Res Clin Pract 1995;\n- 28(2):103-117.\n- 16. Skyler JS, Bergenstal R, Bonow RO, et al. American Diabetes Association; American\n- College of Cardiology Foundation; American Heart Association. Intensive glycemic control', '- 1. 대한당뇨병학회. 2021 당뇨병 진료지침. 2021.\n- 2. Perkovic V, Heerspink HL, Chalmers J, et al. Intensive glucose control improves kidney\n- outcomes in patients with type 2 diabetes. Kidney International 2013;83(3):517-523.\n- 3. American Diabetes Association. Standards of Medical Care in Diabetes 2021. Diabetes\n- Care 2021;44(1):S111-S124.\n- 4. Maruthur NM, Tseng E, Hutfless S, et al. Diabetes medications as monotherapy or\n- metformin-based combination therapy for type 2 diabetes: a systematic review and meta-\n- analysis. Ann Intern Med 2016;164(1 1):740-751.\n- 5. Wu JH, Foote C, Blomster J, et al. Effects of sodium-glucose cotransporter-2 inhibitors\n- on cardiovascular events, death, and major safety outcomes in adults with type 2\n- diabetes: a systematic review and meta-analysis. Lancet Diabetes Endocrinol 2016;4:\n- 411-419.\n- 6. Lee G, Oh SW, Hwang SS, et al. Comparative effectiveness of oral antidiabetic drugs in\n- preventing cardiovascular mortality and morbidity: a network meta-analysis. PLoS One\n- 2017;12:e0177646.\n- 7. Marso SP, Daniels GH, Brown-Frandsen K, et al. LEADER Steering Committee; LEADER\n- Trial Investigators. Liraglutide and cardiovascular outcomes in type 2 diabetes. N Engl J\n- Med 2016;375:311-322.\n- 8. Waugh N, Cummins E, Royle P, et al. Newer agents for blood glucose control in type 2\n- diabetes: Systematic review and economic evaluation. Health Technology Assessment\n- 2010;14(36):3-247.\n- 9. Hasan ilkova, Taner Damc I , Zeynep Oar Siva, et al. The relation of changes in\n- prescribing patterns of anti-diabetic drug and HbA1c levels among patients with type 2\n- diabetes mellitus: systematic analysis of studies from the past 20 years in Turkey. Turkish\n- Journal of Endocrinology and metabolism 2011;15(4):77-105.\n- 10. Shah SN, Litwak L, Haddad J, et al. The A1chieve study: A 60,000-person, global,\n- prospective, observational study of basal, meal-time, and biphasic insulin analogs in daily\n- clinical practice. Diabetes Research and Clinical Practice 2010;88(1):11-16.\n- 11. Lee C, Joseph L, Colosimo A, et al. Mortality in diabetes compared with previous\n- cardiovascular disease: a gender-specific meta-analysis. Diabetes Metab 2012;38(5):420-427.\n- 12. Riddle MC, Vlajnic A, Zhou R, et al. Baseline HbA1c predicts attainment of 7.0% HbA1c\n- target with structured titration of insulin glargine in type 2 diabetes: a patient-level\n- analysis of 12 studies. Diabetes Obesity and Metabolism 2013;15(9):819-825.', '- 85. Nissen SE, Tuzcu EM, Schoenhagen P, et al. Effect of intensive compared with\n- moderate lipid-lowering therapy on progression of coronary atherosclerosis: a randomized\n- controlled trial. JAMA 2004;291:1071-1080.\n- 86. Shepherd J, Barter P, Carmena R, et al. Effect of lowering LDL cholesterol substantially\n- below currently recommended levels in patients with coronary heart disease and\n- diabetes: the Treating to New Targets (TNT) study. Diabetes Care 2006;29:1220-1226.\n- 87. Stevens RJ, Kothari V, Adler AI, et al. The UKPDS risk engine: a model for the risk of\n- coronary heart disease in Type II diabetes (UKPDS 56). Clin Sci (Lond) 2001;101:\n- 671-679.\n- 88. Cushman WC, Evans GW, Byington RP, et al. ACCORD Study Group. Effects of\n- intensive blood-pressure control in type 2 diabetes mellitus. N Engl J Med 2010;362:\n- 1575-1585.\n- 89. Arnold SV, Bhatt DL, Barsness GW, et al. Clinical management of stable coronary artery\n- disease in patients with type 2 diabetes mellitus: a scientific statement from the\n- American Heart Association. Circulation 2020;141:e779-e806.\n- 90. Bakris GL, Gaxiola E, Messerli FH, et al. INVEST Investigators. Clinical outcomes in the\n- diabetes cohort of the INternational VErapamil SR-Trandolapril study. Hypertension\n- 2004;44:637-642.\n- 91. Bakris GL, Weir MR, Study of H, et al. Achieving goal blood pressure in patients with\n- type 2 diabetes: conventional versus fixed-dose combination approaches. J Clin\n- Hypertens (Greenwich) 2003;5:202-209.\n- 92. Bangalore S, Fakheri R, Toklu B, et al. Diabetes mellitus as a compelling indication for\n- use of renin angiotensin system blockers: systematic review and meta-analysis of\n- randomized trials. BMJ 2016;352:i438.\n- 93. Berl T, Hunsicker LG, Lewis JB, et al. Cardiovascular outcomes in the Irbesartan Diabetic\n- Nephropathy Trial of patients with type 2 diabetes and overt nephropathy. Ann Intern\n- Med 2003;138:542-549.\n- 94. Buckley LF, Dixon DL, Wohlford GF, et al. Intensive versus standard blood pressure\n- control in SPRINT-eligible participants of ACCORD-BP. Diabetes Care 2017;40:1733-1738.\n- 95. Cook NR, Cutler JA, Obarzanek E, et al. Long term effects of dietary sodium reduction\n- on cardiovascular disease outcomes: observational follow-up of the trials of hypertension\n- prevention (TOHP). BMJ 2007;334:885-888.\n- 96. Heart Outcomes Prevention Evaluation Study Investigators. Effects of ramipril on\n- cardiovascular and microvascular outcomes in people with diabetes mellitus: results of\n- the HOPE study and MICRO-HOPE substudy. Lancet 2000;355:253-259.\n- 97. Elmer PJ, Obarzanek E, Vollmer WM, et al. Effects of comprehensive lifestyle\n- modification on diet, weight, physical fitness, and blood pressure control: 18-month\n- results of a randomized trial. Ann Intern Med 2006;144:485-495.\n- 98. Feldman RD, Zou GY, Vandervoort MK, et al. A simplified approach to the treatment of']","['<1-hop>\n\n| 권고 내용 | 권고 등급 | 근거 수준 | 권고도출 자료원 |\n| --- | --- | --- | --- |\n| · 혈중 지질검사(총 콜레스테롤, HDL 콜레스테롤, 중성지방, LDL 콜레스테롤)는 당뇨병 진단 당시와 이후 매년 시행하는 것을 고려 한다.a) | lla | B | 81, 87 |\n| · 이상지질혈증이 있는 경우 적극적인 생활습관교정을 위한 교육을 권고한다. b) | | | A | 2, 3, 10, 79 |\n| · 당뇨병 환자의 혈중 지질이상은 적극적으로 교정하며, 다음과 같은 목표로 조절을 권고한다. 1) ① LDL 콜레스테롤 < 100 mg/dL ② 중성지방 < 150 mg/dL ③ HDL 콜레스테롤 > 40 mg/dL (남자), > 50 mg/dL (여자) | | | A | 2, 3, 77, 82 |\n| · 심혈관질환이 있거나 심혈관질환 고위험 당뇨병 환자의 경우 LDL 콜레스테롤을 70 mg/dL 미만으로 조절할 것을 고려한다. c) | II a | B | 2, 3, 76, 78, 85, 86 |\n| · 당뇨병 환자의 혈중 지질이상의 치료 시 non-HDL 콜레스테롤, Apo B 등도 치료 목표로 사용을 고려할 수 있다.d) | llb | D | 2, 3 |\n| · LDL 콜레스테롤 목표치 도달을 우선시하고, 도달하지 못한 경우 약물 치료를 하며, 일차치료약제로는 스타틴을 권고한다.e) | | | A | 84 |\n| · 적정용량의 스타틴으로 LDL 콜레스테롤 목표치에 도달하지 못한 경우 에제티미브 추가를 고려한다. f).2) | II a | A | 11, 80 |\n| · 스타틴 투여로 LDL 콜레스테롤은 목표치에 도달하였으나 중성 지방이 높거나 HDL 콜레스테롤이 낮은 경우 다른 기전의 지질강하제 (파이브레이트, 오메가-3지방산)와 병용요법을 고려할 수 있다.g) | llb | C | 2, 7, 11, 75, 83 |']",1.0,0.8817739599706784,0.9999999999666667,1.0
당뇨병의 진단기준은 무엇인가요?,"당뇨병의 진단기준은 다음 중 하나 이상을 만족할 때 확진됩니다:

1. 당화혈색소 ≥ 6.5%
2. 8시간 이상 공복 후 혈장포도당 ≥ 126 mg/dL
3. 75g 경구포도당부하검사 2시간 후 혈장포도당 ≥ 200 mg/dL
4. 당뇨병의 전형적인 증상(다뇨, 다음, 설명되지 않는 체중감소)과 무작위 혈장포도당 ≥ 200 mg/dL

이 기준 중 하나라도 충족하면 당뇨병으로 진단됩니다.","당뇨병의 진단기준은 여러 가지가 있으며, 이는 당뇨병 분류와 관련된 중요한 요소입니다.","['| 진료 시 고려할 점 |\n| --- |\n| · 노인에게서의 진단기준은 별도로 확정되어 있지 않다. · 당화혈색소는 표준화된 방법으로 측정해야 한다. · 당뇨병 진단기준 [c]1[c]~3[c] 중 하나를 만족하나 명백한 고혈당이 아니라면, 동일한 검사를 반복하거나 다른 검사를 추가해서 당뇨병 진단기준에 합당한 경우 당뇨병으로 확진한다. |', '- a) 선별검사의 목적은 어떤 질병을 가지고 있을 가능성이 높은 대상을 찾아내는 것으로 당뇨병은 선별검사와\n- 진단검사가 동일하다.\n- 2형당뇨병은 진단 시점 이전 상당 기간 동안 대사 이상들이 진행되어 진단 시 합병증이 동반되는 경우가 많아\n- 적극적인 선별검사가 필요하며, 특히 고위험군에서는 더욱 철저하게 시행되어야 한다. 한국인에 적절한 2형\n- 당뇨병의 위험인자는 권고요약본에 정리되어 있다.\n- b) 대한당뇨병학회에서는 공복혈당장애 혹은 당화혈색소에 따라 두 단계로 나누어 추가 검사를 시행하도록 하고\n- 있다. 즉 [1단계] 공복혈당 100-109 mg/dL, 당화혈색소 5.7-6.0%인 경우 매년 공복혈당 및 당화혈색소\n- 측정을 하고, [2단계] 공복혈당 110-125 mg/dL, 당화혈색소 6.1-6.4%인 경우 경구당부하검사를 시행하도록\n- 권고하고 있다.1\n- 2009년 국제전문가위원회에서는 당화혈색소가 장기적인 혈당 상태를 보다 정확히 반영하고, 당뇨병합병증의\n- 위험도와 좋은 상관관계를 보이며, 혈당 측정보다 안정적이라는 이유로 NGSP (National Glycohemoglobin\n- Standardization Program)에 의해 인증되고 DCCT (Diabetes Control and Complication Trial) assay에\n- 표준화된 방법을 사용했을 경우 당화혈색소 6.5% 이상을 당뇨병의 새로운 진단기준으로 포함시킬 것을 권고\n- 하였다.2 이 진단기준은 2010년 미국당뇨병학회의 진료지침에 반영되었고, 대한당뇨병학회는 2011년 진료지침\n- 에서 진단기준에 포함시켰다.', '| 권고 내용 | 권고 등급 | 근거 수준 | 권고도출 자료원 |\n| --- | --- | --- | --- |\n| · 2형당뇨병 성인에게 당뇨병 진단 시 그리고 적어도 매년 당뇨병신장 질환의 선별검사를 권고한다. a),1) | | | A | 1, 3, 29-35 |\n| · 선별검사로는 알부민뇨를 확인하기 위한 소변알부민/크레이티닌비와 혈청 크레아티닌을 이용한 추정사구체여과율(eGFR)을 권고 한다. b),2) | | | A | 1, 3, 29-35, 49 |\n| · 3개월 이상 소변알부민/크레이티닌비가 30 mg/g 이상이거나 추정사구체여과율이 60 mL/min/1.73 m2 미만인 경우 당뇨병 신장질환 진단한다. c),3) | | | B | 1, 3, 34-48, 49 |\n| · 아래의 경우, 당뇨병이 아닌 다른 질환에 의한 신장질환을 고려 한다.d) ① 당뇨병망막병증이 없는 경우 ② 사구체여과율이 급속히 떨어지는 경우 ③ 단백뇨가 급격히 증가하거나 신증후군의 양상을 보이는 경우 ④ 고혈압이 조절되지 않는 경우 ⑤ 소변검사에서 혈뇨 등의 이상을 보이는 경우 ⑥ 다른 전신질환의 증세가 보이는 경우 ⑦ 안지오텐신전환효소억제제나 안지오텐신II수용체차단제 사용 2-3개월 이내에 사구체여과율이 30% 이상 감소하는 경우 | lla | B | 34, 35, 49, 50, 51 |', '| 진단기준 | 권고 등급 | 근거 수준 | 권고도출 자료원 |\n| --- | --- | --- | --- |\n| 91 정상혈당 기준 | 91 정상혈당 기준 | 91 정상혈당 기준 | 91 정상혈당 기준 |\n| · 8시간 이상 음식을 섭취하지 않은 상태에서 ▶ 공복혈장포도당 100 mg/dL 미만 ▶ 75g 경구포도당부하 2시간 후 혈장포도당 140 mg/dL 미만 | | | A | 2, 3, 5 |\n| 91 당뇨병 진단기준a) (4가지 기준 중 한 가지 이상 만족 시) | 91 당뇨병 진단기준a) (4가지 기준 중 한 가지 이상 만족 시) | 91 당뇨병 진단기준a) (4가지 기준 중 한 가지 이상 만족 시) | 91 당뇨병 진단기준a) (4가지 기준 중 한 가지 이상 만족 시) |\n| ① 당화혈색소 ≥ 6.5% | | | A | 2-5 |\n| ② 8시간 이상 공복 후 혈장포도당 ≥ 126 mg/dL | | | A | 2-5 |\n| ③ 75 g 경구포도당부하검사 2시간 후 혈장포도당 ≥ 200 mg/dL | | | A | 2-5 |\n| ④ 당뇨병의 전형적인 증상(다뇨, 다음, 설명되지 않는 체중감소)과 무작위 혈장포도당 ≥ 200 mg/dL | | | A | 2-5 |\n| 91 당뇨병전단계 진단기준 | 91 당뇨병전단계 진단기준 | 91 당뇨병전단계 진단기준 | 91 당뇨병전단계 진단기준 |\n| ① 공복혈장포도당 100-125 mg/dL (공복혈당장애) | | | A | 2, 3, 5 |\n| ② 75g 경구포도당부하 2시간 후 혈장포도당 140-199 mg/dL (내당능장애) | | | A | 2, 3, 5 |\n| 당화혈색소 5.7-6.4% | | | A | 2, 3, 5 |']",['- 1. 당뇨병 분류\n- 2. 당뇨병 진단기준\n- 3. 임신당뇨병 진단기준\n- 4. 대사증후군 진단기준\n- 5. 당뇨병 선별검사\n- 6. 당뇨병 예방'],1.0,0.837596317184274,0.4166666666458333,0.0
기타 당뇨병은 뭐에요?,"기타 당뇨병은 특정한 원인에 의해 당뇨병 상태로 진행하는 경우를 말합니다. 주로 다음과 같은 원인에 의해 발생할 수 있습니다: 유전적 결함이 있는 베타세포 기능, 인슐린 작용의 결함, 췌장 외분비 기능 장애, 여러 가지 내분비 질환, 간 질환, 약물 유발, 감염, 그리고 드문 형태의 면역 매개 당뇨병 등이 있습니다. 이러한 원인이 해결되더라도 혈당이 개선되지 않을 수 있으며, 향후 고혈당 발생 가능성을 관리해야 합니다.","기타 당뇨병은 여러 원인으로 발생하는 당뇨병으로, 베타세포 기능의 유전적 결함, 인슐린 작용의 유전적 결함, 췌장 외분비 기능 장애, 내분비 질환, 간질환, 약물 유발, 감염, 드문 형태의 면역 매개 당뇨병, 그리고 당뇨병과 동반될 수 있는 기타 유전적 증후군 등이 포함됩니다.","['- c) 기타 당뇨병 또는 이차성당뇨병은 어떤 특정한 원인에 의해 당뇨병상태로 진행하는 경우를 말하는데 대부분\n- 당뇨병이 발생하기 쉬운 유전적 또는 환경적(비만, 노화 등) 조건을 가진 경우가 대부분이다. 따라서 원인이\n- 해결되고 혈당이 개선되어도 차후 고혈당이 발생할 가능성이 높으므로 이에 대한 관리가 필요하다.', '| 분류 | 내용 |\n| --- | --- |\n| 1형당뇨병a),1,2 | · 췌장 베타세포 파괴에 의한 인슐린 결핍으로 발생한 당뇨병 ① 면역 매개성 ② 특발성 |\n| 2형당뇨 병b),1,2 | · 인슐린 분비 및 작용의 결함에 의해 발생한 당뇨병 |\n| 기타 당뇨병c).1.2 | ① 베타세포기능의 유전적 결함: MODY1-6, 미토콘드리아 DNA, 일부 췌도 조절자/단백질 등 ② 인슐린 작용의 유전적 결함 ③ 췌장 외분비기능장애 ④ 내분비질환: 말단비대증, 쿠싱증후군, 글루카곤증, 갈색세포종, 갑상선기능항진증, 소마토스타틴종, 알도스테론종 등 ⑤ 간질환 ⑥ 약물 유발: 당류코르티코이드, 니코틴산, 다이아족사이드, 베타-아드레날린 작용제, 티아지드, 에피네프린, 항정신병약(비정상적, 기타) 등 ⑦ 감염 ⑧ 드문 형태의 면역 매개 당뇨병 ⑨ 당뇨병과 동반될 수 있는 기타 유전적 증후군 |\n| 임신당뇨병d).1.2 (임신 중 진단된 당뇨병) | - |', 'a) 당뇨병케토산증(diabetic ketoacidosis, DKA)과 고삼투질고혈당상태(hyperosmolar hyperglycemic state,\nHHS)는 고혈당에 의한 급성합병증이다. 당뇨병 환자에게서 전신상태에 문제가 있는 경우 DKA 혹은 HHS를\n의심해야 한다. 1,2 DKA와 HHS는 인슐린이 부족한 상태에서 고혈당에 의한 세포외액 감소와 이에 따르는\n전해질 이상 및 케토산증(DKA의 경우)으로 표현되는 합병증이다. 진단되면 즉시 상급병원 응급실로 전원하되,\n전신상태에 따라 기도확보, 생리식염수와 인슐린 정주 등의 조치를 우선해야 할 수도 있다. DKA와 HHS의\n일차적인 치료는 인슐린과 체액의 보충이며, 이를 통해 혈당을 낮추고, 케톤생성을 막고, 전해질이상을 정상화\n시키는 것이다. 동시에 감염, 부적절한 인슐린치료, 혈관질환(심근경색증, 뇌경색증 등) 등의 유발인자들이\n있는지 꼭 확인해야 한다.', '- a) 1형당뇨병은 인슐린을 분비하는 췌장의 베타세포가 서서히 파괴되어 결국 인슐린 분비가 없어지는 질환이다.\n- 자가면역질환의 한 형태로 나타날 수 있으며 이 경우 대부분 자가항체(anti-GAD 항체)가 양성으로 나타난다.\n- 하지만 자가면역성을 증명할 수 없는 특발성의 경우 일반적으로 인슐린 결핍이 비교적 서서히 진행되어 초기에는\n- 2형당뇨병과 구분이 어려울 수 있다. 1형당뇨병은 전 연령에 걸쳐 발생하며 우리나라에서도 최근 발생률이\n- 증가하는 추세다.1']","['| 분류 | 내용 |\n| --- | --- |\n| 1형당뇨병a),1,2 | · 췌장 베타세포 파괴에 의한 인슐린 결핍으로 발생한 당뇨병 ① 면역 매개성 ② 특발성 |\n| 2형당뇨 병b),1,2 | · 인슐린 분비 및 작용의 결함에 의해 발생한 당뇨병 |\n| 기타 당뇨병c).1.2 | ① 베타세포기능의 유전적 결함: MODY1-6, 미토콘드리아 DNA, 일부 췌도 조절자/단백질 등 ② 인슐린 작용의 유전적 결함 ③ 췌장 외분비기능장애 ④ 내분비질환: 말단비대증, 쿠싱증후군, 글루카곤증, 갈색세포종, 갑상선기능항진증, 소마토스타틴종, 알도스테론종 등 ⑤ 간질환 ⑥ 약물 유발: 당류코르티코이드, 니코틴산, 다이아족사이드, 베타-아드레날린 작용제, 티아지드, 에피네프린, 항정신병약(비정상적, 기타) 등 ⑦ 감염 ⑧ 드문 형태의 면역 매개 당뇨병 ⑨ 당뇨병과 동반될 수 있는 기타 유전적 증후군 |\n| 임신당뇨병d).1.2 (임신 중 진단된 당뇨병) | - |']",1.0,0.6670034497827596,0.99999999995,1.0
"What are the recommended blood sugar control goals for adult patients with type 2 diabetes, and how should these goals be individualized based on patient circumstances?","성인 2형 당뇨병 환자의 권장 혈당 조절 목표는 당화혈색소 6.5% 미만으로 설정하는 것입니다. 그러나 혈당 조절 목표는 환자의 나이, 신체/정신/사회적 여건, 기대수명, 동반질환 또는 합병증의 중증도, 저혈당 위험, 선호도 등에 따라 개별화할 필요가 있습니다.","The recommended blood sugar control goal for adult patients with type 2 diabetes is to maintain an HbA1c level of less than 6.5%. Additionally, it is advised that blood sugar control goals be individualized based on factors such as the patient's age, physical, mental, and social conditions, life expectancy, severity of comorbidities or complications, risk of hypoglycemia, and patient preferences.","['| 권고 내용 | 권고등급 | 근거수준 | 권고도출 자료원 |\n| --- | --- | --- | --- |\n| · 2형당뇨병 성인에게서 일반적인 혈당조절 목표는 당화혈색소 6.5% 미만으로 할 것을 권고한다. a),1) | | | A | 2, 13-18 |\n| · 혈당조절 목표는 환자의 나이, 신체/정신/사회적 여건, 기대수명, 동반질환 또는 합병증의 중증도, 저혈당 위험, 선호도 등에 따라 개별화할 것을 고려한다. b),2) | II a | Guideline | 2, 3 |', '| 권고 적용군 | 2형당뇨병 성인 | 진료환경 | 진료실 |\n| --- | --- | --- | --- |\n| 중재/실행지표 | 당화혈색소 6.5% 미만/혈당조절 목표의 개별화 | 당화혈색소 6.5% 미만/혈당조절 목표의 개별화 | 당화혈색소 6.5% 미만/혈당조절 목표의 개별화 |\n| 비교지표 | 당화혈색소 6.5% 이상/일률적인 혈당조절 목표 | 당화혈색소 6.5% 이상/일률적인 혈당조절 목표 | 당화혈색소 6.5% 이상/일률적인 혈당조절 목표 |\n| 결과물 | 합병증 발생률 및 사망률 감소 | 합병증 발생률 및 사망률 감소 | 합병증 발생률 및 사망률 감소 |', '- b) 당뇨병 치료의 목표는 상황에 따라 개별화되어야 하겠지만, 일반적으로 당화혈색소 < 7%를 목표로 한다.\n- 메트포민 단독요법으로 목표에 도달하지 못하면, 기저 인슐린을 추가하거나 리라글루타이드 추가를 고려할 수\n- 있으나, 현재 우리나라에서는 리라글루타이드가 허가 사항이 아니다. 1.2 또한, 소아청소년기 2형당뇨병 환자는\n- 진단 당시에 합병증 동반 가능성이 있어 진단 시점부터 미세혈관 합병증(신증, 망막병증, 신경병증)에 대한 선별\n- 검사를 실시해야 하며, 이후 매년 실시하는 것을 고려한다.1', '- 1. 대한당뇨병학회. 2021 당뇨병 진료지침. 2021.\n- 2. Perkovic V, Heerspink HL, Chalmers J, et al. Intensive glucose control improves kidney\n- outcomes in patients with type 2 diabetes. Kidney International 2013;83(3):517-523.\n- 3. American Diabetes Association. Standards of Medical Care in Diabetes 2021. Diabetes\n- Care 2021;44(1):S111-S124.\n- 4. Maruthur NM, Tseng E, Hutfless S, et al. Diabetes medications as monotherapy or\n- metformin-based combination therapy for type 2 diabetes: a systematic review and meta-\n- analysis. Ann Intern Med 2016;164(1 1):740-751.\n- 5. Wu JH, Foote C, Blomster J, et al. Effects of sodium-glucose cotransporter-2 inhibitors\n- on cardiovascular events, death, and major safety outcomes in adults with type 2\n- diabetes: a systematic review and meta-analysis. Lancet Diabetes Endocrinol 2016;4:\n- 411-419.\n- 6. Lee G, Oh SW, Hwang SS, et al. Comparative effectiveness of oral antidiabetic drugs in\n- preventing cardiovascular mortality and morbidity: a network meta-analysis. PLoS One\n- 2017;12:e0177646.\n- 7. Marso SP, Daniels GH, Brown-Frandsen K, et al. LEADER Steering Committee; LEADER\n- Trial Investigators. Liraglutide and cardiovascular outcomes in type 2 diabetes. N Engl J\n- Med 2016;375:311-322.\n- 8. Waugh N, Cummins E, Royle P, et al. Newer agents for blood glucose control in type 2\n- diabetes: Systematic review and economic evaluation. Health Technology Assessment\n- 2010;14(36):3-247.\n- 9. Hasan ilkova, Taner Damc I , Zeynep Oar Siva, et al. The relation of changes in\n- prescribing patterns of anti-diabetic drug and HbA1c levels among patients with type 2\n- diabetes mellitus: systematic analysis of studies from the past 20 years in Turkey. Turkish\n- Journal of Endocrinology and metabolism 2011;15(4):77-105.\n- 10. Shah SN, Litwak L, Haddad J, et al. The A1chieve study: A 60,000-person, global,\n- prospective, observational study of basal, meal-time, and biphasic insulin analogs in daily\n- clinical practice. Diabetes Research and Clinical Practice 2010;88(1):11-16.\n- 11. Lee C, Joseph L, Colosimo A, et al. Mortality in diabetes compared with previous\n- cardiovascular disease: a gender-specific meta-analysis. Diabetes Metab 2012;38(5):420-427.\n- 12. Riddle MC, Vlajnic A, Zhou R, et al. Baseline HbA1c predicts attainment of 7.0% HbA1c\n- target with structured titration of insulin glargine in type 2 diabetes: a patient-level\n- analysis of 12 studies. Diabetes Obesity and Metabolism 2013;15(9):819-825.']","['<1-hop>\n\n| 권고 내용 | 권고등급 | 근거수준 | 권고도출 자료원 |\n| --- | --- | --- | --- |\n| · 2형당뇨병 환자의 첫 방문 시에 신체계측과 혈액검사로 대사 증후군 평가를 고려한다. | II a | B | 17-19 |\n| · 아래 기준 중 3개 이상에 해당될 때 대사증후군으로 진단할 것을 고려한다. ① 복부비만(허리둘레 남자 ≥ 90 cm, 여자 ≥ 85cm)a) ② 고중성지방혈증(중성지방 ≥ 150 mg/dL 또는 이상지질혈증약 복용) ③ 낮은 HDL 콜레스테롤(남자 < 40 mg/dL, 여자 < 50 mg/dL 또는 이상지질혈증약 복용) ④ 고혈압(혈압 ≥ 130/85 mmHg 또는 고혈압약 복용) ⑤ 고혈당(공복혈장포도당 ≥ 100 mg/dL 또는 당뇨병약 복용) | II a | A | 20-24 |', '<2-hop>\n\n| 권고 내용 | 권고등급 | 근거수준 | 권고도출 자료원 |\n| --- | --- | --- | --- |\n| · 2형당뇨병 성인에게서 일반적인 혈당조절 목표는 당화혈색소 6.5% 미만으로 할 것을 권고한다. a),1) | | | A | 2, 13-18 |\n| · 혈당조절 목표는 환자의 나이, 신체/정신/사회적 여건, 기대수명, 동반질환 또는 합병증의 중증도, 저혈당 위험, 선호도 등에 따라 개별화할 것을 고려한다. b),2) | II a | Guideline | 2, 3 |']",1.0,0.0,0.9166666666361111,1.0
어떻게 2형당뇨병 환자에게 당뇨병신경병증 예방과 삶의 질 향상에 기여할 수 있나요?,"2형당뇨병 환자에게 당뇨병신경병증 예방과 삶의 질 향상을 위해 다음과 같은 중재를 시행할 수 있습니다:

1. **선별검사 시행**: 당뇨병신경병증을 조기에 진단하기 위해 선별검사를 시행함으로써 무증상인 환자도 조기 진단과 치료를 받을 수 있습니다.

2. **발 평가 및 관리 교육**: 발 건강 관리 및 예방 교육을 통해 심각한 합병증을 예방할 수 있습니다.

3. **혈당 조절 및 약물 치료**: 안정적이고 이상적인 혈당 조절은 당뇨병신경병증의 예방과 진행 억제에 기여하며, 통증 경감과 삶의 질 향상에도 도움을 줍니다.

이러한 중재를 통해 당뇨병신경병증의 발생을 지연시키고, 당뇨병으로 인한 합병증의 예방 및 통증 경감, 전반적인 삶의 질 향상에 기여할 수 있습니다.","2형당뇨병 환자에게 당뇨병신경병증 예방과 삶의 질 향상에 기여하기 위해서는 당뇨병신경병증 선별검사, 발 평가 및 관리 교육, 혈당조절 및 약물치료를 시행해야 합니다. 이러한 중재를 통해 당뇨병신경병증의 예방 및 진행 억제, 당뇨병발질환 예방과 절단 예방, 통증 경감이 이루어져 삶의 질이 향상될 수 있습니다.","['| 권고 적용군 | 2형당뇨병 환자 | 진료환경 | 진료실 |\n| --- | --- | --- | --- |\n| 중재/실행지표 | 당뇨병신경병증 선별검사, 발 평가 및 관리 교육, 혈당조절 및 약물치료 시행 | 당뇨병신경병증 선별검사, 발 평가 및 관리 교육, 혈당조절 및 약물치료 시행 | 당뇨병신경병증 선별검사, 발 평가 및 관리 교육, 혈당조절 및 약물치료 시행 |\n| 비교지표 | 당뇨병신경병증 선별검사, 발 평가 및 관리 교육, 혈당조절 및 약물치료 미시행 | 당뇨병신경병증 선별검사, 발 평가 및 관리 교육, 혈당조절 및 약물치료 미시행 | 당뇨병신경병증 선별검사, 발 평가 및 관리 교육, 혈당조절 및 약물치료 미시행 |\n| 결과물 | 당뇨병신경병증 예방 및 진행 억제, 당뇨병발질환 예방 및 절단 예방과 감소, 통증 경감, 삶의 질 향상 | 당뇨병신경병증 예방 및 진행 억제, 당뇨병발질환 예방 및 절단 예방과 감소, 통증 경감, 삶의 질 향상 | 당뇨병신경병증 예방 및 진행 억제, 당뇨병발질환 예방 및 절단 예방과 감소, 통증 경감, 삶의 질 향상 |', '| 이익 및 불이익 |\n| --- |\n| · 이 익 - 당뇨병신경병증 발생의 지연 및 예방 - 당뇨병발질환을 예방 및 절단 예방과 감소, 사망률 감소 - 당뇨병신경병증 환자의 신경병증 통증 감소와 삶의 질 향상 · 불이익 - (약물치료 시) 부작용 가능성 1) 당뇨병신경병증은 절반 이상의 환자가 무증상이며, 선별검사를 통해 당뇨병성신경병증을 조기에 진단 하고 치료를 시행할 수 있다. 신경병증의 조기진단 및 치료는 당뇨병신경병증 환자의 통증 조절 및 삶의 질 향상에 기여하고, 당뇨병발질환의 예방 및 절단 예방과 감소, 입원율 및 사망률을 감소에 기여한다. 당뇨병신경병증의 진단을 위한 검사 시행으로 의료비 상승이 발생할 수 있으나 진단이 적절하지 않을 경우 발생할 수 있는 환자의 예후 등을 고려할 때 이득이 훨씬 더 크다. + |\n| 十 다학제 임상진료지침 개발위원회에서는 이익과 불이익 연계 근거를 검토하고 전문가 의견을 취합하여 논의한 결과, 권고 관련 얻을 수 있는 이익이 크고 발생 가능한 불이익이 거의 없을 것으로 판단함. |\n| 2) 자율신경병증의 조기진단은 일상생활과 삶의 질을 향상시킬 수 있으며 질환의 이환율과 사망률을 감소시킬 수 있어 검사의 시행으로 인해 발생하는 의료비의 상승에 비해 얻을 수 있는 이득이 훨씬 더 크다. + |\n| 十 다학제 임상진료지침 개발위원회에서는 이익과 불이익 연계 근거를 검토하고 전문가 의견을 취합하여 논의한 결과, 권고 관련 얻을 수 있는 이익이 크고 발생 가능한 불이익이 거의 없을 것으로 판단함. |\n| 3) 당뇨병신경병증의 근본적인 치료인 혈당조절은 발생 가능한 위해가 적고 이로 인한 이득이 매우 커서 당뇨병신경병증 치료에 도움이 된다. 당뇨병신경병증환자의 치료에서 가장 중요한 것은 안정적이고 이상적인 혈당조절이다. + |\n| t 다학제 임상진료지침 개발위원회에서는 이익과 불이익 연계 근거를 검토하고 전문가 의견을 취합하여 논의한 결과, 권고 관련 얻을 수 있는 이익이 크고 발생 가능한 불이익이 거의 없을 것으로 판단함. |\n| 4) 당뇨병신경병증의 병인 및 증상에 기초한 약물치료는 통증을 경감시키고, 수면장애, 우울증, 불안 등을 감소시켜 삶의 질을 향상시킨다. 그러나 일부에서 약제에 의한 부작용(어지럼, 졸음, 하지부종, 체중증가, 입 마름, 흐린시력, 두통, 배뇨곤란, 안압항진, 두근거림, 부정맥, 기립저혈압, 심질환 등)이 발생할 수 있다. 당뇨병신경병증에 사용하는 약물에 대한 효과와 부작용을 이득과 위해를 평가해 보면 이득이 위해를 상회하여 당뇨병신경병증 치료에 도움이 된다. + |\n| 十 다학제 임상진료지침 개발위원회에서는 이익과 불이익 연계 근거를 검토하고 전문가 의견을 취합하여 논의한 결과, 권고 관련 얻을 수 있는 이익이 발생 가능한 불이익보다 클 것으로 판단함. |', '- e) 무작위대조연구와 메타분석연구에서 당뇨병말초 및 자율신경병증의 치료에서 근본 원인인 혈당을 조절하는 것이\n- 중요하며, 여러 연구들에서 고혈당과 당뇨병말초신경병증의 중증도는 서로 밀접한 상관관계가 있고, 적극적인\n- 혈당조절은 1형당뇨병 환자에서 당뇨병신경병증을 예방 및 발생 지연시켰다. 1형당뇨병 환자를 대상으로 한\n- Diabetes Control and Complications Trial (DCCT) 연구에서 적극적인 혈당조절은 말초 및 자율신경병증\n- 이환율을 50-60% 정도까지 감소시켰다. 11 2형당뇨병 환자에서는 적극적인 혈당조절의 신경병증에 대한 효과가\n- 뚜렷하지는 않으나 일부에서는 감소시킨다는 보고가 있다. 12,13', '| 권고 적용군 | 2형당뇨병 환자 | 진료환경 | 진료실 |\n| --- | --- | --- | --- |\n| 중재/실행지표 | 혈압 측정, 생활습관교정, 약물치료 | 혈압 측정, 생활습관교정, 약물치료 | 혈압 측정, 생활습관교정, 약물치료 |\n| 비교지표 | 혈압 측정, 생활습관교정, 약물치료 미시행 | 혈압 측정, 생활습관교정, 약물치료 미시행 | 혈압 측정, 생활습관교정, 약물치료 미시행 |\n| 결과물 | 목표혈압 도달, 당뇨병신장질환과 심혈관질환 예방 및 진행 억제 | 목표혈압 도달, 당뇨병신장질환과 심혈관질환 예방 및 진행 억제 | 목표혈압 도달, 당뇨병신장질환과 심혈관질환 예방 및 진행 억제 |']","['<1-hop>\n\n| 권고 적용군 | 2형당뇨병 환자 | 진료환경 | 진료실 |\n| --- | --- | --- | --- |\n| 중재/실행지표 | 당뇨병신경병증 선별검사, 발 평가 및 관리 교육, 혈당조절 및 약물치료 시행 | 당뇨병신경병증 선별검사, 발 평가 및 관리 교육, 혈당조절 및 약물치료 시행 | 당뇨병신경병증 선별검사, 발 평가 및 관리 교육, 혈당조절 및 약물치료 시행 |\n| 비교지표 | 당뇨병신경병증 선별검사, 발 평가 및 관리 교육, 혈당조절 및 약물치료 미시행 | 당뇨병신경병증 선별검사, 발 평가 및 관리 교육, 혈당조절 및 약물치료 미시행 | 당뇨병신경병증 선별검사, 발 평가 및 관리 교육, 혈당조절 및 약물치료 미시행 |\n| 결과물 | 당뇨병신경병증 예방 및 진행 억제, 당뇨병발질환 예방 및 절단 예방과 감소, 통증 경감, 삶의 질 향상 | 당뇨병신경병증 예방 및 진행 억제, 당뇨병발질환 예방 및 절단 예방과 감소, 통증 경감, 삶의 질 향상 | 당뇨병신경병증 예방 및 진행 억제, 당뇨병발질환 예방 및 절단 예방과 감소, 통증 경감, 삶의 질 향상 |']",1.0,0.741342371371561,0.999999999975,1.0
당뇨병 환자에서 감염이 수술 후 어떤 영향을 미칠 수 있나요?,"당뇨병 환자에서 수술 후 감염은 여러 가지 부정적인 영향을 미칠 수 있습니다. 수술을 받는 동안 급격한 스트레스 호르몬 분비로 인하여 고혈당이 악화되면, 이는 수술 후 상처 치료의 지연, 수술 부위의 감염, 입원기간의 지연 또는 심지어 사망과 같은 불량한 예후와 관련이 있습니다. 따라서 당뇨병 환자는 수술 전 반드시 혈당 조절 상태를 평가받아야 하며, 특히 전신마취하 수술이 예정되어 있으면 인슐린 정주를 통한 혈당 조절이 필요합니다.","당뇨병 환자에서 감염은 수술 후 상처 치료의 지연, 수술 부위의 감염, 입원기간의 지연이나 사망 등 불량한 예후와 관련이 있다. 따라서 수술 전 반드시 혈당조절 상태에 대한 평가를 받아야 하며, 특히 전신마취 하 수술이 예정되어 있다면 인슐린 정주를 통한 혈당조절이 필요하다.","['- b) 당뇨병 환자에서 수술을 시행하게 될 경우 급격한 스트레스 호르몬 분비로 인하여 고혈당이 악화될 수 있으며,\n- 이는 수술 후 상처 치료의 지연, 수술 부위의 감염, 입원기간의 지연이나 사망 등 불량한 예후와 관련이 있다.3.4\n- 따라서 당뇨병 병력이 있는 환자는 수술 전 반드시 혈당조절 상태에 대한 평가를 받아야 한다.5 특히 전신마취\n- 하 수술이 예정되어 있다면 인슐린 정주를 통한 혈당조절이 필요하므로, 당뇨병 전문의에게 의뢰하는 것이\n- 필요하다.', '| 진료 시 고려할 점 |\n| --- |\n| · 아픈 날에도 당뇨병 치료는 계속 유지되어야 한다. · 수술 전후에 혈당조절을 철저히 하여야 한다. · 진료 의뢰: 수술을 앞둔 당뇨병 환자는 당뇨병 전문의에게 의뢰 |', '| 이익 및 불이익† |\n| --- |\n| · 이 익 - 급성합병증의 발생 감소 - 수술 전후의 위험성 감소 · 불이익 - 없음 · 당뇨병 환자에서 급성 질환의 동반 시 인슐린길항호르몬의 증가로 인한 고혈당이 유발될 수 있으며, 반대로 식사량의 감소나 영양상태 불량으로 인한 저혈당이 유발될 수도 있다. 따라서 이러한 경우 기존 약제는 그대로 사용하여 상태에 따른 용량조절이 필요하다. 또한, 당뇨병 환자에서 수술을 시행하게 될 경우 급격한 스트레스 호르몬 분비로 인하여 고혈당이 악화될 수 있으며, 이는 수술 후 상처 치료의 지연, 수술 부위의 감염, 입원기간의 지연이나 사망 등 불량한 예후와 관련이 있다. 당뇨병의 병력이 있는 환자는 반드시 수술 수 주 전에 혈당조절 상태 및 동반된 심혈관계 합병증에 대해 평가받아야 한다. 급성 질환 동반 시 기존의 약제 사용 및 용량 조절에 따른 추가적인 위해는 없으며, 수술 전 혈당조절의 평가 및 심혈관계 합병증에 대한 평가는 경제적인 이유를 제외한 다른 위해는 없으며, 오히려 수술 후 예후를 개선시킨다. |\n| 十 다학제 임상진료지침 개발위원회에서는 이익과 불이익 연계 근거를 검토하고 전문가 의견을 취합하여 논의한 결과, 권고 관련 얻을 수 있는 이익이 크고 발생 가능한 불이익이 거의 없을 것으로 판단함. |', '- a) 2형당뇨병 환자들은 당뇨병의 발병시기가 모호하며, 진단 당시부터 신증을 동반할 수 있으며, 한 연구에 의하면\n- 진단 당시부터 7-8%의 환자에서 미량알부민뇨(microalbuminuria)나 다량알부민뇨가 동반되며, 고혈압 및\n- 심혈관질환을 가지고 있는 경우도 흔하고, 신증의 동반 시 심혈관질환의 위험도가 2-3배 증가하게 된다. 메\n- 타분석에서 2형당뇨병 환자에서 미량알부민뇨를 포함한 알부민뇨의 연간 발생률은 약 8%이며, 추정 사구체\n- 여과율이 60 mL/min/1.73 m2 미만으로 감소하는 만성콩팥병의 연간 발생률이 약 2-4%로 보고되었다.\n- 따라서, 조기진단 및 치료를 위하여 처음 병원을 방문했을 때부터 당뇨병신장질환의 선별을 위해 처음 병원을\n- 방문했을 때부터 매년 요알부민배설량과 추정 사구체 여과율 검사를 시행해야 한다. 1']","['<1-hop>\n\na) 당뇨병케토산증(diabetic ketoacidosis, DKA)과 고삼투질고혈당상태(hyperosmolar hyperglycemic state,\nHHS)는 고혈당에 의한 급성합병증이다. 당뇨병 환자에게서 전신상태에 문제가 있는 경우 DKA 혹은 HHS를\n의심해야 한다. 1,2 DKA와 HHS는 인슐린이 부족한 상태에서 고혈당에 의한 세포외액 감소와 이에 따르는\n전해질 이상 및 케토산증(DKA의 경우)으로 표현되는 합병증이다. 진단되면 즉시 상급병원 응급실로 전원하되,\n전신상태에 따라 기도확보, 생리식염수와 인슐린 정주 등의 조치를 우선해야 할 수도 있다. DKA와 HHS의\n일차적인 치료는 인슐린과 체액의 보충이며, 이를 통해 혈당을 낮추고, 케톤생성을 막고, 전해질이상을 정상화\n시키는 것이다. 동시에 감염, 부적절한 인슐린치료, 혈관질환(심근경색증, 뇌경색증 등) 등의 유발인자들이\n있는지 꼭 확인해야 한다.', '<2-hop>\n\n- b) 당뇨병 환자에서 수술을 시행하게 될 경우 급격한 스트레스 호르몬 분비로 인하여 고혈당이 악화될 수 있으며,\n- 이는 수술 후 상처 치료의 지연, 수술 부위의 감염, 입원기간의 지연이나 사망 등 불량한 예후와 관련이 있다.3.4\n- 따라서 당뇨병 병력이 있는 환자는 수술 전 반드시 혈당조절 상태에 대한 평가를 받아야 한다.5 특히 전신마취\n- 하 수술이 예정되어 있다면 인슐린 정주를 통한 혈당조절이 필요하므로, 당뇨병 전문의에게 의뢰하는 것이\n- 필요하다.']",1.0,0.7027584077099213,0.999999999975,1.0
"What are the recommended screening methods for diabetic neuropathy, and how does the Michigan Neuropathy Screening Instrument Questionnaire fit into these recommendations?","당뇨병신경병증에 대한 추천 선별검사 방법은 당뇨병 진단 시 시행하고 그 이후 매년 시행하는 것입니다. 이때 사용하는 선별검사로는 Michigan Neuropathy Screening Instrument Questionnaire (MNSIQ)가 포함되며, 10 g 모노필라멘트 검사, 진동감각검사, 발목반사검사, 핀찌르기검사, 온도감각검사와 함께 사용됩니다. 이러한 검사 방법들은 원위부 대칭형 다발성신경병증의 진단에 유용하며, 2개 이상의 검사를 시행할 경우 진단적인 민감도를 87% 이상 높일 수 있습니다.","The recommended screening methods for diabetic neuropathy include conducting a screening test at the time of diabetes diagnosis and then annually thereafter. Specifically, the Michigan Neuropathy Screening Instrument Questionnaire (MNSIQ) is suggested as a screening tool alongside neurological physical examinations such as the 10 g monofilament test, vibration sensation test, ankle reflex test (Michigan Neuropathy Screening Instrument Examination, MNSIE), pinprick test, and temperature sensation test. These methods are aimed at identifying diabetic neuropathy effectively and ensuring timely intervention.","['- 76. Wong TY, Sun J, Kawasaki R, et al. Guidelines on diabetic eye care: the international\n- council of ophthalmology recommendations for screening, follow-up, referral, and\n- treatment based on resource settings. Ophthalmology 2018;125:1608-1622.\n- 77. Taylor-Phillips S, Mistry H, Leslie R, et al. Extending the diabetic retinopathy screening\n- interval beyond 1 year: systematic review. Br J Ophthalmol 2016;100:105-114.\n- 78. Wright AD, Dodson PM. Medical management of diabetic retinopathy: fenofibrate and\n- ACCORD Eye studies. Eye (Lond) 2011;25:843-849.\n- 79. Keech AC, Mitchell P, Summanen PA, et al. Effect of fenofibrate on the need for laser\n- treatment for diabetic retinopathy (FIELD study): a randomised controlled trial. Lancet\n- 2007;370:1687-1697.\n- 80. Ismail-Beigi F, Craven T, Banerji MA, et al. ACCORD Trial Group. Effect of intensive\n- treatment of hyperglycaemia on microvascular outcomes in type 2 diabetes: an analysis\n- of the ACCORD randomised trial. Lancet 2010;376:419-430.\n- 81. Boulton AJ, Vinik AI, Arezzo JC, et al. American Diabetes Association. Diabetic\n- neuropathies: a statement by the American Diabetes Association. Diabetes Care 2005;28:\n- 956-962.\n- 82. Vinik AI, Maser RE, Mitchell BD, et al. Diabetic autonomic neuropathy. Diabetes Care\n- 2003;26:1553-1579.\n- 83. Spallone V, Bellavere F, Scionti L, et al. Diabetic Neuropathy Study Group of the Italian\n- Society of Diabetology. Recommendations for the use of cardiovascular tests in\n- diagnosing diabetic autonomic neuropathy. Nutr Metab Cardiovasc Dis 2011;21:69-78.\n- 84. Bril V, England J, Franklin GM, et al. American Academy of Neurology; American\n- Association of Neuromuscular and Electrodiagnostic Medicine; American Academy of\n- Physical Medicine and Rehabilitation. Evidence-based guideline: treatment of painful\n- diabetic neuropathy: report of the American Academy of Neurology, the American\n- Association of Neuromuscular and Electrodiagnostic Medicine, and the American Academy\n- of Physical Medicine and Rehabilitation. Neurology 2011;76:1758-1765.\n- 85. CW Lee. Diagnosis and Management of Diabetic Foot. J Korean Diabetes 2018;19:\n- 168-174\n- 86. Boulton AJM, Armstrong DG, Albert SF, et al. American Diabetes Association; American\n- Association of Clinical Endocrinologists. Comprehensive foot examination and risk\n- assessment: a report of the task force of the foot care interest group of the American\n- Diabetes Association, with endorsement by the American Association of Clinical\n- Endocrinologists. Diabetes Care 2008;31:1679-1685.\n- 87. Ziegler D, Papanas N, Schnell O, et al. Current concepts in the management of diabetic\n- polyneuropathy. J Diabetes Investig 2021;12:464-475.\n- 88. Pop-Busui R, Boulton AJM, Feldman EL, et al. Diabetic neuropathy: a position statement\n- by the American Diabetes Association. Diabetes Care 2017;40:136-154.\n- 89. Callaghan BC, Little AA, Feldman EL, et al. Enhanced glucose control for preventing and', '- 1. Wong TY, Sun J, Kawasaki R, et al. Guidelines on diabetic eye care: the international\n- council of ophthalmology recommendations for screening, follow-up, referral, and treatment\n- based on resource settings. Ophthalmology 2018;125:1608-1622.\n- 2. Taylor-Phillips S, Mistry H, Leslie R, et al. Extending the diabetic retinopathy screening\n- interval beyond 1 year: systematic review. Br J Ophthalmol 2016;100:105-114.\n- 3. UK Prospective Diabetes Study Group. Intensive blood-glucose control with sulphonylureas\n- or insulin compared with conventional treatment and risk of complications in patients with\n- type 2 diabetes (UKPDS 33). Lancet 1998;352:837-853.\n- 4. UK Prospective Diabetes Study Group. Effect of intensive blood-glucose control with\n- metformin on complications in overweight patients with type 2 diabetes (UKPDS 34).\n- Lancet 1998;352:854-865.\n- 5. UK Prospective Diabetes Study Group. Tight blood pressure control and risk of macrovascular\n- and microvascular complications in type 2 diabetes (UKPDS 38). BMJ 1998;317:703-713.\n- 6. The Diabetic Retinopathy Study (DRS) Research Group. Preliminary report on the effects\n- of photocoagulation therapy: DRS Report #1. Am J Ophthalmol 1976;81:383-396.\n- 7. Early Treatment Diabetic Retinopathy Study Research Group. Photocoagulation for diabetic\n- macular edema: Early Treatment Diabetic Retinopathy Study Report No. 1. Arch Ophthalmol\n- 1985;103:1796-1806.\n- 8. Early Treatment Diabetic Retinopathy Study Research Group. Treatment techniques and\n- clinical guidelines for photocoagulation of diabetic macular edema: Early Treatment\n- Diabetic Retinopathy Study Report No. 2. Ophthalmology 1987;94:761-774.\n- 9. 대한당뇨병학회. 2021 당뇨병 진료지침. 2021.\n- 10. Ciulla TA, Amador AG, Zinman B: Diabetic retinopathy and diabetic macular edema:\n- pathophysiology, screening, and novel therapies. Diabetes Care 2003;26:2653-2664.\n- 11. Klein R. Hyperglycemia and microvascular and macrovascular disease in diabetes.\n- Diabetes Care 1995;18:258-268.\n- 12. Estacio RO, McFarling E, Biggerstaff S, et al. Overt albuminuria predicts diabetic\n- retinopathy in Hispanics with NIDDM. Am J Kidney Dis 1998;31:947-953.\n- 13. Leske MC, Wu SY, Hennis A, et al. Hyperglycemia, blood pressure, and the 9-year\n- incidence of diabetic retinopathy: the Barbados Eye Studies. Ophthalmology 2005;112:799-805.\n- 14. Chew EY, Klein ML, Ferris FL III, et al. Association of elevated serum lipid levels with\n- retinal hard exudate in diabetic retinopathy: Early Treatment of Diabetic Retinopathy Study\n- (ETDRS) Report No 22. Arch Ophthalmol 1996;114:1079-1084.\n- 15. Wright AD, Dodson PM. Medical management of diabetic retinopathy: fenofibrate and\n- ACCORD Eye Studies. Eye (Lond) 2011;25:843-849.', '| 권고 내용 | 권고등급 | 근거수준 | 권고도출 자료원 |\n| --- | --- | --- | --- |\n| · 당뇨병말초신경병증에 대한 선별검사는 당뇨병 진단 당시에 시행 하고 그 이후 매년 선별검사 시행한다. a),1) | | | B | 1, 2, 80, 81 |\n| · 신경병증의 선별검사로 당뇨병신경병증 설문(Michigan Neuropathy Screening Instrument Questionnaire, MNSIQ)과 신경학적 신체검사(10 g 모노필라멘트검사, 진동감각검사, 발목반사검사 (Michigan Neuropathy Screening Instrument Examination, MNSIE), 핀찌르기검사, 온도감각검사)를 고려한다. b),1) | II a | B | 1, 2, 80, 81 |\n| · 당뇨병신경병증의 임상양상이 비전형적이거나 감별진단이 필요한 경우 전기생리학적 검사방법을 고려할 수 있다. c),1) | llb | D | 1, 2 81 |\n| · 당뇨병자율신경병증에 대한 증상과 징후를 당뇨병 진단 당시, 그리고 이후에는 매년 평가할 것을 고려한다. d),2) | II a | B | 1, 2, 82, 83, 88 |\n| · 당뇨병신경병증의 발생 및 진행을 지연시키기 위하여 철저한 혈당 조절을 권고한다. e),3) | | | B | 89, 90 |\n| · 당뇨병신경병증의 증상을 경감시키고, 환자의 삶의 질을 향상시키기 위해서 다양한 범주의 약물치료를 고려한다. f),4) | II a | B | 1, 2, 81, 84, 87 |\n| · 매년 궤양과 절단의 위험요인을 확인하기 위해 포괄적인 발 평가를 하고, 발관리 교육을 권고한다. | | | D | 85, 86 |', '당뇨병 환자들은 1년에 한 번씩 당뇨병신경병증 설문(Michigan Neuropathy Screening Instrument\nQuestionnaire, MNSIQ)와 신경학적 신체검사인 10 g 모노필라멘트 검사, 온도/진동감각 검사(128-Hz\ntuning fork), 발목반사검사, 핀찌르기검사 등으로 원위부 대칭형 다발성신경병증에 대한 선별검사를 시행한다. 1-4\n2개 이상의 검사를 시행하면 원위부 대칭형 다발성신경병증에 대한 진단적인 민감도를 87% 이상 높일 수\n있다.6.8 당뇨병말초신경병증 진단은 환자의 전형적인 증상과 징후와 신경학적인 검사를 시행하여 진단할 수\n있다(그림 1).']","['<1-hop>\n\n| 권고 내용 | 권고등급 | 근거수준 | 권고도출 자료원 |\n| --- | --- | --- | --- |\n| · 당뇨병말초신경병증에 대한 선별검사는 당뇨병 진단 당시에 시행 하고 그 이후 매년 선별검사 시행한다. a),1) | | | B | 1, 2, 80, 81 |\n| · 신경병증의 선별검사로 당뇨병신경병증 설문(Michigan Neuropathy Screening Instrument Questionnaire, MNSIQ)과 신경학적 신체검사(10 g 모노필라멘트검사, 진동감각검사, 발목반사검사 (Michigan Neuropathy Screening Instrument Examination, MNSIE), 핀찌르기검사, 온도감각검사)를 고려한다. b),1) | II a | B | 1, 2, 80, 81 |\n| · 당뇨병신경병증의 임상양상이 비전형적이거나 감별진단이 필요한 경우 전기생리학적 검사방법을 고려할 수 있다. c),1) | llb | D | 1, 2 81 |\n| · 당뇨병자율신경병증에 대한 증상과 징후를 당뇨병 진단 당시, 그리고 이후에는 매년 평가할 것을 고려한다. d),2) | II a | B | 1, 2, 82, 83, 88 |\n| · 당뇨병신경병증의 발생 및 진행을 지연시키기 위하여 철저한 혈당 조절을 권고한다. e),3) | | | B | 89, 90 |\n| · 당뇨병신경병증의 증상을 경감시키고, 환자의 삶의 질을 향상시키기 위해서 다양한 범주의 약물치료를 고려한다. f),4) | II a | B | 1, 2, 81, 84, 87 |\n| · 매년 궤양과 절단의 위험요인을 확인하기 위해 포괄적인 발 평가를 하고, 발관리 교육을 권고한다. | | | D | 85, 86 |']",1.0,0.86771101753542,0.8055555555287036,0.6666666666666666
"What considerations should be taken into account during the management of hypertension in patients, especially when acute complications are suspected, and how does the combination of different antihypertensive medications play a role in this management?","고혈압 관리 시 고려해야 할 사항에는 약제의 효과와 부작용, 동반 질환 여부, 혈당 조절 효과, 저혈당 위험도, 체중에 대한 영향, 부작용, 치료 수용성, 비용, 환자의 선호도를 포함한 개별화된 접근이 필요합니다. 특히 급성 합병증이 의심되는 경우에는 이러한 요소를 더욱 신중하게 판단해야 합니다. 또한, 노인 환자의 경우 다약제 사용으로 인한 약물 상호작용을 예방하기 위해 위험인자의 조절에 주의를 기울여야 하며, 환자의 개별 상황을 고려하여 치료 여부를 결정해야 합니다.

항고혈압 약물의 조합은 다양한 혈압 조절 요구에 따라 효과적일 수 있으며, 이를 통해 혈압 목표 달성에 도움이 되는 경우가 많습니다. 다만, 약물 조합 시 부작용과 약물 상호작용에 대한 주의가 필요합니다.","During the management of hypertension, particularly when acute complications are suspected, it is crucial to promptly transfer the patient to a higher-level hospital. Additionally, the ACCORD study indicates that many patients with hypertension do not achieve control with a single medication and may benefit from the combination of antihypertensive drugs with different mechanisms. Using low doses of different medications can enhance blood pressure-lowering effects and improve adherence while reducing side effects. However, it is important to note that combining certain medications, such as angiotensin-converting enzyme inhibitors and angiotensin II receptor blockers, may not provide additional cardiovascular benefits and could increase the risk of side effects like hyperkalemia and acute kidney injury.","['| 진료 시 고려할 점 |\n| --- |\n| · 약제들의 효과와 부작용에 대해 잘 숙지하고, 약제 선택 시에는 동반질환(심부전, 죽상경화심혈관질환, 만성신장질환) 여부, 혈당강화 효과, 저혈당 위험도, 체중에 대한 영향, 부작용, 치료 수용성, 비용, 환자의 선호도를 고려하여 개별화한다. · 진료 의뢰: 혈당강하제의 부작용 발생, 혈당조절 불량, 집중인슐린요법 필요, 당뇨병의 급성 및 만성 합병증 으로 약제 조정이 필요한 경우 |', '| 진료 시 고려할 점 |\n| --- |\n| · 2형당뇨병과 대사증후군의 동반은 심혈관질환의 발생 위험도가 매우 높다는 것을 의미하며, 혈당뿐만 아니라 비만, 고혈압, 이상지질혈증 등 위험인자를 포함한 포괄적인 관리가 필요하다는 것을 시사한다. b) |', '- d) 노인의 특성상 당뇨병 이외의 다른 심혈관계 위험인자를 동반하고 있는 경우가 많아 이에 대한 적절한 조치가\n- 필요하다. 그러나 노인 환자에서는 지나친 위험인자의 조절이 부작용을 일으킬 수 있고 다약제 사용으로 인한\n- 약물 상호작용이 있을 수 있어 약제 선택에 항상 주의를 기울이고 환자의 치료를 통해 얻을 수 있는 이득과\n- 환자의 개별 상황을 고려하여 치료 여부를 결정할 수 있다.5,6', '- 18. Makani H, Bangalore S, Desouza KA, et al. Efficacy and safety of dual blockade of the\n- renin-angiotensin system: meta-analysis of randomised trials. BMJ 2013;346:60.\n- 19. Bakris GL, Weir MR. Study of Hypertension and the Efficacy of Lotrel in Diabetes\n- (SHIELD) Investigators. Achieving goal blood pressure in patients with type 2 diabetes:\n- conventional versus fixed-dose combination approaches. J Clin Hypertens (Greenwich)\n- 2003;5:202-209.\n- 20. Feldman RD, Zou GY, Vandervoort MK, et al. A simplified approach to the treatment of\n- uncomplicated hypertension: a cluster randomized, controlled trial. Hypertension 2009;53:\n- 646-653.\n- 21. Webster R, Salam A, de Silva HA, et al. Fixed low-dose triple combination antihypertensive\n- medication VS usual care for blood pressure control in patients with mild to moderate\n- hypertension in Sri Lanka: a randomized clinical trial. JAMA 2018;320:566-579.\n- 22. Holman RR, Paul SK, Bethel MA, et al. Long-term follow-up after tight control of blood\n- pressure in type 2 diabetes. N Engl J Med 2008;359(15):1565-1576.']","['<1-hop>\n\n- e) ACCORD 연구에서 많은 고혈압환자는 한 가지 약제로 조절되지 않고, 기전이 서로 다른 약제를 병용하였다. 13\n- 처음 사용한 일차약제에 효과가 없거나 목표혈압에 도달하지 못하는 경우 일차약제의 용량을 증가시키는 것보다\n- 서로 다른 기전의 약제를 저용량으로 병용하는 것이 혈압강하 효과와 순응도를 높이면서 부작용을 줄일 수\n- 있다. 14 두 가지 이상의 약제를 사용할 때 모든 조합의 병용이 가능하고, 어떻게 병용하는 것이 장기적인\n- 관점에서 이득이 있을 것인지는 아직 명확하지 않다. 레닌-안지오텐신계억제제, 칼슘 통로 차단제, 이뇨제\n- 중에서 두 가지 약을 병용하는 경우 비교적 좋은 결과를 보이고, 이 중 레닌-안지오텐신계억제제를 칼슘 통로\n- 차단제와 병용할 때 이뇨제와 복용하는 경우보다 우월하다는 보고가 있다.15 그러나 안지오텐신전환효소억제제와\n- 안지오텐신II수용체차단제를 함께 복용하는 경우 심혈관질환 예방에 추가적인 장점이 없고, 고칼륨혈증과 급성\n- 신손상 등 부작용이 증가할 수 있어, 이 두 약제의 병용은 권고하지 않는다. 16-18\n- 여러 연구결과들에서 혈압이 160/100 mmHg를 초과할 때는 강압효과를 극대화하고 혈압을 빠르게 조절하기\n- 위해 처음부터 서로 다른 기전을 가진 두 가지 이상 약물들의 병용요법을 고려한다. 19-21', '<2-hop>\n\n| 진료 시 고려할 점 |\n| --- |\n| · 급성합병증이 의심될 때 신속히 상급병원으로 전원한다. · 진료 의뢰: 급성합병증이 진단되면 가까운 상급병원 응급실로 바로 전원 |']",1.0,0.7988687182761683,0.999999999975,0.5
경구포도당부하검사가 당뇨병 선별검사로 권고되는 이유는 무엇인가요? 그리고 공복혈장포도당 수치가 100-125 mg/dL일 때 어떤 검사를 고려해야 하나요?,"경구포도당부하검사가 당뇨병 선별검사로 권고되는 이유는 2형당뇨병이 진단 시점 이전에 대사 이상이 진행되어 합병증이 동반되는 경우가 많기 때문에, 적극적인 선별검사가 필요하기 때문입니다. 특히 고위험군에서는 더욱 철저하게 시행되어야 합니다.

공복혈장포도당 수치가 100-125 mg/dL인 경우에는 경구당부하검사를 시행하도록 권고하고 있습니다. 이는 6-12개월 마다 공복혈당 또는 당화혈색소 검사를 고려하라는 추가 검사가 포함됩니다.","경구포도당부하검사는 당뇨병 선별검사로 권고되는 이유는 공복혈장포도당 측정, 경구포도당부하검사 혹은 당화혈색소 측정이 당뇨병 진단에 효과적이기 때문입니다. 또한, 공복혈장포도당 수치가 100-125 mg/dL인 경우에는 6-12개월마다 공복혈장포도당 또는 당화혈색소 검사를 고려해야 합니다.","['| 권고 내용 | 권고등급 | 근거수준 | 권고도출 자료원 |\n| --- | --- | --- | --- |\n| · 당뇨병 선별검사로 공복혈장포도당 측정, 경구포도당부하검사 혹은 당화혈색소 측정을 권고한다. a) | I | A | 1, 3, 25-27 |\n| · 공복혈장포도당 수치가 100-125 mg/dL 또는 당화혈색소 수치가 5.7-6.4%인 경우 6-12개월 마다 공복혈장포도당 또는 당화혈색소 검사를 고려한다.b) | II a | Guideline | 1, 3 |\n| · 혈당 측정은 정맥 전혈을 채취하여 분리한 혈장을 이용하는 것을 원칙으로 한다. 부득이하게 혈청을 이용할 경우 채혈 30분 이내에 분리할 것을 고려한다. | II a | Guideline | 1, 3 |', '- a) 선별검사의 목적은 어떤 질병을 가지고 있을 가능성이 높은 대상을 찾아내는 것으로 당뇨병은 선별검사와\n- 진단검사가 동일하다.\n- 2형당뇨병은 진단 시점 이전 상당 기간 동안 대사 이상들이 진행되어 진단 시 합병증이 동반되는 경우가 많아\n- 적극적인 선별검사가 필요하며, 특히 고위험군에서는 더욱 철저하게 시행되어야 한다. 한국인에 적절한 2형\n- 당뇨병의 위험인자는 권고요약본에 정리되어 있다.\n- b) 대한당뇨병학회에서는 공복혈당장애 혹은 당화혈색소에 따라 두 단계로 나누어 추가 검사를 시행하도록 하고\n- 있다. 즉 [1단계] 공복혈당 100-109 mg/dL, 당화혈색소 5.7-6.0%인 경우 매년 공복혈당 및 당화혈색소\n- 측정을 하고, [2단계] 공복혈당 110-125 mg/dL, 당화혈색소 6.1-6.4%인 경우 경구당부하검사를 시행하도록\n- 권고하고 있다.1\n- 2009년 국제전문가위원회에서는 당화혈색소가 장기적인 혈당 상태를 보다 정확히 반영하고, 당뇨병합병증의\n- 위험도와 좋은 상관관계를 보이며, 혈당 측정보다 안정적이라는 이유로 NGSP (National Glycohemoglobin\n- Standardization Program)에 의해 인증되고 DCCT (Diabetes Control and Complication Trial) assay에\n- 표준화된 방법을 사용했을 경우 당화혈색소 6.5% 이상을 당뇨병의 새로운 진단기준으로 포함시킬 것을 권고\n- 하였다.2 이 진단기준은 2010년 미국당뇨병학회의 진료지침에 반영되었고, 대한당뇨병학회는 2011년 진료지침\n- 에서 진단기준에 포함시켰다.', '| 권고 적용군 | 당뇨병 고위험 청소년 | 진료환경 | 진료실 |\n| --- | --- | --- | --- |\n| 중재/실행지표 | 공복혈당, 경구포도당부하 후 2시간 혈당, 당화혈색소 검사 | 공복혈당, 경구포도당부하 후 2시간 혈당, 당화혈색소 검사 | 공복혈당, 경구포도당부하 후 2시간 혈당, 당화혈색소 검사 |\n| 비교지표 | 공복혈당, 경구포도당부하 후 2시간 혈당, 당화혈색소 검사 미시행 | 공복혈당, 경구포도당부하 후 2시간 혈당, 당화혈색소 검사 미시행 | 공복혈당, 경구포도당부하 후 2시간 혈당, 당화혈색소 검사 미시행 |\n| 결과물 | 당뇨병 조기진단 | 당뇨병 조기진단 | 당뇨병 조기진단 |', '| 권고 내용 | 권고등급 | 근거수준 | 권고도출 자료원 |\n| --- | --- | --- | --- |\n| 91 선별검사 | 91 선별검사 | 91 선별검사 | 91 선별검사 |\n| · 모든 임부를 대상으로 첫 산전 방문 시 기왕의 당뇨병 여부에 대한 검사(공복혈장포도당, 무작위 혈장포도당 혹은 당화혈색소)를 하도록 권고한다. | | | A | 1, 2, 6-10 |\n| · 이전에 당뇨병이나 임신당뇨병a)으로 진단받지 않은 임부인 경우 임신 24-28주에 2시간 75 g 경구포도당부하검사를 권고한다 (1단계 접근법, one step approach). | | | A | 1, 2, 11-13 |\n| · 기존의 2단계 접근법(two step approach)을 이용할 경우는 50 g 경구포도당부하 후 1시간 혈장포도당 140 mg/dL (고위험 임부의 경우 130 mg/dL)이상이면 선별검사 양성으로 판정하여 100 g 경구포도당부하검사를 권고한다. | | | A | 1, 11-13 |\n| 91 진단기준 | 91 진단기준 | 91 진단기준 | 91 진단기준 |\n| · 첫 산전 방문 검사 시 당뇨병의 일반 진단기준 적용을 권고한다. | | | A | 1, 2, 6, 14 |\n| · 임신 24-28주 사이에 시행한 75 g 경구포도당부하검사b)에서 다음 중 하나 이상을 만족하는 경우 임신당뇨병으로 진단할 수 있다. ① 공복혈장포도당 ≥ 92 mg/dL ② 포도당부하 후 1시간 혈장포도당 ≥ 180 mg/dL ③ 포도당부하 후 2시간 혈장포도당 ≥ 153 mg/dL | lla | B | 1, 2, 6, 15 |\n| · 기존의 2단계 접근법c)으로 100 g 경구포도당부하검사를 시행한 경우는 다음 기준 중 두 가지 이상을 만족하는 경우 임신당뇨병 으로 진단할 수 있다. ① 공복혈장포도당 ≥ 95 mg/dL ② 포도당부하 후 1시간 혈장포도당 ≥ 180 mg/dL ③ 포도당부하 후 2시간 혈장포도당 ≥ 155 mg/dL ④ 포도당부하 후 3시간 혈장포도당 ≥ 140 mg/dL | lla | A | 1, 16 |']","['<1-hop>\n\n| 권고 내용 | 권고등급 | 근거수준 | 권고도출 자료원 |\n| --- | --- | --- | --- |\n| · 당뇨병 선별검사로 공복혈장포도당 측정, 경구포도당부하검사 혹은 당화혈색소 측정을 권고한다. a) | I | A | 1, 3, 25-27 |\n| · 공복혈장포도당 수치가 100-125 mg/dL 또는 당화혈색소 수치가 5.7-6.4%인 경우 6-12개월 마다 공복혈장포도당 또는 당화혈색소 검사를 고려한다.b) | II a | Guideline | 1, 3 |\n| · 혈당 측정은 정맥 전혈을 채취하여 분리한 혈장을 이용하는 것을 원칙으로 한다. 부득이하게 혈청을 이용할 경우 채혈 30분 이내에 분리할 것을 고려한다. | II a | Guideline | 1, 3 |']",1.0,0.6422349778546285,0.999999999975,1.0
2형당뇨병은 어떤 질환인지 설명해줄 수 있나요?,"2형당뇨병은 인슐린저항성(인슐린의 작용 감소)과 인슐린의 분비량 부족으로 초래되는 질환입니다. 이 두 가지 병인은 모든 당뇨병 환자에게 반드시 존재하며, 인슐린저항성이 좀 더 우세한 경우와 인슐린 분비결핍이 더 우세한 경우로 나누어질 수 있습니다. 치료할 때는 모든 환자에게서 인슐린저항성과 인슐린분비능을 함께 고려해야 장기적인 혈당 관리가 가능하다고 합니다.","제공된 맥락에서는 2형당뇨병에 대한 정보가 포함되어 있지 않습니다. 그러나 1형당뇨병에 대한 설명이 있으며, 이는 인슐린을 분비하는 췌장의 베타세포가 서서히 파괴되어 인슐린 분비가 없어지는 질환입니다. 1형당뇨병은 자가면역질환의 한 형태로 나타날 수 있으며, 자가항체가 양성으로 나타나는 경우가 많습니다. 초기에는 2형당뇨병과 구분이 어려울 수 있습니다.","['- b) 2형당뇨병은 인슐린저항성(인슐린의 작용 감소)과 인슐린의 분비량 부족으로 초래되는 질환이다. 이 두 가지\n- 병인은 모든 당뇨병 환자들에게서 반드시 존재한다. 하지만 인슐린저항성이 좀 더 우세한 경우(예를 들면\n- 비만증 동반)와 인슐린 분비결핍(예를 들면 저체중인 경우)이 더 우세한 경우로 나누어지기도 한다.1 복잡한\n- 병인을 고려하면 모든 환자들에게서 인슐린저항성과 인슐린분비능을 같이 고려하면서 치료해야 장기적인 혈당\n- 관리가 가능하다.', '| 분류 | 내용 |\n| --- | --- |\n| 1형당뇨병a),1,2 | · 췌장 베타세포 파괴에 의한 인슐린 결핍으로 발생한 당뇨병 ① 면역 매개성 ② 특발성 |\n| 2형당뇨 병b),1,2 | · 인슐린 분비 및 작용의 결함에 의해 발생한 당뇨병 |\n| 기타 당뇨병c).1.2 | ① 베타세포기능의 유전적 결함: MODY1-6, 미토콘드리아 DNA, 일부 췌도 조절자/단백질 등 ② 인슐린 작용의 유전적 결함 ③ 췌장 외분비기능장애 ④ 내분비질환: 말단비대증, 쿠싱증후군, 글루카곤증, 갈색세포종, 갑상선기능항진증, 소마토스타틴종, 알도스테론종 등 ⑤ 간질환 ⑥ 약물 유발: 당류코르티코이드, 니코틴산, 다이아족사이드, 베타-아드레날린 작용제, 티아지드, 에피네프린, 항정신병약(비정상적, 기타) 등 ⑦ 감염 ⑧ 드문 형태의 면역 매개 당뇨병 ⑨ 당뇨병과 동반될 수 있는 기타 유전적 증후군 |\n| 임신당뇨병d).1.2 (임신 중 진단된 당뇨병) | - |', '- a) 2형당뇨병 환자들은 당뇨병의 발병시기가 모호하며, 진단 당시부터 신증을 동반할 수 있으며, 한 연구에 의하면\n- 진단 당시부터 7-8%의 환자에서 미량알부민뇨(microalbuminuria)나 다량알부민뇨가 동반되며, 고혈압 및\n- 심혈관질환을 가지고 있는 경우도 흔하고, 신증의 동반 시 심혈관질환의 위험도가 2-3배 증가하게 된다. 메\n- 타분석에서 2형당뇨병 환자에서 미량알부민뇨를 포함한 알부민뇨의 연간 발생률은 약 8%이며, 추정 사구체\n- 여과율이 60 mL/min/1.73 m2 미만으로 감소하는 만성콩팥병의 연간 발생률이 약 2-4%로 보고되었다.\n- 따라서, 조기진단 및 치료를 위하여 처음 병원을 방문했을 때부터 당뇨병신장질환의 선별을 위해 처음 병원을\n- 방문했을 때부터 매년 요알부민배설량과 추정 사구체 여과율 검사를 시행해야 한다. 1', '- a) 1형당뇨병은 인슐린을 분비하는 췌장의 베타세포가 서서히 파괴되어 결국 인슐린 분비가 없어지는 질환이다.\n- 자가면역질환의 한 형태로 나타날 수 있으며 이 경우 대부분 자가항체(anti-GAD 항체)가 양성으로 나타난다.\n- 하지만 자가면역성을 증명할 수 없는 특발성의 경우 일반적으로 인슐린 결핍이 비교적 서서히 진행되어 초기에는\n- 2형당뇨병과 구분이 어려울 수 있다. 1형당뇨병은 전 연령에 걸쳐 발생하며 우리나라에서도 최근 발생률이\n- 증가하는 추세다.1']",['- a) 1형당뇨병은 인슐린을 분비하는 췌장의 베타세포가 서서히 파괴되어 결국 인슐린 분비가 없어지는 질환이다.\n- 자가면역질환의 한 형태로 나타날 수 있으며 이 경우 대부분 자가항체(anti-GAD 항체)가 양성으로 나타난다.\n- 하지만 자가면역성을 증명할 수 없는 특발성의 경우 일반적으로 인슐린 결핍이 비교적 서서히 진행되어 초기에는\n- 2형당뇨병과 구분이 어려울 수 있다. 1형당뇨병은 전 연령에 걸쳐 발생하며 우리나라에서도 최근 발생률이\n- 증가하는 추세다.1'],0.8333333333333334,0.7495737158347334,0.9999999999,0.75
"How does hypertension management relate to the treatment of 2형당뇨병 in pediatric patients, particularly in terms of medication combinations and lifestyle modifications?","고혈압 관리와 2형 당뇨병 치료는 소아청소년 환자에서 밀접한 관련이 있습니다. 혈압 측정, 생활습관 교정 및 약물 치료는 고혈압 관리에 있어 중요한 요소로, 이와 같은 접근은 당뇨병 신장 질환 및 심혈관 질환의 예방과 진행 억제에 도움을 줄 수 있습니다. 또한, 모든 새롭게 진단된 제2형 소아청소년 당뇨병 환자에게는 생활습관 조절과 자가 조절 교육, 약물 치료도 함께 고려되어야 하며, 치료 초기에는 고혈당 정도와 대사 이상 정도에 따라 치료 방침을 결정하게 됩니다. 따라서 고혈압 관리와 2형 당뇨병 치료 모두에서 생활습관 교정이 중요한 역할을 합니다.","Hypertension management in patients, including those with 2형당뇨병, often involves the use of multiple medications to achieve better blood pressure control. The ACCORD study indicates that many hypertensive patients do not achieve adequate control with a single medication and may benefit from combining drugs with different mechanisms. This approach can enhance blood pressure-lowering effects while reducing side effects. In pediatric patients diagnosed with 2형당뇨병, the recommended interventions include the administration of metformin and insulin, alongside lifestyle modifications. These lifestyle changes are crucial for improving blood sugar control, which is also a significant aspect of managing hypertension in this population. Therefore, both hypertension management and diabetes treatment emphasize the importance of medication combinations and lifestyle adjustments to optimize health outcomes.","['- a) 모든 새롭게 진단된 제2형 소아청소년 당뇨병 환자에서는 생활습관조절, 당뇨병의 자가 조절 교육 및 약물\n- 치료를 모두 고려해야 한다. 치료 초기에는 당뇨병의 임상양상이 1형인지 2형인지 불분명할 수 있어서, 치료를\n- 시작할 때에는 고혈당 정도뿐 만 아니라 대사 이상의 정도에 따라 추후의 치료방침을 결정해야 한다.1', '| 권고 적용군 | 2형당뇨병 진단된 소아청소년 | 진료환경 | 진료실 |\n| --- | --- | --- | --- |\n| 중재/실행지표 | 메트포민 투여, 인슐린 투여 | 메트포민 투여, 인슐린 투여 | 메트포민 투여, 인슐린 투여 |\n| 비교지표 | 생활습관교정 | 생활습관교정 | 생활습관교정 |\n| 결과물 | 혈당조절 개선 | 혈당조절 개선 | 혈당조절 개선 |', '| 권고 적용군 | 2형당뇨병 환자 | 진료환경 | 진료실 |\n| --- | --- | --- | --- |\n| 중재/실행지표 | 혈압 측정, 생활습관교정, 약물치료 | 혈압 측정, 생활습관교정, 약물치료 | 혈압 측정, 생활습관교정, 약물치료 |\n| 비교지표 | 혈압 측정, 생활습관교정, 약물치료 미시행 | 혈압 측정, 생활습관교정, 약물치료 미시행 | 혈압 측정, 생활습관교정, 약물치료 미시행 |\n| 결과물 | 목표혈압 도달, 당뇨병신장질환과 심혈관질환 예방 및 진행 억제 | 목표혈압 도달, 당뇨병신장질환과 심혈관질환 예방 및 진행 억제 | 목표혈압 도달, 당뇨병신장질환과 심혈관질환 예방 및 진행 억제 |', '| 권고 적용군 | 2형당뇨병 환자 | 진료환경 | 진료실 |\n| --- | --- | --- | --- |\n| 중재/실행지표 | 비만 관리(생활습관교정, 약물치료, 수술) | 비만 관리(생활습관교정, 약물치료, 수술) | 비만 관리(생활습관교정, 약물치료, 수술) |\n| 비교지표 | 비만 관리(생활습관교정, 약물치료, 수술)를 하지 않음 | 비만 관리(생활습관교정, 약물치료, 수술)를 하지 않음 | 비만 관리(생활습관교정, 약물치료, 수술)를 하지 않음 |\n| 결과물 | 체중감량, 혈당호전, 심혈관질환 및 사망률 감소, 삶의 질 향상 | 체중감량, 혈당호전, 심혈관질환 및 사망률 감소, 삶의 질 향상 | 체중감량, 혈당호전, 심혈관질환 및 사망률 감소, 삶의 질 향상 |']","['<1-hop>\n\n- e) ACCORD 연구에서 많은 고혈압환자는 한 가지 약제로 조절되지 않고, 기전이 서로 다른 약제를 병용하였다. 13\n- 처음 사용한 일차약제에 효과가 없거나 목표혈압에 도달하지 못하는 경우 일차약제의 용량을 증가시키는 것보다\n- 서로 다른 기전의 약제를 저용량으로 병용하는 것이 혈압강하 효과와 순응도를 높이면서 부작용을 줄일 수\n- 있다. 14 두 가지 이상의 약제를 사용할 때 모든 조합의 병용이 가능하고, 어떻게 병용하는 것이 장기적인\n- 관점에서 이득이 있을 것인지는 아직 명확하지 않다. 레닌-안지오텐신계억제제, 칼슘 통로 차단제, 이뇨제\n- 중에서 두 가지 약을 병용하는 경우 비교적 좋은 결과를 보이고, 이 중 레닌-안지오텐신계억제제를 칼슘 통로\n- 차단제와 병용할 때 이뇨제와 복용하는 경우보다 우월하다는 보고가 있다.15 그러나 안지오텐신전환효소억제제와\n- 안지오텐신II수용체차단제를 함께 복용하는 경우 심혈관질환 예방에 추가적인 장점이 없고, 고칼륨혈증과 급성\n- 신손상 등 부작용이 증가할 수 있어, 이 두 약제의 병용은 권고하지 않는다. 16-18\n- 여러 연구결과들에서 혈압이 160/100 mmHg를 초과할 때는 강압효과를 극대화하고 혈압을 빠르게 조절하기\n- 위해 처음부터 서로 다른 기전을 가진 두 가지 이상 약물들의 병용요법을 고려한다. 19-21', '<2-hop>\n\n| 권고 적용군 | 2형당뇨병 진단된 소아청소년 | 진료환경 | 진료실 |\n| --- | --- | --- | --- |\n| 중재/실행지표 | 메트포민 투여, 인슐린 투여 | 메트포민 투여, 인슐린 투여 | 메트포민 투여, 인슐린 투여 |\n| 비교지표 | 생활습관교정 | 생활습관교정 | 생활습관교정 |\n| 결과물 | 혈당조절 개선 | 혈당조절 개선 | 혈당조절 개선 |']",1.0,0.9013711714751024,0.9999999999666667,0.6666666666666666
"What are the recommendations for managing HDL 콜레스테롤 levels in diabetes patients, and how does this relate to the assessment of metabolic syndrome during their first visit?","당뇨병 환자에서 HDL 콜레스테롤 수치를 관리하기 위한 권고는 다음과 같습니다: HDL 콜레스테롤은 남성에서 40 mg/dL 이상, 여성에서 50 mg/dL 이상으로 조절하는 것이 권장됩니다. 또한, 혈중 지질검사(총 콜레스테롤, HDL 콜레스테롤, 중성지방, LDL 콜레스테롤)는 당뇨병 진단 시와 이후 매년 시행하는 것이 고려되어야 합니다. 

이러한 관리 방안은 첫 방문 시 대사 증후군을 평가하는 것과 관련이 있습니다. 대사 증후군은 여러 가지 대사 이상 상태들, 특히 이상 지질혈증과 관련이 있기 때문에, HDL 콜레스테롤 수치는 대사 증후군 판단에 중요한 요소로 작용합니다. 대사 증후군의 평가를 통해 당뇨병 환자의 심혈관 위험을 모니터링하고, 필요 시 조기 개입이 가능하게 됩니다.","The recommendations for managing HDL 콜레스테롤 levels in diabetes patients include considering blood lipid tests, which should be conducted at the time of diagnosis and annually thereafter. Specifically, it is advised that HDL 콜레스테롤 levels should be greater than 40 mg/dL for men and greater than 50 mg/dL for women. Additionally, during the first visit of a type 2 diabetes patient, it is recommended to evaluate for metabolic syndrome through physical measurements and blood tests. A diagnosis of metabolic syndrome should be considered if three or more of the following criteria are met: abdominal obesity, high triglycerides, low HDL 콜레스테롤, high blood pressure, or high blood glucose. Thus, monitoring HDL 콜레스테롤 is crucial in both managing diabetes and assessing metabolic syndrome.","['- 1. 대한당뇨병학회. 2021 당뇨병 진료지침. 2021.\n- 2. American Diabetes Association. Standards of Medical Care in Diabetes-2021. Diabetes\n- Care 2021;44(suppl 1):S1-S232.\n- 3. Diabetes Canada. Diabetes Canada 2018 clinical practice guidelines for the prevention and\n- management of diabetes in Canada. Can J Diabetes 2018;42:S1-S352.\n- 4. Stevens RJ, Kothari V, Adler AI, et al. United Kingdom Prospective Diabetes Study\n- (UKPDS) Group. The UKPDS risk engine: a model for the risk of coronary heart disease in\n- Type II diabetes (UKPDS 56). Clin Sci (Lond) 2001;101:671-679.\n- 5. Lawlor DA, Smith GD, Ebrahim S. Does the new International Diabetes Federation\n- definition of the metabolic syndrome predict CHD any more strongly than older\n- definitions? Findings from the British Womens Heart and Health Study. Diabetologia\n- 2006;49:41-48.\n- 6. Ryden L, Standl E, Bartnik M, et al. Task Force on Diabetes and Cardiovascular Diseases\n- of the European Society of Cardiology (ESC); European Association for the Study of\n- Diabetes (EASD): Guidelines on diabetes, pre-diabetes, and cardiovascular diseases:\n- executive summary. The Task Force on Diabetes and Cardiovascular Diseases of the\n- European Society of Cardiology (ESC) and of the European Association for the Study of\n- Diabetes (EASD). Eur Heart J 2007;28:88-136.\n- 7. Scognamiglio R, Negut C, Ramondo A, et al. Detection of coronary artery disease in\n- asymptomatic patients with type 2 diabetes mellitus. J Am Coll Cardiol 2006;47:65-71.\n- 8. Cushman WC, Evans GW, Byington RP, et al. ACCORD Study Group. Effects of intensive\n- blood-pressure control in type 2 diabetes mellitus. N Engl J Med 2010;362:1575-1585.\n- 9. Shah BR, Bhattacharyya O, Yu C, et al. Evaluation of a toolkit to improve cardiovascular\n- disease screening and treatment for people with type 2 diabetes: protocol for a\n- cluster-randomized pragmatic trial. Trials 2010;11:44.\n- 10. Hansen LJ, Siersma V, Beck-Nielsen H, et al. Structured personal care of type 2\n- diabetes: A 19 year follow-up of the study Diabetes Care in General Practice (DCGP).\n- Diabetologia 2013;56(6):1243-1253.\n- 11. Noble D, Mathur R, Dent T, et al. Risk models and scores for type 2 diabetes:\n- systematic review. BMJ (Online) 2011;343(7836):1243.\n- 12. Chung TN, Andy HL, Colin WB. Components and validity of risk scores for screening for\n- Type 2 diabetes mellitus. Diabetes Management 2012;2(5):419-425.\n- 13. Seidu S, Achana FA, Gray LJ, et al. Effects of glucose-lowering and multifactorial\n- interventions on cardiovascular and mortality outcomes: a meta-analysis of randomized\n- control trials. Diabet Med 2015;33:280-289.\n- 14. Zinman B, Wanner C, Lachin JM, et al. Empagliflozin, cardiovascular outcomes, and\n- mortality in type 2 diabetes. N Engl J Med 2015;373(22):2117-2128.\n- 15. Monami M, Dicembrini 1, Mannucci E. Effects of SGLT-2 inhibitors on mortality and', ""- 1. Stevens RJ, Kothari V, Adler AI, et al. United Kingdom Prospective Diabetes Study\n- (UKPDS) Group: the UKPDS risk engine: a model for the risk of coronary heart disease in\n- Type II diabetes (UKPDS 56). Clin Sci (Lond) 2001;101:671-679.\n- 2. American Diabetes Association (2018). Standards of medical care in diabetes 2018.\n- Diabetes Care. 2018;41(1):S86-S104.\n- 3. Laakso M. Hyperglycemia and cardiovascular disease in type 2 diabetes. Diabetes\n- 1999;48:937-942.\n- 4. Lawlor DA, Smith GD, Ebrahim S. Does the new International Diabetes Federation definition\n- of the metabolic syndrome predict CHD any more strongly than older definitions? Findings\n- from the British Womens S Heart and Health Study. Diabetologia 2006;49:41-48.\n- 5. Anderson KM, Odell PM, Wilson PW, et al. Cardiovascular disease risk profiles. Am Heart\n- J 1991;121:293-298.\n- 6. Wilson PW, D'Agostino RB, Levy D, et al. Prediction of coronary heart disease using risk\n- factor categories. Circulation 1998;97:1837-1847.\n- 7. Conroy RM, Pyorala K, Fitzgerald AP, et al. SCORE project group: Estimation of ten-year\n- risk of fatal cardiovascular disease in Europe: the SCORE project. Eur Heart J\n- 2003;24:987-1003.\n- 8. Bax JJ, Young LH, Frye RL, et al. ADA: screening for coronary artery disease in patients\n- with diabetes. Diabetes Care 2007;30:2729-2736.\n- 9. Gerson MC, Khoury JC, Hertzberg VS, et al. Prediction of coronary artery disease in a\n- population of insulin-requiring diabetic patients: results of an 8-year follow-up study. Am\n- Heart J 1988;116:820-826.\n- 10. Beckman JA, Creager MA, Libby P. Diabetes and atherosclerosis: epidemiology,\n- pathophysiology, and management. JAMA 2002;287:2570-2581.\n- 11. Wiviott SD, Raz I, Bonaca MP, et al. Dapagliflozin and cardiovascular outcomes in type 2\n- diabetes. N Engl J Med 2019;380:347-357.\n- 12. Cannon CP, Pratley R, Dagogo-Jack S, et al. Cardiovascular outcomes with ertugliflozin\n- in type 2 diabetes. N Engl J Med 2020;383:1425-1435.\n- 13. Radholm K, Figtree G, Perkovic V, et al. Canagliflozin and heart failure in type 2\n- diabetes mellitus: results from the CANVAS program. Circulation 2018;138:458-468.\n- 14. Kato ET, Silverman MG, Mosenzon O, et al. Effect of dapagliflozin on heart failure and\n- mortality in type 2 diabetes mellitus. Circulation 2019;139:2528-2536.\n- 15. Buse JB, Wexler DJ, Tsapas A, et al. 2019 Update to: management of hyperglycemia in\n- type 2 diabetes, 2018. A consensus report by the American Diabetes Association (ADA)\n- and the European Association for the Study of Diabetes (EASD). Diabetes Care\n- 2020;43:487-493.\n- 16. McMurray JJV, Solomon SD, Inzucchi SE, et al. Dapagliflozin in patients with heart failure\n- and reduced ejection fraction. N Engl J Med 2019;381:1995-2008."", '- 16. Khalifeh A, Eckler R, Felder L, et al. One-step versus two-step diagnostic testing for\n- gestational diabetes: a randomized controlled trial. Journal of maternal-fetal & neonatal\n- medicine 2020;33(4):612-617.\n- 17. Kim TH, Kim DJ, Lim S, et al. Prevalence of the metabolic syndrome in type 2 diabetic\n- patients. Korean Diabetes J 2009;33(1):40-47.\n- 18. Sung KC, Rhee EJ, Ryu S, et al. Increased cardiovascular mortality in subjects with\n- metabolic syndrome is largely attributable to diabetes and hypertension in 159,971\n- Korean adults. J Clin Endocrinol Metab 2015;100(7):2606-2612.\n- 19. Chung HS, Seo JA, Kim SG, et al. Relationship between metabolic syndrome and risk of\n- chronic complications in Koreans with type 2 diabetes. Korean Diabetes J 2009;33(5):\n- 392-400.\n- 20. Expert Panel on Detection, Evaluation, and Treatment of High Blood Cholesterol in\n- Adults. Executive Summary of The Third Report of The National Cholesterol Education\n- Program (NCEP) Expert Panel on Detection, Evaluation, And Treatment of High Blood\n- Cholesterol In Adults (Adult Treatment Panel III). JAMA 2001;285:2486-2497.\n- 21. Alberti KG, Eckel RH, Grundy SM, et al. Harmonizing the metabolic syndrome: a joint\n- interim statement of the International Diabetes Federation Task Force on Epidemiology\n- and Prevention; National Heart, Lung, and Blood Institute; American Heart Association;\n- World Heart Federation; International Atherosclerosis Society; and International\n- Association for the Study of Obesity. Circulation 2009;120:1640-1645.\n- 22. Seo MH, Lee WY, Kim SS, et al. 2018 Korean society for the study of obesity guideline\n- for the management of obesity in Korea. J Obes Metab Syndr 2019;28(1):40-45.\n- 23. Kim HY, Kim JK, Shin GG, et al. Association between abdominal obesity and\n- cardiovascular risk factors in adults with normal body mass index: based on the sixth\n- Korea National Health and Nutrition Examination Survey. J Obes Metab Syndr 2019;28(4):\n- 262-270.\n- 24. Shiferaw WS, Akalu TY, Gedefaw M, et al. Metabolic syndrome among type 2 diabetic\n- patients in Sub-Saharan African countries: a systematic review and meta-analysis.\n- Diabetes Metab Syndr 2020;14(5):1403-1411.\n- 25. Peer N, Balakrishna Y, Durao S. Screening for type 2 diabetes mellitus. Cochrane\n- Database of Systematic Reviews 2020;5:CD005266.\n- 26. Hoyer A, Rathmann W, Kuss O. Utility of HbA(1c) and fasting plasma glucose for\n- screening of Type 2 diabetes: a meta-analysis of full ROC curves. Diabet Med 2018;\n- 35(3):317-322.\n- 27. Thavorasak T, Kamkaen P, Rattanasri A, et al. Diabetic risk score and fasting plasma\n- glucose testing in the screening for type 2 diabetes mellitus risk. International journal of\n- pharmaceutical and clinical research 2017;9(6):435-438.\n- 28. Knowler WC, Barrett-Connor E, Fowler SE, et al. Diabetes prevention program research', '| 권고 내용 | 권고 등급 | 근거 수준 | 권고도출 자료원 |\n| --- | --- | --- | --- |\n| · 혈중 지질검사(총 콜레스테롤, HDL 콜레스테롤, 중성지방, LDL 콜레스테롤)는 당뇨병 진단 당시와 이후 매년 시행하는 것을 고려 한다.a) | lla | B | 81, 87 |\n| · 이상지질혈증이 있는 경우 적극적인 생활습관교정을 위한 교육을 권고한다. b) | | | A | 2, 3, 10, 79 |\n| · 당뇨병 환자의 혈중 지질이상은 적극적으로 교정하며, 다음과 같은 목표로 조절을 권고한다. 1) ① LDL 콜레스테롤 < 100 mg/dL ② 중성지방 < 150 mg/dL ③ HDL 콜레스테롤 > 40 mg/dL (남자), > 50 mg/dL (여자) | | | A | 2, 3, 77, 82 |\n| · 심혈관질환이 있거나 심혈관질환 고위험 당뇨병 환자의 경우 LDL 콜레스테롤을 70 mg/dL 미만으로 조절할 것을 고려한다. c) | II a | B | 2, 3, 76, 78, 85, 86 |\n| · 당뇨병 환자의 혈중 지질이상의 치료 시 non-HDL 콜레스테롤, Apo B 등도 치료 목표로 사용을 고려할 수 있다.d) | llb | D | 2, 3 |\n| · LDL 콜레스테롤 목표치 도달을 우선시하고, 도달하지 못한 경우 약물 치료를 하며, 일차치료약제로는 스타틴을 권고한다.e) | | | A | 84 |\n| · 적정용량의 스타틴으로 LDL 콜레스테롤 목표치에 도달하지 못한 경우 에제티미브 추가를 고려한다. f).2) | II a | A | 11, 80 |\n| · 스타틴 투여로 LDL 콜레스테롤은 목표치에 도달하였으나 중성 지방이 높거나 HDL 콜레스테롤이 낮은 경우 다른 기전의 지질강하제 (파이브레이트, 오메가-3지방산)와 병용요법을 고려할 수 있다.g) | llb | C | 2, 7, 11, 75, 83 |']","['<1-hop>\n\n| 권고 내용 | 권고등급 | 근거수준 | 권고도출 자료원 |\n| --- | --- | --- | --- |\n| · 2형당뇨병 환자의 첫 방문 시에 신체계측과 혈액검사로 대사 증후군 평가를 고려한다. | II a | B | 17-19 |\n| · 아래 기준 중 3개 이상에 해당될 때 대사증후군으로 진단할 것을 고려한다. ① 복부비만(허리둘레 남자 ≥ 90 cm, 여자 ≥ 85cm)a) ② 고중성지방혈증(중성지방 ≥ 150 mg/dL 또는 이상지질혈증약 복용) ③ 낮은 HDL 콜레스테롤(남자 < 40 mg/dL, 여자 < 50 mg/dL 또는 이상지질혈증약 복용) ④ 고혈압(혈압 ≥ 130/85 mmHg 또는 고혈압약 복용) ⑤ 고혈당(공복혈장포도당 ≥ 100 mg/dL 또는 당뇨병약 복용) | II a | A | 20-24 |', '<2-hop>\n\n| 권고 내용 | 권고 등급 | 근거 수준 | 권고도출 자료원 |\n| --- | --- | --- | --- |\n| · 혈중 지질검사(총 콜레스테롤, HDL 콜레스테롤, 중성지방, LDL 콜레스테롤)는 당뇨병 진단 당시와 이후 매년 시행하는 것을 고려 한다.a) | lla | B | 81, 87 |\n| · 이상지질혈증이 있는 경우 적극적인 생활습관교정을 위한 교육을 권고한다. b) | | | A | 2, 3, 10, 79 |\n| · 당뇨병 환자의 혈중 지질이상은 적극적으로 교정하며, 다음과 같은 목표로 조절을 권고한다. 1) ① LDL 콜레스테롤 < 100 mg/dL ② 중성지방 < 150 mg/dL ③ HDL 콜레스테롤 > 40 mg/dL (남자), > 50 mg/dL (여자) | | | A | 2, 3, 77, 82 |\n| · 심혈관질환이 있거나 심혈관질환 고위험 당뇨병 환자의 경우 LDL 콜레스테롤을 70 mg/dL 미만으로 조절할 것을 고려한다. c) | II a | B | 2, 3, 76, 78, 85, 86 |\n| · 당뇨병 환자의 혈중 지질이상의 치료 시 non-HDL 콜레스테롤, Apo B 등도 치료 목표로 사용을 고려할 수 있다.d) | llb | D | 2, 3 |\n| · LDL 콜레스테롤 목표치 도달을 우선시하고, 도달하지 못한 경우 약물 치료를 하며, 일차치료약제로는 스타틴을 권고한다.e) | | | A | 84 |\n| · 적정용량의 스타틴으로 LDL 콜레스테롤 목표치에 도달하지 못한 경우 에제티미브 추가를 고려한다. f).2) | II a | A | 11, 80 |\n| · 스타틴 투여로 LDL 콜레스테롤은 목표치에 도달하였으나 중성 지방이 높거나 HDL 콜레스테롤이 낮은 경우 다른 기전의 지질강하제 (파이브레이트, 오메가-3지방산)와 병용요법을 고려할 수 있다.g) | llb | C | 2, 7, 11, 75, 83 |']",0.2857142857142857,0.7753814033350706,0.999999999975,1.0
2형당뇨병 환자가 음주를 할 때 혈당 조절에 미치는 영향과 대사 증후군 평가를 위한 권고 사항은 무엇인가요?,"2형당뇨병 환자가 음주를 할 때 혈당 조절에 미치는 영향은 음주가 혈당 조절을 악화시키는 것으로, 금주가 권장됩니다. 음주 후 저혈당이 발생할 수 있기 때문에, 혈당 검사와 식사를 거르지 않도록 교육받는 것이 중요합니다. 또한, 음주 시 안면홍조가 나타나면 고혈당과 대사증후군의 위험이 증가할 수 있으므로 금주가 필요합니다.

대사 증후군 평가를 위한 권고 사항으로는, 2형당뇨병 환자의 첫 방문 시 신체계측과 혈액검사로 대사 증후군 평가를 고려하라고 권장하고 있습니다. 대사증후군으로 진단하기 위해서는 아래 기준 중 3개 이상에 해당하는 경우를 고려해야 합니다: 복부비만, 고중성지방혈증, 낮은 HDL 콜레스테롤, 고혈압, 고혈당.","2형당뇨병 환자가 음주를 할 때, 음주는 혈당 조절을 악화시키므로 금주를 하는 것이 좋습니다. 인슐린 또는 인슐린분비촉진제를 투여하는 환자에서는 음주 후 저혈당이 발생할 수 있으므로 혈당 검사와 식사를 거르지 않도록 미리 교육해야 합니다. 또한, 음주를 할 때 안면홍조가 생기는 경우에는 적정 음주를 하여도 고혈당과 대사증후군의 위험이 증가할 수 있으므로 금주가 필요합니다. 대사 증후군 평가를 위해서는 2형당뇨병 환자의 첫 방문 시 신체계측과 혈액검사를 고려해야 하며, 복부비만, 고중성지방혈증, 낮은 HDL 콜레스테롤, 고혈압, 고혈당 등의 기준 중 3개 이상에 해당될 때 대사증후군으로 진단할 것을 고려해야 합니다.","['- c) 음주는 혈당조절을 악화시키므로 금주를 하는 것이 좋다. 인슐린 또는 인슐린분비촉진제를 투여하는 환자에서\n- 음주 후 저혈당이 발생할 수 있으므로 혈당 검사와 식사를 거르지 않도록 미리 교육한다.\n- 음주를 할 때 안면홍조가 생기는 경우에는 적정음주를 하여도 고혈당과 대사증후군의 위험이 증가할 수 있으므로\n- 금주가 필요하다.4', '| 권고 내용 | 권고등급 | 근거수준 | 권고도출 자료원 |\n| --- | --- | --- | --- |\n| · 2형당뇨병 환자의 첫 방문 시에 신체계측과 혈액검사로 대사 증후군 평가를 고려한다. | II a | B | 17-19 |\n| · 아래 기준 중 3개 이상에 해당될 때 대사증후군으로 진단할 것을 고려한다. ① 복부비만(허리둘레 남자 ≥ 90 cm, 여자 ≥ 85cm)a) ② 고중성지방혈증(중성지방 ≥ 150 mg/dL 또는 이상지질혈증약 복용) ③ 낮은 HDL 콜레스테롤(남자 < 40 mg/dL, 여자 < 50 mg/dL 또는 이상지질혈증약 복용) ④ 고혈압(혈압 ≥ 130/85 mmHg 또는 고혈압약 복용) ⑤ 고혈당(공복혈장포도당 ≥ 100 mg/dL 또는 당뇨병약 복용) | II a | A | 20-24 |', '| 권고 적용군 | 2형당뇨병 환자 | 진료환경 | 진료실 |\n| --- | --- | --- | --- |\n| 중재/실행지표 | 대사증후군 평가 시행 | 대사증후군 평가 시행 | 대사증후군 평가 시행 |\n| 비교지표 | 대사증후군 평가 미시행 | 대사증후군 평가 미시행 | 대사증후군 평가 미시행 |\n| 결과물 | 심뇌혈관질환 예방 | 심뇌혈관질환 예방 | 심뇌혈관질환 예방 |', '| 권고 적용군 | 2형당뇨병 성인 | 진료환경 | 진료실/지역사회, 자가 |\n| --- | --- | --- | --- |\n| 중재/실행지표 | 혈당감시 | 혈당감시 | 혈당감시 |\n| 비교지표 | 혈당감시 미시행 | 혈당감시 미시행 | 혈당감시 미시행 |\n| 결과물 | 혈당조절, 합병증 감소, 저혈당 예방 | 혈당조절, 합병증 감소, 저혈당 예방 | 혈당조절, 합병증 감소, 저혈당 예방 |']","['<1-hop>\n\n- c) 음주는 혈당조절을 악화시키므로 금주를 하는 것이 좋다. 인슐린 또는 인슐린분비촉진제를 투여하는 환자에서\n- 음주 후 저혈당이 발생할 수 있으므로 혈당 검사와 식사를 거르지 않도록 미리 교육한다.\n- 음주를 할 때 안면홍조가 생기는 경우에는 적정음주를 하여도 고혈당과 대사증후군의 위험이 증가할 수 있으므로\n- 금주가 필요하다.4', '<2-hop>\n\n| 권고 내용 | 권고등급 | 근거수준 | 권고도출 자료원 |\n| --- | --- | --- | --- |\n| · 2형당뇨병 환자의 첫 방문 시에 신체계측과 혈액검사로 대사 증후군 평가를 고려한다. | II a | B | 17-19 |\n| · 아래 기준 중 3개 이상에 해당될 때 대사증후군으로 진단할 것을 고려한다. ① 복부비만(허리둘레 남자 ≥ 90 cm, 여자 ≥ 85cm)a) ② 고중성지방혈증(중성지방 ≥ 150 mg/dL 또는 이상지질혈증약 복용) ③ 낮은 HDL 콜레스테롤(남자 < 40 mg/dL, 여자 < 50 mg/dL 또는 이상지질혈증약 복용) ④ 고혈압(혈압 ≥ 130/85 mmHg 또는 고혈압약 복용) ⑤ 고혈당(공복혈장포도당 ≥ 100 mg/dL 또는 당뇨병약 복용) | II a | A | 20-24 |']",1.0,0.8189577569470471,0.9999999999666667,1.0
경구포도당부하검사에 대해 설명해줄 수 있나요? 특히 임신 중에 어떻게 사용되는지 궁금해요.,"경구포도당부하검사(GTT)는 임신당뇨병을 진단하기 위한 검사입니다. 임신 중에는 특히 임신 24-28주 사이에 2시간 75g의 경구포도당부하검사를 시행하는 것이 권장됩니다. 이 검사를 통해 다음 중 하나 이상을 만족하는 경우 임신당뇨병으로 진단할 수 있습니다: 

1. 공복혈장포도당 ≥ 92 mg/dL
2. 포도당부하 후 1시간 혈장포도당 ≥ 180 mg/dL
3. 포도당부하 후 2시간 혈장포도당 ≥ 153 mg/dL

이 검사는 임부의 혈당 수치를 평가하여 당뇨병 이환 여부를 판단하는 데에 사용됩니다. 임신 중 당뇨병이 진단된 경우, 엄격한 혈당 조절이 필요합니다.","경구포도당부하검사는 임신 중에 당뇨병을 진단하기 위해 사용됩니다. 이전에 당뇨병이나 임신당뇨병으로 진단받지 않은 임부인 경우, 임신 24-28주에 2시간 75 g 경구포도당부하검사를 권고합니다. 이 검사를 통해 공복혈장포도당, 포도당부하 후 1시간 및 2시간 혈장포도당 수치를 측정하여 임신당뇨병 여부를 판단합니다. 예를 들어, 75 g 경구포도당부하검사에서 공복혈장포도당이 92 mg/dL 이상이거나, 포도당부하 후 1시간 혈장포도당이 180 mg/dL 이상인 경우 임신당뇨병으로 진단할 수 있습니다.","['| 권고 내용 | 권고등급 | 근거수준 | 권고도출 자료원 |\n| --- | --- | --- | --- |\n| 91 선별검사 | 91 선별검사 | 91 선별검사 | 91 선별검사 |\n| · 모든 임부를 대상으로 첫 산전 방문 시 기왕의 당뇨병 여부에 대한 검사(공복혈장포도당, 무작위 혈장포도당 혹은 당화혈색소)를 하도록 권고한다. | | | A | 1, 2, 6-10 |\n| · 이전에 당뇨병이나 임신당뇨병a)으로 진단받지 않은 임부인 경우 임신 24-28주에 2시간 75 g 경구포도당부하검사를 권고한다 (1단계 접근법, one step approach). | | | A | 1, 2, 11-13 |\n| · 기존의 2단계 접근법(two step approach)을 이용할 경우는 50 g 경구포도당부하 후 1시간 혈장포도당 140 mg/dL (고위험 임부의 경우 130 mg/dL)이상이면 선별검사 양성으로 판정하여 100 g 경구포도당부하검사를 권고한다. | | | A | 1, 11-13 |\n| 91 진단기준 | 91 진단기준 | 91 진단기준 | 91 진단기준 |\n| · 첫 산전 방문 검사 시 당뇨병의 일반 진단기준 적용을 권고한다. | | | A | 1, 2, 6, 14 |\n| · 임신 24-28주 사이에 시행한 75 g 경구포도당부하검사b)에서 다음 중 하나 이상을 만족하는 경우 임신당뇨병으로 진단할 수 있다. ① 공복혈장포도당 ≥ 92 mg/dL ② 포도당부하 후 1시간 혈장포도당 ≥ 180 mg/dL ③ 포도당부하 후 2시간 혈장포도당 ≥ 153 mg/dL | lla | B | 1, 2, 6, 15 |\n| · 기존의 2단계 접근법c)으로 100 g 경구포도당부하검사를 시행한 경우는 다음 기준 중 두 가지 이상을 만족하는 경우 임신당뇨병 으로 진단할 수 있다. ① 공복혈장포도당 ≥ 95 mg/dL ② 포도당부하 후 1시간 혈장포도당 ≥ 180 mg/dL ③ 포도당부하 후 2시간 혈장포도당 ≥ 155 mg/dL ④ 포도당부하 후 3시간 혈장포도당 ≥ 140 mg/dL | lla | A | 1, 16 |', '- b) 임신당뇨병의 선별검사로는 임신 24-28주에 2시간 75 g 경구포도당부하검사가 추천된다. 임신당뇨병의\n- 진단은 공복혈장포도당 92 mg/dL 이상, 포도당부하 후 1시간 혈장포도당 180 mg/dL 이상, 포도당부하 후\n- 2시간 혈장포도당 153 mg/dL 이상 중 하나만 만족하면 된다.2 이는 HAPO 연구 결과, 임산부의 높은 혈당치와\n- 합병증 발생의 위험도가 특정한 한계치 없이 연속적인 상관관계에 있음이 반영된 것이다. 새로운 진단 기준은\n- 신생아 체중 > 90th percentile, 제대혈 C-peptide > 90th percentile, 체지방률 > 90th percentile의\n- 위험도를 평균 혈당군에 비해 1.75배 증가시키는 수치로 결정되었다.2', '| 진료 시 고려할 점 |\n| --- |\n| · 모든 임부를 대상으로 임신 초기에 당뇨병 선별검사를 시행하여 당뇨병 이환 여부를 평가해야 한다. · 임신당뇨병은 경구포도당부하검사를 시행하여 진단한다. · 임신당뇨병으로 진단된 임부는 임신기간 동안 엄격하게 혈당조절을 해야 한다. |', '| 권고 적용군 | 당뇨병 고위험 청소년 | 진료환경 | 진료실 |\n| --- | --- | --- | --- |\n| 중재/실행지표 | 공복혈당, 경구포도당부하 후 2시간 혈당, 당화혈색소 검사 | 공복혈당, 경구포도당부하 후 2시간 혈당, 당화혈색소 검사 | 공복혈당, 경구포도당부하 후 2시간 혈당, 당화혈색소 검사 |\n| 비교지표 | 공복혈당, 경구포도당부하 후 2시간 혈당, 당화혈색소 검사 미시행 | 공복혈당, 경구포도당부하 후 2시간 혈당, 당화혈색소 검사 미시행 | 공복혈당, 경구포도당부하 후 2시간 혈당, 당화혈색소 검사 미시행 |\n| 결과물 | 당뇨병 조기진단 | 당뇨병 조기진단 | 당뇨병 조기진단 |']","['| 권고 내용 | 권고등급 | 근거수준 | 권고도출 자료원 |\n| --- | --- | --- | --- |\n| 91 선별검사 | 91 선별검사 | 91 선별검사 | 91 선별검사 |\n| · 모든 임부를 대상으로 첫 산전 방문 시 기왕의 당뇨병 여부에 대한 검사(공복혈장포도당, 무작위 혈장포도당 혹은 당화혈색소)를 하도록 권고한다. | | | A | 1, 2, 6-10 |\n| · 이전에 당뇨병이나 임신당뇨병a)으로 진단받지 않은 임부인 경우 임신 24-28주에 2시간 75 g 경구포도당부하검사를 권고한다 (1단계 접근법, one step approach). | | | A | 1, 2, 11-13 |\n| · 기존의 2단계 접근법(two step approach)을 이용할 경우는 50 g 경구포도당부하 후 1시간 혈장포도당 140 mg/dL (고위험 임부의 경우 130 mg/dL)이상이면 선별검사 양성으로 판정하여 100 g 경구포도당부하검사를 권고한다. | | | A | 1, 11-13 |\n| 91 진단기준 | 91 진단기준 | 91 진단기준 | 91 진단기준 |\n| · 첫 산전 방문 검사 시 당뇨병의 일반 진단기준 적용을 권고한다. | | | A | 1, 2, 6, 14 |\n| · 임신 24-28주 사이에 시행한 75 g 경구포도당부하검사b)에서 다음 중 하나 이상을 만족하는 경우 임신당뇨병으로 진단할 수 있다. ① 공복혈장포도당 ≥ 92 mg/dL ② 포도당부하 후 1시간 혈장포도당 ≥ 180 mg/dL ③ 포도당부하 후 2시간 혈장포도당 ≥ 153 mg/dL | lla | B | 1, 2, 6, 15 |\n| · 기존의 2단계 접근법c)으로 100 g 경구포도당부하검사를 시행한 경우는 다음 기준 중 두 가지 이상을 만족하는 경우 임신당뇨병 으로 진단할 수 있다. ① 공복혈장포도당 ≥ 95 mg/dL ② 포도당부하 후 1시간 혈장포도당 ≥ 180 mg/dL ③ 포도당부하 후 2시간 혈장포도당 ≥ 155 mg/dL ④ 포도당부하 후 3시간 혈장포도당 ≥ 140 mg/dL | lla | A | 1, 16 |']",1.0,0.7949612712298006,0.999999999975,1.0
"What are the implications of hypertension management strategies for patients with type 2 diabetes, particularly in relation to the findings from the ACCORD study?","ACCORD 연구의 결과와 관련하여, 제2형 당뇨병 환자에서 고혈압 관리 전략은 중요한 함의를 가집니다. ACCORD 연구는 제2형 당뇨병 환자들에서의 집중적인 혈압 조절이 임상 결과에 미치는 영향을 조사하였으며, 이는 환자들의 심혈관 질환 예방 및 관리와 관련된 전략을 세울 때 중요한 정보가 됩니다. 고혈압의 관리는 당뇨병 환자에서 심혈관 질환의 위험을 줄이는 데 중요한 요소로 작용할 수 있습니다.

따라서, 제2형 당뇨병 환자에게 있어 효과적인 고혈압 관리 전략은 전체적인 심혈관 건강 증진과 관련이 있으며, ACCORD 연구의 결과는 이러한 관리를 위한 근거 자료로 활용될 수 있습니다.","The implications of hypertension management strategies for patients with type 2 diabetes are significant, especially in light of the findings from the ACCORD study. The study indicates that many hypertensive patients do not achieve adequate blood pressure control with a single medication and often require the combination of drugs with different mechanisms. This approach not only enhances blood pressure-lowering effects but also improves adherence and reduces side effects. For patients with type 2 diabetes, effective hypertension management is crucial as it can help prevent complications associated with diabetes, such as cardiovascular diseases. The study suggests that when blood pressure exceeds 160/100 mmHg, it is advisable to consider combination therapy from the outset, utilizing two or more medications with different mechanisms to maximize the antihypertensive effect. This strategy aligns with the broader goal of managing type 2 diabetes and its complications, including the prevention of cardiovascular diseases and the improvement of quality of life.","['- 85. Nissen SE, Tuzcu EM, Schoenhagen P, et al. Effect of intensive compared with\n- moderate lipid-lowering therapy on progression of coronary atherosclerosis: a randomized\n- controlled trial. JAMA 2004;291:1071-1080.\n- 86. Shepherd J, Barter P, Carmena R, et al. Effect of lowering LDL cholesterol substantially\n- below currently recommended levels in patients with coronary heart disease and\n- diabetes: the Treating to New Targets (TNT) study. Diabetes Care 2006;29:1220-1226.\n- 87. Stevens RJ, Kothari V, Adler AI, et al. The UKPDS risk engine: a model for the risk of\n- coronary heart disease in Type II diabetes (UKPDS 56). Clin Sci (Lond) 2001;101:\n- 671-679.\n- 88. Cushman WC, Evans GW, Byington RP, et al. ACCORD Study Group. Effects of\n- intensive blood-pressure control in type 2 diabetes mellitus. N Engl J Med 2010;362:\n- 1575-1585.\n- 89. Arnold SV, Bhatt DL, Barsness GW, et al. Clinical management of stable coronary artery\n- disease in patients with type 2 diabetes mellitus: a scientific statement from the\n- American Heart Association. Circulation 2020;141:e779-e806.\n- 90. Bakris GL, Gaxiola E, Messerli FH, et al. INVEST Investigators. Clinical outcomes in the\n- diabetes cohort of the INternational VErapamil SR-Trandolapril study. Hypertension\n- 2004;44:637-642.\n- 91. Bakris GL, Weir MR, Study of H, et al. Achieving goal blood pressure in patients with\n- type 2 diabetes: conventional versus fixed-dose combination approaches. J Clin\n- Hypertens (Greenwich) 2003;5:202-209.\n- 92. Bangalore S, Fakheri R, Toklu B, et al. Diabetes mellitus as a compelling indication for\n- use of renin angiotensin system blockers: systematic review and meta-analysis of\n- randomized trials. BMJ 2016;352:i438.\n- 93. Berl T, Hunsicker LG, Lewis JB, et al. Cardiovascular outcomes in the Irbesartan Diabetic\n- Nephropathy Trial of patients with type 2 diabetes and overt nephropathy. Ann Intern\n- Med 2003;138:542-549.\n- 94. Buckley LF, Dixon DL, Wohlford GF, et al. Intensive versus standard blood pressure\n- control in SPRINT-eligible participants of ACCORD-BP. Diabetes Care 2017;40:1733-1738.\n- 95. Cook NR, Cutler JA, Obarzanek E, et al. Long term effects of dietary sodium reduction\n- on cardiovascular disease outcomes: observational follow-up of the trials of hypertension\n- prevention (TOHP). BMJ 2007;334:885-888.\n- 96. Heart Outcomes Prevention Evaluation Study Investigators. Effects of ramipril on\n- cardiovascular and microvascular outcomes in people with diabetes mellitus: results of\n- the HOPE study and MICRO-HOPE substudy. Lancet 2000;355:253-259.\n- 97. Elmer PJ, Obarzanek E, Vollmer WM, et al. Effects of comprehensive lifestyle\n- modification on diet, weight, physical fitness, and blood pressure control: 18-month\n- results of a randomized trial. Ann Intern Med 2006;144:485-495.\n- 98. Feldman RD, Zou GY, Vandervoort MK, et al. A simplified approach to the treatment of', '- 1. 대한당뇨병학회. 2021 당뇨병 진료지침. 2021.\n- 2. Perkovic V, Heerspink HL, Chalmers J, et al. Intensive glucose control improves kidney\n- outcomes in patients with type 2 diabetes. Kidney International 2013;83(3):517-523.\n- 3. American Diabetes Association. Standards of Medical Care in Diabetes 2021. Diabetes\n- Care 2021;44(1):S111-S124.\n- 4. Maruthur NM, Tseng E, Hutfless S, et al. Diabetes medications as monotherapy or\n- metformin-based combination therapy for type 2 diabetes: a systematic review and meta-\n- analysis. Ann Intern Med 2016;164(1 1):740-751.\n- 5. Wu JH, Foote C, Blomster J, et al. Effects of sodium-glucose cotransporter-2 inhibitors\n- on cardiovascular events, death, and major safety outcomes in adults with type 2\n- diabetes: a systematic review and meta-analysis. Lancet Diabetes Endocrinol 2016;4:\n- 411-419.\n- 6. Lee G, Oh SW, Hwang SS, et al. Comparative effectiveness of oral antidiabetic drugs in\n- preventing cardiovascular mortality and morbidity: a network meta-analysis. PLoS One\n- 2017;12:e0177646.\n- 7. Marso SP, Daniels GH, Brown-Frandsen K, et al. LEADER Steering Committee; LEADER\n- Trial Investigators. Liraglutide and cardiovascular outcomes in type 2 diabetes. N Engl J\n- Med 2016;375:311-322.\n- 8. Waugh N, Cummins E, Royle P, et al. Newer agents for blood glucose control in type 2\n- diabetes: Systematic review and economic evaluation. Health Technology Assessment\n- 2010;14(36):3-247.\n- 9. Hasan ilkova, Taner Damc I , Zeynep Oar Siva, et al. The relation of changes in\n- prescribing patterns of anti-diabetic drug and HbA1c levels among patients with type 2\n- diabetes mellitus: systematic analysis of studies from the past 20 years in Turkey. Turkish\n- Journal of Endocrinology and metabolism 2011;15(4):77-105.\n- 10. Shah SN, Litwak L, Haddad J, et al. The A1chieve study: A 60,000-person, global,\n- prospective, observational study of basal, meal-time, and biphasic insulin analogs in daily\n- clinical practice. Diabetes Research and Clinical Practice 2010;88(1):11-16.\n- 11. Lee C, Joseph L, Colosimo A, et al. Mortality in diabetes compared with previous\n- cardiovascular disease: a gender-specific meta-analysis. Diabetes Metab 2012;38(5):420-427.\n- 12. Riddle MC, Vlajnic A, Zhou R, et al. Baseline HbA1c predicts attainment of 7.0% HbA1c\n- target with structured titration of insulin glargine in type 2 diabetes: a patient-level\n- analysis of 12 studies. Diabetes Obesity and Metabolism 2013;15(9):819-825.', '57. Shah SN, Litwak L, Haddad J, et al. The A1chieve study: A 60,000-person, global,\nprospective, observational study of basal, meal-time, and biphasic insulin analogs in daily\nclinical practice. Diabetes Research and Clinical Practice 2010;88(1):11-16.\n58. Wu JH, Foote C, Blomster J, et al. Effects of sodium-glucose cotransporter-2 inhibitors\non cardiovascular events, death, and major safety outcomes in adults with type 2\ndiabetes: a systematic review and meta-analysis. Lancet Diabetes Endocrinol\n2016;4:411-419.\n59. Alavian SM, Tabatabaei SV. The effect of diabetes mellitus on immunological response to\nhepatitis B virus vaccine in individuals with chronic kidney disease: a meta-analysis of\ncurrent literature. Vaccine 2010;28(22):3773-3777.\n60. Almasri L, Holtzclaw BJ. Assessing vaccine protection for older adults with diabetes: a\nsystematic review. West J Nurs Res 2021:1939459211005710.\n61. Bhattacharyya A, Seth A, Srivast N, et al. Coronavirus (COVID-19): a systematic review\nand meta-analysis to evaluate the significance of demographics and comorbidities. Res\nSq 2021;rs.3.rs-144684.\n62. Dos Santos G, Tahrat H, Bekkat-Berkani R. Immunogenicity, safety, and effectiveness of\nseasonal influenza vaccination in patients with diabetes mellitus: a systematic review.\nHum Vaccin Immunother 2018;14(8):1853-1866.\n63. Mark HS, Thomas JH, Trudy VM, et al. Use of hepatitis B vaccination for adults with\ndiabetes mellitus: recommendations of the Advisory Committee on Immunization\nPractices(ACIP). MMWR Morb Mortal Wkly Rep 2011;60(50):1709-1711.\n64. Pal R, Bhadada SK, Misra A. COVID-19 vaccination in patients with diabetes mellitus:\ncurrent concepts, uncertainties and challenges. Diabetes Metab Syndr 2021;15(2):505-508.\n65. Wolff D, Nee S, Hickey NS, et al. Risk factors for Covid-19 severity and fatality: a\nstructured literature review. Infection 2021;49(1):15-28.\n66. Plaster CP, Melo DT, Boldt V, et al. Reduction of cardiovascular risk in patients with\nmetabolic syndrome in a community health center after a pharmaceutical care program\nof pharmacotherapy follow-up. Brazilian Journal of Pharmaceutical Sciences 2012;48(3):\n435-446.\n67. Hansen LJ, Siersma V, Beck-Nielsen H, et al. Structured personal care of type 2\ndiabetes: A 19 year follow-up of the study diabetes care in general practice (DCGP).\nDiabetologia 2013;56(6):1243-1253.\n68. Kenneth CC, Janet S, Kelly RM, et al. Management of newly diagnosed type 2 diabetes\nmellitus (T2DM) in children and adolescents. Pediatrics 2013;131(2):364-382.\n69. Gillett M, Dallosso HM, Dixon S, et al. Delivering the diabetes education and self\nmanagement for ongoing and newly diagnosed (DESMOND) programme for people with\nnewly diagnosed type 2 diabetes: cost effectiveness analysis. BMJ 2010;341:c4093.\n70. Munshi MN, Segal AR, Suhl E, et al. Assessment of barriers to improve diabetes\nmanagement in older adults. Diabetes Care 2013;36(3):543-549.\n71. Plotnikoff RC, Courneya KS, Sigal RJ, et al. Alberta Diabetes and Physical Activity Trial', '- 113. Weber MA, Bakris GL, Jamerson K, et al. Cardiovascular events during differing\n- hypertension therapies in patients with diabetes. J Am Coll Cardiol 2010;56:77-85.\n- 114. Webster R, Salam A, de Silva HA, et al. Fixed low-dose triple combination\n- antihypertensive medication VS usual care for blood pressure control in patients with\n- mild to moderate hypertension in Sri Lanka: a randomized clinical trial. JAMA 2018;\n- 320:566-579.\n- 115. American Diabetes Association. 8. Obesity management for the treatment of type 2\n- diabetes: standards of medical care in diabetes. Diabetes Care 2020;43(1):S89-S97.\n- 116. Apovian CM, Aronne LJ, Bessesen DH, et al. Endocrine Society. Pharmacological\n- management of obesity: an Endocrine Society clinical practice guideline. J Clin Endocrinol\n- Metab 2015;100:342-362.\n- 117. Buchwald H, Avidor Y, Braunwald E, et al. Bariatric surgery: a systematic review and\n- meta-analysis. JAMA 2004;292(1 4):1724-1737.\n- 118. Chong K, Ikramuddin S, Lee WJ, et al. National differences in remission of type 2\n- diabetes mellitus after roux-en-y gastric bypass surgery-subgroup analysis of 2-year\n- results of the diabetes surgery study comparing taiwanese with Americans with Mild\n- Obesity (BMI 30-35 kg/m(2)). Obes Surg 2017;27:1189-1195.\n- 119. Cohen R, Le Roux CW, Junqueira S, et al. Roux-En-Y gastric bypass in type 2\n- diabetes patients with mild obesity: a systematic review and meta-analysis. Obes Surg\n- 2017;27:2733-2739.\n- 120. Davies MJ, Bergenstal R, Bode B, et al. Efficacy of liraglutide for weight loss among\n- patients with type 2 diabetes: the scale diabetes randomized clinical trial. JAMA\n- 2015;314(7):687-699.\n- 121. Garvey WT, Ryan DH, Bohannon NJ, et al. Weight-loss therapy in type 2 diabetes:\n- effects of phentermine and topiramate extended release. Diabetes Care 2014;37(12):\n- 3309-3316.\n- 122. Hollander P, Gupta AK, Plodkowski R, et al. Effects of naltrexone sustained-\n- release/bupropion sustained-release combination therapy on body weight and glycemic\n- parameters in overweight and obese patients with type 2 diabetes. Diabetes Care\n- 2013;36(12):4022-4029.\n- 123. Ji G, Li P, Li W, et al. The effect of bariatric surgery on asian patients with type 2\n- diabetes mellitus and body mass index < 30 kg/m2: a systematic review and meta-\n- analysis.. Obes Surg 2019;29(8):2492-2502.\n- 124. Kasama K, Mui W, Lee WJ, et al. IFSO-APC consensus statements 2011. Obes Surg\n- 2012;22(5):677-684.\n- 125. Korean Society for the Study of Obesity. 2020 Korean Society for the study of obesity\n- guideline for the management of obesity in Korea. 2020.\n- 126. Lean ME, Leslie WS, Barnes AC, et al. Primary care-led weight management for']","['<1-hop>\n\n- e) ACCORD 연구에서 많은 고혈압환자는 한 가지 약제로 조절되지 않고, 기전이 서로 다른 약제를 병용하였다. 13\n- 처음 사용한 일차약제에 효과가 없거나 목표혈압에 도달하지 못하는 경우 일차약제의 용량을 증가시키는 것보다\n- 서로 다른 기전의 약제를 저용량으로 병용하는 것이 혈압강하 효과와 순응도를 높이면서 부작용을 줄일 수\n- 있다. 14 두 가지 이상의 약제를 사용할 때 모든 조합의 병용이 가능하고, 어떻게 병용하는 것이 장기적인\n- 관점에서 이득이 있을 것인지는 아직 명확하지 않다. 레닌-안지오텐신계억제제, 칼슘 통로 차단제, 이뇨제\n- 중에서 두 가지 약을 병용하는 경우 비교적 좋은 결과를 보이고, 이 중 레닌-안지오텐신계억제제를 칼슘 통로\n- 차단제와 병용할 때 이뇨제와 복용하는 경우보다 우월하다는 보고가 있다.15 그러나 안지오텐신전환효소억제제와\n- 안지오텐신II수용체차단제를 함께 복용하는 경우 심혈관질환 예방에 추가적인 장점이 없고, 고칼륨혈증과 급성\n- 신손상 등 부작용이 증가할 수 있어, 이 두 약제의 병용은 권고하지 않는다. 16-18\n- 여러 연구결과들에서 혈압이 160/100 mmHg를 초과할 때는 강압효과를 극대화하고 혈압을 빠르게 조절하기\n- 위해 처음부터 서로 다른 기전을 가진 두 가지 이상 약물들의 병용요법을 고려한다. 19-21', '<2-hop>\n\n| 권고 적용군 | 2형당뇨병 환자 | 진료환경 | 진료실 |\n| --- | --- | --- | --- |\n| 중재/실행지표 | 지방간 선별검사 및 관리 | 지방간 선별검사 및 관리 | 지방간 선별검사 및 관리 |\n| 비교지표 | 지방간 선별검사 및 관리 하지 않음 | 지방간 선별검사 및 관리 하지 않음 | 지방간 선별검사 및 관리 하지 않음 |\n| 결과물 | 지방간질환 진행 억제, 2형당뇨병합병증 감소, 심혈관질환 예방, 삶의 질 향상 | 지방간질환 진행 억제, 2형당뇨병합병증 감소, 심혈관질환 예방, 삶의 질 향상 | 지방간질환 진행 억제, 2형당뇨병합병증 감소, 심혈관질환 예방, 삶의 질 향상 |']",1.0,0.9603979777457569,0.9999999999,0.5
