user_input,response,reference,retrieved_contexts,reference_contexts,faithfulness,answer_relevancy,context_precision,context_recall
"당뇨병 급성합병증이 의심될 때, 환자를 신속히 상급병원으로 전원하는 것이 왜 중요한가?","당뇨병 급성합병증이 의심될 때 환자를 신속히 상급병원으로 전원하는 것은 급성합병증의 빠른 진단이 사망률을 감소시키고, 선행인자를 확인하여 치료에 도움이 되기 때문입니다. 이러한 조치는 환자의 생명을 구할 수 있는 중요한 단계로, 적절한 치료를 받을 수 있는 환경으로의 전원이 필수적입니다. 급성합병증은 심각한 상태를 초래할 수 있으므로, 신속한 대응이 환자의 예후에 긍정적인 영향을 미칠 수 있습니다.","당뇨병 급성합병증이 의심될 때 환자를 신속히 상급병원으로 전원하는 것은 매우 중요하다. 급성합병증은 당뇨병 환자를 사망에 이르게 할 수 있는 중요한 합병증으로, 빠른 진단이 사망률을 감소시키는 데 기여한다. 또한, 선행인자를 확인하면 치료에 도움이 되므로, 적절한 치료를 받을 수 있는 상급병원으로의 신속한 전원은 환자의 생명을 구하는 중요한 조치로 여겨진다.","['121\nⅢ. 당뇨병과 합병증\n6. 당뇨병 급성합병증\n권고 적용군 2형당뇨병 환자 진료환경 진료실\n중재/실행지표 당뇨병 급성합병증 진단 및 전원\n비교지표 당뇨병 급성합병증의 진단 및 전원이 늦어지거나 하지 않음\n결과물 급성합병증(당뇨병케토산증 또는 고삼투질고혈당상태) 예방 및 적절한 치료\n권고 내용 권고등급 근거수준 권고도출\n자료원\n∙ 당뇨병케토산증 또는 고삼투질고혈당상태가 의심되는 전신상태가 \n불량한 고혈당 환자는 신속히 상급병원으로의 전원을 권고한다. B\nⅠA  1 ,  3 ,  9 1\n이익 및 불이익 †\n∙ 이  익\n - 급성합병증의 빠른 진단은 사망률을 감소시킴\n - 선행인자를 확인하면 치료에 도움이 됨\n∙ 불이익\n -  없 음\n∙ 당뇨병의 급성합병증은 당뇨병 환자를 사망에 이르게 할 수 있는 매우 중요한 합병증이다. 따라서 이에\n대한 진단은 매우 빠르고 적절하게 이루어져야 하며 이를 충분히 치료할 수 있는 상급병원으로의 신속한 \n전원은 환자의 사망률에 영향을 미칠 수 있는 중요한 조치로 이로 인해 얻을 수 있는 이득이 매우 \n크며 위해는 거의 없다.\n† 다학제 임상진료지침 개발위원회에서는 이익과 불이익 연계 근거를 검토하고 전문가 의견을 취합하여 논의한 \n결과, 권고 관련 얻을 수 있는 이익이 크고 발생 가능한 불이익이 거의 없을 것으로 판단함.\n진료 시 고려할 점\n∙ 급성합병증이 의심될 때 신속히 상급병원으로 전원한다.\n∙ 진료 의뢰: 급성합병증이 진단되면 가까운 상급병원 응급실로 바로 전원', '117\nⅢ. 당뇨병과 합병증\n진료 시 고려할 점\n∙ 모든 2형당뇨병 환자는 당뇨병 진단 당시 당뇨병말초신경병증에 대한 선별검사를 시행해야 한다.\n∙ 진료 의뢰: 당뇨병발질환, 궤양 및 말초혈관질환이 발생하면 상급병원으로 의뢰\n 근거 설명\na) 당뇨병신경병증\n당뇨병신경병증은 다양한 임상 증상들이 나타날 수 있으며 국소적이기도 하고 전신적으로 나타나기도 한다. \n신경병증들 중에서 가장 흔한 것은 당뇨병말초신경병증인 만성 감각운동성 원위부 대칭형 다발성신경병증과 \n자율신경병증이다.\x12\x0e\x15\n우리나라의 당뇨병신경병증 유병률은 33-53%이다.\x16\x01당뇨병 환자에서 신경병증의 조기진단과 관리는 다음과 \n같은 이유에서 중요하다.\x13\r\x17\n   ① 당뇨병이 아닌 다른 원인에 의한 신경병증이 동반되어 있을 수 있으며 이런 경우 치료가 가능하다.\n   ② 증상이 있는 당뇨병신경병증에 대한 치료 선택 약물이 다양하다.\n   ③ 원위부 대칭형 다발성신경병증의 50% 이상에서 증상이 없을 수 있는데 이런 경우 환자 자신의 발에 스스로  \n감지하지 못하는 상처가 발생할 위험이 높다.\n   ④ 자율신경병증은 전신의 모든 부분을 침범할 수 있다. \n   ⑤ 당뇨병자율신경병증은 이환율, 사망률, 삶의 질 감소와 일상생활에 제한을 가져오며 특히 심혈관계 자율신경병증 \n환자는 5년 사망률이 높은 질환이다.\n신경 손상에 대한 근본적인 치료는 아직까지 요원하므로 혈당조절을 잘하는 것만이 신경병증의 진행을 \n억제할 수 있고 드물게는 신경손상을 회복시킬 수도 있다.']","['<1-hop>\n\n121\n Ⅲ. 당뇨병과 합병증\n 6. 당뇨병 급성합병증\n권고 적용군 2형당뇨병 환자 진료환경 진료실\n중재/실행지표 당뇨병 급성합병증 진단 및 전원\n비교지표 당뇨병 급성합병증의 진단 및 전원이 늦어지거나 하지 않음\n결과물 급성합병증(당뇨병케토산증 또는 고삼투질고혈당상태) 예방 및 적절한 치료\n 권고 내용 권고등급 근거수준 권고도출\n자료원\n∙ 당뇨병케토산증 또는 고삼투질고혈당상태가 의심되는 전신상태가 \n불량한 고혈당 환자는 신속히 상급병원으로의 전원을 권고한다. B\nⅠA  1 ,  3 ,  9 1\n 이익 및 불이익 †\n∙ 이  익\n - 급성합병증의 빠른 진단은 사망률을 감소시킴\n - 선행인자를 확인하면 치료에 도움이 됨\n∙ 불이익\n -  없 음\n∙ 당뇨병의 급성합병증은 당뇨병 환자를 사망에 이르게 할 수 있는 매우 중요한 합병증이다. 따라서 이에\n대한 진단은 매우 빠르고 적절하게 이루어져야 하며 이를 충분히 치료할 수 있는 상급병원으로의 신속한 \n전원은 환자의 사망률에 영향을 미칠 수 있는 중요한 조치로 이로 인해 얻을 수 있는 이득이 매우 \n크며 위해는 거의 없다.\n† 다학제 임상진료지침 개발위원회에서는 이익과 불이익 연계 근거를 검토하고 전문가 의견을 취합하여 논의한 \n결과, 권고 관련 얻을 수 있는 이익이 크고 발생 가능한 불이익이 거의 없을 것으로 판단함.\n', '<2-hop>\n\n진료 시 고려할 점\n∙ 급성합병증이 의심될 때 신속히 상급병원으로 전원한다.\n∙ 진료 의뢰: 급성합병증이 진단되면 가까운 상급병원 응급실로 바로 전원']",1.0,0.831654050104215,0.99999999995,1.0
"당뇨병 환자에서 심혈관 사건의 예방과 관련하여, 제2형 당뇨병 환자에서의 혈당 조절의 중요성은 무엇인가요?","제2형 당뇨병 환자에서 혈당 조절은 심혈관 사건의 예방에 중요한 역할을 합니다. 철저한 혈당 조절은 당뇨병 합병증을 예방할 수 있으며, 여러 연구에서 미세혈관합병증과 대혈관합병증의 발생을 줄이는 데 효과적임이 입증되었습니다. 특히, 심근경색증 발생률과 총사망률을 낮추는 데도 긍정적인 영향을 미쳤습니다. 

또한, 혈당 조절이 잘 이루어질 경우, 심혈관질환의 이환율과 사망률을 낮추는 예방 프로그램을 적용할 수 있는 기회를 제공하며, 조기 진단과 치료를 통해 심혈관질환의 위험을 감소시킬 수 있습니다. 그러나 모든 환자에게 동일한 효과가 있는 것은 아니며, 특정 조건에서는 덜 엄격한 치료가 더 나은 결과를 가져올 수 있습니다. 따라서, 혈당 조절의 목표는 개별 환자의 상태에 따라 조정되어야 합니다.","제2형 당뇨병 환자에서의 혈당 조절은 심혈관 사건의 예방에 중요한 역할을 합니다. UKPDS 연구에 따르면, 혈당 조절을 강화하면 심혈관 합병증의 위험을 줄일 수 있으며, HbA1c 수치와 혈관 합병증 및 사망 간의 연관성이 입증되었습니다. 또한, ACCORD, ADVANCE, VA 당뇨병 시험들은 심혈관 사건 예방을 위한 혈당 조절의 중요성을 강조하고 있습니다.","['b) 2형당뇨병에서 고혈압, 고지혈증 등에 대한 치료들이 심혈관질환의 위험을 감소시키는 것이 잘 증명되어 있지만, \n심혈관질환을 완전히 예방할 수 있는 치료는 없다. 그러므로 심혈관질환을 조기에 진단하는 것이 무엇보다 중요\n하다. 당뇨병 환자에게서 증상이 없는 심혈관질환을 진단하는 것은 (1) 추후의 심장병 이환율과 사망률을 \n낮추는 예방 프로그램을 적용할 수 있고, (2) 항혈소판 약제 치료를 시작하고, (3) 혈관재형성 시술이 필요한 \n환자를 조기에 발견한다는 장점이 있다. 심혈관질환의 재발 예방에 대한 연구들에서 당뇨병 환자를 대상으로 \n분석한 결과를 보면, 적극적인 치료가 심혈관질환의 이환율과 사망률을 낮추는데 효과적임을 알 수 있다.', '38\n 근거 설명\na) 철저한 혈당조절은 당뇨병합병증을 예방할 수 있다. Kumamoto 연구 \x14와 UK Prospective Diabetes Study \n(UKPDS)\x15, 비교적 오랜 유병 기간을 가진 당뇨병 환자들을 대상으로 했던 Action in Diabetes and \nVascular Disease: Preterax and Diamicron MR Controlled Evaluati on (ADVANCE)과 Veterans \nAffairs Diabetes Trial (VADT) 연구에서도 철저한 혈당조절은 미세혈관합병증의 발생을 줄였다\x16. UKPDS에서는 \n심근경색증 발생률과 총사망률도 줄일 수 있었다. 철저한 혈당조절로 실제 도달했던 당화혈색소는 Kumamoto \n연구와 UKPDS에서 7.0-7.4%였고, ADVANCE, VADT 연구에서는 6.5-6.9%였다. Kumamoto 연구자들은 \n미세혈관합병증을 예방하기 위한 혈당조절 목표로 당화혈색소 6.5% 미만을 제시하였고, ADVANCE 연구에서 \n대혈관합병증을 줄일 수 있는 당화혈색소의 역치는 7.0%, 미세혈관합병증에 대해서는 6.5%라 보고했다\n\x13. 이런 \n연구 결과들을 고려할 때 2형당뇨병 성인에게서 일반적인 혈당조절의 목표는 6.5% 미만이 적절할 것이다.\nb) 모든 환자들이 적극적인 혈당조절의 이득을 얻을 수 있는 것은 아니다. 일부 연구에서는 합병증 예방효과를 \n입증하지 못했고, ACCORD 연구에서는 적극적인 치료가 오히려 사망률을 높이는 결과도 보여 주었다\n[hazard ratio 1.22 (95% CI 1.01 to 1.46)] \x16. 사망률 증가의 기전으로 적극적인 치료군에서 높을 수밖에 \n없는 저혈당을 주목하였으나, 직접적인 연관성은 밝혀지지 않았다. 이후 사후(post-hoc)분석에서 연구 참여 \n당시 혈당조절이 나쁘지 않았거나, 심혈관질환이 없었던 환자들에게서는 적극적인 혈당조절의 이점이 관찰\n되었다. 반면 당뇨병 유병 기간이 길거나, 심한 저혈당의 발생 병력이 있던 경우, 고령이거나 노쇠한 경우, \n심한 죽상경화증을 갖고 있는 경우에서는 오히려 덜 엄격한 치료가 나은 결과를 보였다. 여러 연구 결과들을 \n종합하면, 혈당을 철저히 조절하는 것은 합병증 예방에 확실한 이득을 가져다준다.']","['<1-hop>\n\n86\nand the prevention of cardiovascular events: implications of th e ACCORD, ADVANCE, and \nVA diabetes trials: a position statement of the American Diabet es Association and a \nscientific statement of the Ameri can College of Cardiology Foun dation and the American \nHeart Association. Dia betes Care 2009;32:187-192. \n17. ', '<2-hop>\n\nUK Prospective Diabetes Study (UKPDS) Group. Intensive blood -glucose control with \nsulphonylureas or insulin compared with conventional treatment and risk of complications \nin patients with type 2 diabetes (UKPDS 33). Lancet 1998;352:83 7-853.\n18. Zoungas S, Chalmers J, Ninomiya T, et al. Advance Collaborat ive Group. Association of \nHbA1c levels with vascular complications and death in patients with type 2 diabetes: \nevidence of glycaemic thresho lds. Diabetologia 2012;55:636-643.\n19. Ajjan RA, Jackson N, Thomson SA, et al. Reduction in HbA1c u sing professional flash \nglucose monitoring in insulin-t reated type 2 diabetes patients managed in primary and \nsecondary care settings: a pilot, multicentre, randomised contr olled trial. Diab Vasc Dis \n2019;16(4):385-395.\n20. Beck RW, Riddlesworth TD, Ruedy K, et al. Continuous glucose  monitoring versus usual \ncare in patients with type 2 diabetes receiving multiple daily insulin injections: a \nrandomized trial. Ann Intern Med 2017;167:365-374.\n21. Nathan DM, Genuth S, Lachin J, et al. Diabetes Control and C omplications Trial Research \nGroup. The effect of intensive treatment of diabetes on the dev elopment and \nprogression of long-term com plications in insulin-dependent dia betes mellitus. N Engl J \nMed 1993;329:977-986.\n22. Haak T, Hanaire H, Ajjan R, et al. Flash glucose-sensing te chnology as a replacement \nfor blood glucose monitoring for the management of insulin-trea ted type 2 diabetes: a \nmulticenter, open-label randomized controlled trial. Diabetes T her 2017;8:55-73.\n23. Ida S, Kaneko R, Murata K, et al. Utility of real-time and r etrospective continuous glucose \nmonitoring in patients with type 2 diabetes mellitus: a meta-an alysis of randomized \ncontrolled trials. J Diabetes Res 2019;2019:4684815.\n24. Mannucci E, Antenore A, Giorgino F, et al. Effects of struct ured versus unstructured \nself-monitoring of blood glucose on glucose control in patients  with non-insulin-treated \ntype 2 diabetes: a meta-analysis of randomized controlled trial s. J Diabetes Sci Technol \n2018;12(1):183-189.\n25. Xu Y, Tan DHY, Lee JYC, et al. Evaluating the impact of self -monitoring of blood \nglucose frequencies on glucose control in patients with type 2 diabetes who do not use \ni n s u l i n :  a  s y s t e m a t i c  r e v i e w  a n d  m e t a - a n a l y s i s .  I n t  J  C l i n  P r a ct 2019;73(7):e13357.\n2 6 .Y a r o n  M ,  R o i t m a n  E ,  A h a r o n - H a n a n e l  G ,  e t  a l .  E f f e c t  o f  f l a s h glucose monitoring \ntechnology on glycemic control and treatment satisfaction in pa tients with type 2 \ndiabetes. Diabetes Care 2019;42(7):1178-1184.\n27. Young LA, Buse JB, Weaver MA, et al. Glucose self-monitoring  in non-insulin-treated \npatients with type 2 diabetes in primary care settings: a rando mized trial. JAMA Intern \nMed 2017;177(7):920-929.', '<3-hop>\n\n38\n  r A I , N e i l H A, et al. Association of glycaem ia with macrovascular and microvascular complications of type 2 diabetes (UKPDS 35): pros pective observational study. BMJ 2000;321:405-412. 2. Zoungas S, Chalmers J, Ninomiya T, et al. Association of HbA1 c levels with vascular complications and death in patients with type 2 diabetes: evide nce of glycaemic thresholds. Diabetologia 2012;55:636-643. 3. Ohkubo Y, Kishikawa H, Araki E, et al. Intensive insulin ther apy prevents the progression of diabetic microvascular complications in Japanese patients wi th non-insulin-dependent diabetes mellitus: a randomized prospective 6-year study. Diabe tes Res Clin Pract 1995;28:103-117. 4. UK Prospective Diabetes Study (UKPDS) Group. Intensive blood- glucose control with sulphonylureas or insulin compared with conventional treatment and risk of complications']",1.0,0.0,0.99999999995,1.0
"대사증후군과 관련하여 2형당뇨병 환자에서 지방간질환의 유병률이 어떻게 영향을 미치는지, 그리고 이러한 연관성이 심혈관질환의 위험도에 어떤 의미를 가지는지 설명해 주세요.","2형당뇨병 환자에서 대사증후군과 지방간질환은 밀접한 연관성을 가지고 있으며, 지방간질환의 유병률은 60-75%에 이릅니다. 이러한 높은 유병률은 대사증후군의 주요 인자들과 관련이 있으며, 비만, 이상지질혈증, 고혈압 등이 심혈관질환의 위험인자로 작용합니다. 

대사증후군이 있는 2형당뇨병 환자는 심혈관계 질환의 발생 및 사망률이 증가하는데, 이는 지방간질환이 대혈관 및 미세혈관 합병증의 위험을 높이기 때문입니다. 따라서 지방간질환과 대사증후군의 존재는 심혈관질환의 위험도를 예측하고 관리하는 데 중요한 요소로 작용합니다. 이러한 연관성을 이해하는 것은 환자의 초기 평가와 치료 전략 수립에 있어 매우 중요합니다.","대사증후군은 2형당뇨병과 밀접한 연관이 있으며, 이 두 가지가 동반될 경우 심혈관질환의 발생 위험도가 매우 높아진다. 특히, 지방간질환은 비만, 당뇨병, 이상지질혈증, 대사증후군 등과 밀접한 연관성을 보인다. 연구에 따르면, 당뇨병 환자에서 지방간질환의 유병률은 60-75%에 달하며, 이는 대혈관 및 미세혈관 합병증의 위험 증가와 만성신장질환과도 관련이 있다. 따라서, 대사증후군을 관리하는 것은 심혈관질환의 예방과 관련하여 매우 중요하다.","['b) 2형당뇨병과 대사증후군은 인슐린 저항성이 중심이 되는 질환으로 매우 밀접한 관련성을 보인다. 우리나라 \n2형당뇨병 환자에서 대사증후군을 동반하고 있는 비율은 80%에 달하며, \x16 이러한 환자에서 심혈관계 질환의 \n발생 및 사망률이 더욱 증가하리라는 것은 지극히 당연하다. 대사증후군이 있는 환자에서 대사증후군이 없는 \n환자에 비해 심혈관계 질환으로 인한 사망률이 1.6배 증가하며, 이러한 사망률의 증가에는 당뇨병이 주된 \n기여를 하는 것으로 보고되었다. \x17 또한 2형당뇨병 환자에서 대사증후군이 동반되었을 때 대혈관합병증뿐만 \n아니라 미세혈관합병증의 발생 역시 증가되었다. \x18 잘 알려진 바와 같이 대사증후군의 주된 인자들인 비만, \n이상지질혈증 및 고혈압은 2형당뇨병 환자의 심혈관질환 발생에 중요한 위험인자로 작용한다. 따라서 2형\n당뇨병 환자의 초기 평가 시 신체 계측과 혈액검사를 통하여 대사증후군을 평가하는 것은 심혈관질환의 발생 \n위험도를 미리 예측하고 위험인자들을 관리하는 차원에서 매우 중요하다.  \n 참 고 문 헌\n1. DeFronzo RA, Ferrannini E. Insulin resistance - a multifacete d syndrome responsible for \nNIDDM, obesity, hypertension, dyslipidemia and atherosclerotic cardiovascular disease. \nDiabetes Care 1991;14:173-194.\n2. Executive summary of the third report of the National Cholest erol Education Program \n(NCEP) expert panel on detection, evaluation, and treatment of high blood cholesterol in \nadults (Adult treatment p anel III). JAMA 2001;285:2486-2497.', '\x15\r\x16\n∙ 2형당뇨병 환자에게 지방간 관리를 위해 유산소 또는 저항성 신체활동을 강력하게 권유해야 한다. \n왜냐하면 운동요법 이점이 체중감량에만 국한되지 않고 지방간질환을 동반한 당뇨병 환자에서 간효소 \n및 인슐린저항성을 개선하는 것으로 확인되었다. \x17\r\x18 의학영양요법 및 운동요법을 결합한 포괄적 접근\n방식은 특히 장기간 지방간질환 환자에게 상당한 이점을 보여주었지만, 포괄적 생활습관교정 중재가 \n개별적인 의학영양요법 및 운동요법보다 시너지효과가 있는 것에 대해서는 분명하지 않다. 체중감소 \n목표에 도달하지 못한 생활습관교정이 지방간질환을 동반한 2형당뇨병 환자에 미치는 효과에 대해 \n명확하지 않을 수 있지만, 저열량 영양요법과 운동요법 중 하나 또는 포괄적 생활습관교정이 심혈관질환의 \n위험과 2형당뇨병합병증 진행을 감소시키는 것은 분명하다.\n\x17\r\x18\n 근거 설명\na) 지방간질환은 진단방법, 연령, 성별 및 인종에 따라 차이가 있지만 메티분석에 의하면 전 세계적으로 성인의 \n25.2%에 영향을 미치는 가장 흔한 간질환이며, 한국인 일반성인의 지방간질환의 유병률은 16.1%에서 \n25.2%까지 다양하다.\x15\x01지방간질환은 비만, 당뇨병, 이상지질혈증, 대사증후군 등과 밀접한 연관성을 보인다. \x19 \n당뇨병 환자에서 지방간질환의 유병률은 60-75%까지로 높게 보고되며, \x01대혈관 및 미세혈관 합병증의 위험 \n증가뿐 아니라 만성신장질환과 관련이 있다는 연구가 있다.\x15 2형당뇨병 환자에서 지방간질환에 대한 선별검사가 \n비용 효과적임을 보고한 연구가 있다.\x19\nb) 지방간질환에 대한 초기 혈액검사에 대한 합의는 이루어지지 않았다. 간 혈액검사의 범위 및 결과의 해석은 \n임상적 맥락에서 판단되어야 한다. ALT 수치는 지방간과 상관관계가 가장 좋은 단일 생화학적 수치이지만,']","['<1-hop>\n\nⅠ.  당뇨병 총론\n25\n 진료 시 고려할 점\n∙ 2형당뇨병과 대사증후군의 동반은 심혈관질환의 발생 위험도가 매우 높다는 것을 의미하며, 혈당뿐만 \n아니라 비만, 고혈압, 이상지질혈증 등 위험인자를 포함한 포괄적인 관리가 필요하다는 것을 시사한다. C\n  위험도를 미리 예측하고 위험인자들을 관리하는 차원에서 매우 중요하다. 참 고 문 헌 1. DeFronzo RA, Ferrannini E. Insulin resistance - a multifacete d syndrome responsible for NIDDM, obesity, hypertension, dyslipidemia and atherosclerotic cardiovascular disease. Diabetes Care 1991;14:173-194. 2. Executive summary of the third report of the National Cholest erol Education Program (NCEP) expert panel on detection, evaluation, and treatment of high blood cholesterol in adults (Adult treatment p anel III). JAMA 2001;285:2486-2497.', '<2-hop>\n\n근거 설명\na) 지방간질환은 진단방법, 연령, 성별 및 인종에 따라 차이가 있지만 메티분석에 의하면 전 세계적으로 성인의 \n25.2%에 영향을 미치는 가장 흔한 간질환이며, 한국인 일반성인의 지방간질환의 유병률은 16.1%에서 \n25.2%까지 다양하다.\x15\x01지방간질환은 비만, 당뇨병, 이상지질혈증, 대사증후군 등과 밀접한 연관성을 보인다. \x19 \n당뇨병 환자에서 지방간질환의 유병률은 60-75%까지로 높게 보고되며, \x01대혈관 및 미세혈관 합병증의 위험 \n증가뿐 아니라 만성신장질환과 관련이 있다는 연구가 있다.\x15 2형당뇨병 환자에서 지방간질환에 대한 선별검사가 \n비용 효과적임을 보고한 연구가 있다.\x19\nb) 지방간질환에 대한 초기 혈액검사에 대한 합의는 이루어지지 않았다. 간 혈액검사의 범위 및 결과의 해석은 \n임상적 맥락에서 판단되어야 한다. ALT 수치는 지방간과 상관관계가 가장 좋은 단일 생화학적 수치이지만, ']",1.0,0.6415132677140237,0.99999999995,1.0
