user_input,response,reference,retrieved_contexts,reference_contexts,faithfulness,answer_relevancy,context_precision,context_recall
인슐린저항성이란 무엇인가요?,"인슐린저항성은 인슐린의 작용이 감소하는 상태를 의미합니다. 이는 인슐린이 정상적으로 작용하지 않아 혈당 조절에 어려움을 겪게 되는 상황을 나타냅니다. 인슐린저항성은 2형당뇨병의 주요 병인 중 하나로, 일반적으로 비만증과 같은 조건과 관련이 있습니다.","인슐린저항성은 인슐린의 작용이 감소하는 상태로, 2형당뇨병의 주요 원인 중 하나입니다. 이 질환은 인슐린의 분비량 부족과 함께 발생하며, 모든 당뇨병 환자에게 반드시 존재하는 두 가지 병인 중 하나입니다.","['1형당뇨병은 전 연령에 걸쳐 발생하며 우리나라에서도 최근 발생률이 \n증가하는 추세다.\n\x12\nb) 2형당뇨병은 인슐린저항성(인슐린의 작용 감소)과 인슐린의 분비량 부족으로 초래되는 질환이다. 이 두 가지 \n병인은 모든 당뇨병 환자들에게서 반드시 존재한다. 하지만 인슐린저항성이 좀 더 우세한 경우(예를 들면 \n비만증 동반)와 인슐린 분비결핍(예를 들면 저체중인 경우)이 더 우세한 경우로 나누어지기도 한다. \x12 복잡한 \n병인을 고려하면 모든 환자들에게서 인슐린저항성과 인슐린분비능을 같이 고려하면서 치료해야 장기적인 혈당\n관리가 가능하다.', 'Ⅰ. 당뇨병 총론\n17\n1. 당뇨병 분류\n분류 내용\n1형당뇨병B\n\r\x12\r\x13\n∙ 췌장 베타세포 파괴에 의한 인슐린 결핍으로 발생한 당뇨병\n① 면역 매개성\n② 특발성\n2형당뇨병C\n\r\x12\r\x13 ∙ 인슐린 분비 및 작용의 결함에 의해 발생한 당뇨병\n기타 당뇨병 D\n\r\x12\r\x13\n① 베타세포기능의 유전적 결함: MODY1-6, 미토콘드리아 DNA, 일부 췌도\n조절자/단백질 등\n② 인슐린 작용의 유전적 결함\n③ 췌장 외분비기능장애\n④ 내분비질환: 말단비대증, 쿠싱증후군, 글루카곤증, 갈색세포종, 갑상선기능항진증,\n소마토스타틴종, 알도스테론종 등\n⑤ 간질환\n⑥ 약물 유발: 당류코르티코이드, 니코틴산, 다이아족사이드, 베타-아드레날린 \n작용제, 티아지드, 에피네프린, 항정신병약(비정상적, 기타) 등\n⑦ 감염\n⑧ 드문 형태의 면역 매개 당뇨병\n⑨ 당뇨병과 동반될 수 있는 기타 유전적 증후군\n임신당뇨병\nE\n\r\x12\r\x13\n(임신 중 진단된 당뇨병) -\n 근거 설명\na) 1형당뇨병은 인슐린을 분비하는 췌장의 베타세포가 서서히 파괴되어 결국 인슐린 분비가 없어지는 질환이다. \n자가면역질환의 한 형태로 나타날 수 있으며 이 경우 대부분 자가항체(anti-GAD 항체)가 양성으로 나타난다. \n하지만 자가면역성을 증명할 수 없는 특발성의 경우 일반적으로 인슐린 결핍이 비교적 서서히 진행되어 초기에는 \n2형당뇨병과 구분이 어려울 수 있다. 1형당뇨병은 전 연령에 걸쳐 발생하며 우리나라에서도 최근 발생률이 \n증가하는 추세다.\n\x12\nb) 2형당뇨병은 인슐린저항성(인슐린의 작용 감소)과 인슐린의 분비량 부족으로 초래되는 질환이다. 이 두 가지 \n병인은 모든 당뇨병 환자들에게서 반드시 존재한다.']",['임신당뇨병\nE\n\r\x12\r\x13\n(임신 중 진단된 당뇨병) -\n 근거 설명\na) 1형당뇨병은 인슐린을 분비하는 췌장의 베타세포가 서서히 파괴되어 결국 인슐린 분비가 없어지는 질환이다. \n자가면역질환의 한 형태로 나타날 수 있으며 이 경우 대부분 자가항체(anti-GAD 항체)가 양성으로 나타난다. \n하지만 자가면역성을 증명할 수 없는 특발성의 경우 일반적으로 인슐린 결핍이 비교적 서서히 진행되어 초기에는 \n2형당뇨병과 구분이 어려울 수 있다. 1형당뇨병은 전 연령에 걸쳐 발생하며 우리나라에서도 최근 발생률이 \n증가하는 추세다.\n\x12\nb) 2형당뇨병은 인슐린저항성(인슐린의 작용 감소)과 인슐린의 분비량 부족으로 초래되는 질환이다. 이 두 가지 \n병인은 모든 당뇨병 환자들에게서 반드시 존재한다. 하지만 인슐린저항성이 좀 더 우세한 경우(예를 들면 \n비만증 동반)와 인슐린 분비결핍(예를 들면 저체중인 경우)이 더 우세한 경우로 나누어지기도 한다. \x12 복잡한 \n병인을 고려하면 모든 환자들에게서 인슐린저항성과 인슐린분비능을 같이 고려하면서 치료해야 장기적인 혈당\n관리가 가능하다. '],1.0,0.8319274817334238,0.99999999995,1.0
당뇨병 교육팀의 협력은 효과적 자기관리를 어떻게 지원하나요?,당뇨병 교육팀의 협력은 효과적 자기관리를 지원하는 데 중요한 역할을 합니다. 팀 구성원들은 전문성을 가지고 서로 협력하여 원활한 의사소통과 열린 토론을 통해 정보를 공유합니다. 이러한 협력은 환자가 새로운 문제에 직면하거나 새로운 치료법을 이용할 때 지속적인 교육과 지지를 제공하여 자기관리 능력을 향상시키는 데 기여합니다. 각 분야의 전문가들이 함께 참여함으로써 환자는 보다 포괄적이고 효과적인 관리 방법을 배우고 적용할 수 있습니다.,"당뇨병 교육팀에는 의사, 간호사, 영양사 등 최소한 한 명 이상의 전문가가 포함되어야 하며, 이들은 원활한 의사소통과 열린 토론을 통해 서로 협력합니다. 이러한 협력은 환자가 새로운 문제에 부딪히거나 새로운 치료법을 이용할 때 지속적인 정보 제공을 가능하게 하여 효과적 자기관리를 지원합니다.","['62\n자기관리교육은 당뇨병 진단시점에 바로 시행하는 것을 권고하며 이는 환자로 하여금 효과적 자기관리를 시작할 \n수 있도록 하며 당뇨병에 대한 적극적 대처를 가능하게 한다. \x19 추후 필요에 따라 지속적 교육과 지지는 일생\n동안 환자가 새로운 문제에 부딪히거나 새로운 치료법을 이용할 때 효과적 자기관리를 가능하게 한다. \x19\nb) 당뇨병 교육팀에는 최소한 한 명 이상의 의사, 간호사 혹은 영양사가 포함되는 것을 권고하며, 그 외 운동 \n처방사, 사회복지사, 약사, 발전문가, 지역사회전문가가 포함될 수 있다.\x1a\r\x12\x11 모든 팀 구성원은 전문성을 가지고 \n있어야 하며, 원활한 의사소통과 열린 토론을 할 수 있도록 서로 협력하고, 지속적으로 각 분야별 정보를 \n제공해야 한다. \n 참 고 문 헌\n1. Norris SL, Engelgau MM, Narayan KM. Effectiveness of self-man agement training in type \n2 diabetes: a systematic review of randomized controlled trials . Diabetes Care 2001; \n24:561-587.\n2. Norris SL, Lau J, Smith SJ, et al. Self-management education for adults with type 2 \ndiabetes: a meta-analysis of the effect on glycemic control. Di abetes Care 2002;25: \n1159-1171.\n3. Warsi A, Wang PS, LaValley MP, et al. Self-management educati on programs in chronic \ndisease: a systematic review and methodological critique of the  literature. Arch Intern \nMed 2004;164:1641-1649.\n4. Trento M, Fornengo P, Amione C, et al. Self-management educat ion may improve blood \npressure in people with type 2 diabetes. A randomized controlle d clinical trial. Nutr Metab \nCardiovasc Dis 2020;30(11):1973-1979.\n5. Boren SA, Fitzner KA, Panhalk ar PS, et al. Costs and benefits  associated with diabetes \neducation: a review of the literature. Diabetes Educ 2009;35:72 -96.\n6. Huang L, Guo H, Xiu L, et al. Efficacy of individualized educ ation in patients with type 2 \ndiabetes mellitus: a randomized clinical study protocol. Medici ne (Baltimore) 2020;99(50): \ne23625.\n7 . K o d a m a  S ,  M o r i k a w a  S ,  H o r i k a w a  C ,  e t  a l .  E f f e c t  o f  f a m i l y - o r iented diabetes programs on \nglycemic control: a meta-analy sis. Fam Pract 2019;36(4):387-394 . \n8. Funnell MM, Brown TL, Childs BP, et al. National standards fo r diabetes self-management \neducation. Diabetes Care 2007;30:1630-1637.\n9. Korean Diabetes Association. Education guideline for diabetes . 3th ed. Seoul: Gold \nPlanning and Development. 2006. p.597-608.\n10. Kim HS. Role of diabetes educators and effectiveness of diab etes education. J Korean \nDiabetes 2013;14:194-198.', '61\nⅡ. 당뇨병 관리\n7. 당뇨병 자기관리교육\n권고 적용군 2형당뇨병 환자 진료환경 진료실, 교육실\n중재/실행지표 당뇨병 자기관리교육 시행 \n비교지표 당뇨병 자기관리교육 미시행\n결과물 혈당, 혈압 등 임상지표 호전\n권고 내용 권고등급 근거수준 권고도출\n자료원\n∙ 당뇨병 자기관리교육은 치료비용을 줄이고 치료 결과를 향상 \n시키므로 당뇨병이 진단된 시점 및 추후 필요에 따라 자기관리\n교육 시행을 권고한다.\nB\nⅠA 2, 4, 5, 8, \n12, 66-74\n∙ 당뇨병 자기관리교육은 전문적 훈련과 지속적 교육을 통해 \n자격을 갖춘 교육자가 시행하는 것을 고려한다. C\nⅡa B 2, 5, 68-71\n이익 및 불이익 †\n∙ 이  익\n - 혈당(당화혈색소), 혈압 등 임상지표 호전\n - 합병증 조기 발생 감소\n - 치료비용 감소\n - 효율적 자기관리\n - 삶의 질 향상\n∙ 불이익\n -  없 음\n∙ 당뇨병은 약물치료만으로 관리하기 어렵고 식사, 운동 등 자기관리가 매우 중요한 영향을 끼친다. 이를 \n위해 자기관리교육을 가급적 진단 초기에, 개별화하여 가족교육 방식으로 시행하는 것이 효과적이며, \n별다른 위해는 없다.\n† 다학제 임상진료지침 개발위원회에서는 이익과 불이익 연계 근거를 검토하고 전문가 의견을 취합하여 논의한 \n결과, 권고 관련 얻을 수 있는 이익이 크고 발생 가능한 불이익이 거의 없을 것으로 판단함.\n 근 거  설 명\na) 많은 연구에서 당뇨병 자기관리교육을 통해 관련 지식 및 자기관리행동이 향상되고, \x12 당화혈색소, 혈압 등 \n임상지표가 호전되며,\x13\r\x14\r\x15 체중감량 및 삶의 질 향상, \x12 건전한 심리적 대처, 비용 절감과  연관있다는 결과를 보고\n하였다.\x16\x01개별화된 당뇨병관리교육이 임상지표의 호전을 보였고,\x17 가족교육을 하는 것이 자기관리능력을 높인다.\x18']","['<1-hop>\n\n62\n 자기관리교육은 당뇨병 진단시점에 바로 시행하는 것을 권고하며 이는 환자로 하여금 효과적 자기관리를 시작할 \n수 있도록 하며 당뇨병에 대한 적극적 대처를 가능하게 한다. \x19 추후 필요에 따라 지속적 교육과 지지는 일생\n동안 환자가 새로운 문제에 부딪히거나 새로운 치료법을 이용할 때 효과적 자기관리를 가능하게 한다. \x19\nb) ', '<2-hop>\n\n당뇨병 교육팀에는 최소한 한 명 이상의 의사, 간호사 혹은 영양사가 포함되는 것을 권고하며, 그 외 운동 \n처방사, 사회복지사, 약사, 발전문가, 지역사회전문가가 포함될 수 있다.\x1a\r\x12\x11 모든 팀 구성원은 전문성을 가지고 \n있어야 하며, 원활한 의사소통과 열린 토론을 할 수 있도록 서로 협력하고, 지속적으로 각 분야별 정보를 \n제공해야 한다. \n 참 고 문 헌\n1. Norris SL, Engelgau MM, Narayan KM. Effectiveness of self-man agement training in type \n2 diabetes: a systematic review of randomized controlled trials . Diabetes Care 2001; \n24:561-587.\n2. Norris SL, Lau J, Smith SJ, et al. Self-management education for adults with type 2 \ndiabetes: a meta-analysis of the effect on glycemic control. Di abetes Care 2002;25: \n1159-1171.\n3. Warsi A, Wang PS, LaValley MP, et al. Self-management educati on programs in chronic \ndisease: a systematic review and methodological critique of the  literature. Arch Intern \nMed 2004;164:1641-1649.\n4. Trento M, Fornengo P, Amione C, et al. Self-management educat ion may improve blood \npressure in people with type 2 diabetes. A randomized controlle d clinical trial. Nutr Metab \nCardiovasc Dis 2020;30(11):1973-1979.\n5. Boren SA, Fitzner KA, Panhalk ar PS, et al. Costs and benefits  associated with diabetes \neducation: a review of the literature. Diabetes Educ 2009;35:72 -96.\n6. Huang L, Guo H, Xiu L, et al. Efficacy of individualized educ ation in patients with type 2 \ndiabetes mellitus: a randomized clinical study protocol. Medici ne (Baltimore) 2020;99(50): \ne23625.\n7 . K o d a m a  S ,  M o r i k a w a  S ,  H o r i k a w a  C ,  e t  a l .  E f f e c t  o f  f a m i l y - o r iented diabetes programs on \nglycemic control: a meta-analy sis. Fam Pract 2019;36(4):387-394 . \n8. Funnell MM, Brown TL, Childs BP, et al. National standards fo r diabetes self-management \neducation. Diabetes Care 2007;30:1630-1637.\n9. Korean Diabetes Association. Education guideline for diabetes . 3th ed. Seoul: Gold \nPlanning and Development. 2006. p.597-608.\n10. Kim HS. Role of diabetes educators and effectiveness of diab etes education. J Korean \nDiabetes 2013;14:194-198. ']",1.0,0.820964324328178,0.99999999995,1.0
"소아청소년에서 당뇨병 위험요인이 있는 경우, 어떤 검사가 필요하며, 1형과 2형 당뇨병의 구별을 위해 어떤 검사가 필요한가?","소아청소년에서 당뇨병 위험요인이 있는 경우, 3년에 한 번씩 공복혈당 검사가 필요합니다. 또한, 1형과 2형 당뇨병의 구별을 위해 췌장 자가항체 검사를 확인해야 합니다.","소아청소년에서 당뇨병 위험요인이 있는 경우, 3년에 한 번씩 공복혈당 검사가 필요하다. 또한, 소아청소년기 당뇨병 발병 시 1형과 2형 당뇨병의 구별이 쉽지 않으므로 췌장 자가항체 검사를 확인해야 한다.","['136\n진료 시 고려할 점\n∙ 과체중 소아에서 당뇨병 위험요인이 있는 경우, 3년에 한 번씩 공복혈당 검사가 필요하다.\n∙ 소아청소년기 당뇨병 발병 시 1형과 2형당뇨병의 구별이 쉽지 않으므로 췌장 자가항체 검사 확인이 \n필요하다.\n∙ 진료 의뢰: 소아청소년 당뇨병 진단 환자는 당뇨병 전문의에게 의뢰\n 근거 설명\na) 최근 소아청소년기 2형당뇨병 발병률이 빠르게 증가하고 있다.\x12 세계적으로 소아청소년기 2형당뇨병은 과거에는 \n소아청소년기 전체 당뇨병의 10% 미만으로 알려졌으나, 최근 보고에 따르면 20-30% 이상 차지하는 것으로 \n나타나 빠른 속도로 증가하는 것으로 알려졌으며, 국내 여러 기관에서도 이와 비슷한 보고를 하고 있다.\n\x12\r\x13 이 는  \n소아청소년 비만의 급격한 증가와 밀접하게 관련되어 있는 것으로 보고되고 있으며, 이미 전 세계적인 문제가 \n되었다.\x12 따라서 모든 소아청소년 진료에 있어 건강한 식습관, 규칙적인 신체활동, 적정 체중유지에 관한 지도가 \n고려되어야 한다.\x12\r\x14 \nb) 과체중 소아에서 당뇨병 위험요인이 있는 경우, 소아청소년기 당뇨병을 예방하고, 조기진단하여 향후 당뇨병합\n병증을 감소시키기 위해 3년에 한 번씩 공복혈당 검사가 필요하다. \x14\r\x15 체질량지수 백분위수가 증가하면 검사를 \n더 자주 실시해야 한다.\n 참 고 문 헌\n1. Copeland KC, Silverstein J, Moore KR, et al. American Academy  of Pediatrics. \nManagement of newly diagnosed type 2 Diabetes Mellitus (T2DM) i n children and \nadolescents. Pediatrics. 2013;131(2):364-382.\n2. Hwang JS. Type 2 diabetes mellitus and metabolic syndrome. Ko rean J Pediatr. 2006; \n49(7):710-717. \n3. Panagiotopoulos C, Riddell MC, Sellers EA. Canadian Diabetes Association Clinical Practice \nGuidelines Expert Committee. Type 2 diabetes in children and ad olescents. Can J \nDiabetes. 2013; 37:S163-S167.\n4. American Diabetes Association. Standards of Medical Care in D iabetes-2021. Diabetes \nCare 2021;44(suppl 1):S1-S232.', '135\nⅣ. 당뇨병과 특수상황\n2. 소아청소년기 당뇨병 ①\n권고 적용군 당뇨병 고위험 청소년 진료환경 진료실\n중재/실행지표 공복혈당, 경구포도당부하 후 2시간 혈당, 당화혈색소 검사\n비교지표 공복혈당, 경구포도당부하 후 2시간 혈당, 당화혈색소 검사 미시행\n결과물 당뇨병 조기진단\n권고 내용 권고등급 근거수준 권고도출\n자료원\n∙ 모든 소아청소년 진료에 건강한 식습관, 규칙적인 신체활동, 적정 \n체중 유지에 관한 지도를 고려한다.\nⅡa Guideline 3, 4\n∙ 비만한 소아청소년에게 건강한 체중을 유지하기 위해 의학영양\n요법과 운동요법, 가족상담 및 가족중심 행동치료를 포함한 적극적인\n생활습관교정을 고려한다. B\n\x01\nⅡa A 2, 4, 6\n7, 8\n∙ 과체중(연령 성별 체질량지수 85 백분위수 이상)인 소아청소년에서 \n10세 이상 또는 더 적은 연령이더라도 사춘기로 판단되면 다음 \n조건에 2가지 이상 만족될 경우, 3년에 한 번씩 2형당뇨병 선별\n검사로 공복혈장포도당 검사를 고려할 수 있다.\nC\n  ① 2형당뇨병의 가족력이 있을 경우\n  ② 인슐린저항성의 증상 또는 징후가 있을 경우(흑색가시세포증, \n고혈압, 이상지질혈증, 다낭난소증후군, 저출생체중아)\n  ③ 어머니가 본인 임신 시 당뇨병 또는 임신당뇨병에 이환되었던 경우\nⅡb D 2, 3, 4, \n9, 10\n이익 및 불이익 †\n∙ 이  익 \n - 소아청소년기 당뇨병 예방 및 조기진단\n - 당뇨병합병증 감소\n∙ 불이익\n -  없 음\n∙ 소아청소년에서 2형당뇨병은 최근 증가하고 있다. 소아청소년 2형당뇨병은 베타세포의 기능저하가 \n빠르게 진행하고 합병증 발생이 빠르기 때문에 위험집단에서 선별검사가 필요하다.']","['<1-hop>\n\n136\n 진료 시 고려할 점\n∙ 과체중 소아에서 당뇨병 위험요인이 있는 경우, 3년에 한 번씩 공복혈당 검사가 필요하다.\n∙ 소아청소년기 당뇨병 발병 시 1형과 2형당뇨병의 구별이 쉽지 않으므로 췌장 자가항체 검사 확인이 \n필요하다.\n∙ 진료 의뢰: 소아청소년 당뇨병 진단 환자는 당뇨병 전문의에게 의뢰\n ']",1.0,0.742344811228114,0.99999999995,1.0
International Association of Diabetes and Pregnancy Study Groups의 역할은 무엇인가요?,"International Association of Diabetes and Pregnancy Study Groups는 임신 중 고혈당의 진단 및 분류에 대한 권장 사항을 제시하는 역할을 합니다. 이들은 임신부를 대상으로 한 당뇨병 관리의 기준을 설정하고, 임신성 당뇨병의 진단 방법을 통일하는 데 기여합니다.","International Association of Diabetes and Pregnancy Study Groups (IADPSG)는 임신당뇨병의 진단 기준을 설정하고, 임신 중 당뇨병의 관리 및 치료에 대한 지침을 제공하는 역할을 합니다. 2010년 IADPSG Consensus Panel 보고서에서는 첫 산전 방문 시 발견되는 당뇨병을 임신당뇨병이 아닌 기왕의 당뇨병으로 규정하였습니다.","['Ⅰ. 당뇨병 총론\n23\nc) 기존의 임신당뇨병의 진단은 1단계 접근법과 2단계 접근법이 혼용되어 사용되어 왔으며 선별검사의 고위험군만을 \n선택하는 선택적 선별검사(selective screening)와 모든 임신부에서 시행하는 일반적 선별검사(univ ersal \nscreening)로 양분되어 있었다. \x14 그런데 2010 IADPSG 보고서는 모든 임산부를 대상으로 1단계 접근법 \n시행으로 통일시켰다. 하지만 IADPSG에서 제시하고 있는 기준에 대한 국내 연구 자료가 아직까지 없으므로 \n추후 검증될 때까지는 기존의 1단계 접근법과 2단계 접근법(100 g 경구당부하검사를 시행하여 공복, 1시간, \n2시간, 3시간의 기준치 95 mg/dL, 180 mg/dL, 155 mg/dL, 140 mg/dL 중에서 둘 이 상을 만족하는 \n경우)을 이용할 수도 있겠다.\n\x15\n 참 고 문 헌\n1. Metzger BE, Buchanan TA, Coustan DR, et al. Summary and recom mendations of the \nFifth International Workshop-Conference on Gestational Diabetes  Mellitus. Diabetes Care \n2007;30(2):S251-S60.\n2. International Association of Diabetes and Pregnancy Study Gro ups Consensus Panel. \nInternational Association of Diabetes and Pregnancy Study Group s recommendations on \nthe diagnosis and classification of hyperglycemia in pregnancy.  Diabetes Care 2010;33: \n676-682.\n3. The HAPO Study Cooperative Research Group. Hyperglycemia and adverse pregnancy \noutcomes. N Engl J Med 2008;358:1991-2002.\n4. 장학철, 조영민, 박경수, 등. 새로운 진단기준에 따른 한국인 임신성 당뇨병 임신부의 임신 결과. 당뇨병 \n2004;28:122-130.', 'Comparison of an  insulin analog, insulin \naspart, and regular human insulin with no insulin in gestationa l diabetes mellitus. Diabetes \nCare 2003;26(1):183-186.\n4. Mathiesen ER, Hod M, Ivanisevic M, et al. Maternal efficacy a nd safety outcomes in a \nrandomized, controlled trial comparing insulin detemir with NPH  insulin in 310 pregnant \nwomen with type 1 diabetes. Diabetes Care 2012;35(10):2012-2017 .\n5. American Diabetes Association. Standards of Medical Care in D iabetes-2021. Diabetes \nCare 2021;44(suppl 1):S1-S232.\n6. Kitzmiller JL, Block JM, Brown FM, et al. Managing preexistin g diabetes for pregnancy: \nsummary of evidence and consensus recommendations for care. Dia betes Care 2008; \n31(5):1060-1079.\n7. American Diabetes Association Po sition statement: gestational  diabetes mellitus. Diabetes \nCare 2003;26(1):S103-S105.\n8. 박보경, 박정은, 장학철, 등. 임신성당뇨병 임신부에서 탄수화물 제한 식사요법이 임신 중 혈당에 미치는 \n영향. 대한영양의학회지 2001;3:137-147.\n9. 장학철, 박정은, 임창훈, 등. 경증 임신성당뇨병 임신부에서 자가혈당측정이 임신 성적에 미치는 영향. 당\n뇨병 2001;25:93-102.\n10. Castorino K, Jovanovi č L. Pregnancy and diabetes management: advances and controversie s. \nClin Chem 2011;57(2):221-230.\n1 1 .d e  V e c i a n a  M ,  M a j o r  C A ,  M o r g a n  M A ,  e t  a l .  P o s t p r a n d i a l  v e r s us preprandial blood \nglucose monitoring in women with gestational diabetes mellitus requiring insulin therapy. \nN Engl J Med 1995;333:1237-1241.']","['근거 설명\na) 임신당뇨병은 임신 중에 처음 시작되었거나 발견되는 당불내성(carbohydrate intolerance)으로  정의되어 \n왔으나,\x12 2010년 International Association of Diabetes and Pregnancy Stud y Groups (IADPSG) \nConsensus Panel 보고서에서는 첫 산전 방문 시에 발견되는 당뇨병은 임신당뇨병이 아닌 기왕의 당뇨병으로 \n규정하였다.\x12 임신당뇨병은 임신과 관련된 합병증으로 3-14%에서 발생하며, 임신 중에 발생하는 가장 흔한 \n내과적 합병증의 하나이다. 임신당뇨병은 임신고혈압, 분만 시 손상, 난산, 임산부의 당뇨병 발생과 관련이 있고 \n거대아, 신생아 저혈당, 신생아 골절 및 신경손상 등 주산기 합병증 등을 유발하며 장기적으로는 자녀의 비만과 \n당뇨병의 위험을 증가시킨다고 알려져 왔다. 임신당뇨병을 진단하고 치료함으로써 위와 같은 주산기 합병증을 \n감소시킬 수 있는가에 대한 자료가 많지 않지만, 최근의 무작위 임상시험에서 임신당뇨병을 치료함으로써 \n주산기 이환율이 감소된다는 것이 증명되었다. 그러나 아직까지도 임신당뇨병의 선별검사와 진단기준에 대하여 \n논란이 계속되고 있다. \nb) 임신당뇨병의 선별검사로는 임신 24-28주에 2시간 75 g 경구포도당부하검사가 추천된다. 임신당뇨병의 \n진단은 공복혈장포도당 92 mg/dL 이상, 포도당부하 후 1시간 혈장포도당 180 mg/dL 이상, 포도당부하 후 \n2시간 혈장포도당 153 mg/dL 이상 중 하나만 만족하면 된다.\n\x13 이는 HAPO 연구 결과, 임산부의 높은 혈당치와 \n합병증 발생의 위험도가 특정한 한계치 없이 연속적인 상관관계에 있음이 반영된 것이다. 새로운 진단 기준은 \n신생아 체중 ＞ 90th percentile, 제대혈 C-peptide ＞ 90th percentile, 체지방률 ＞ 90th percentile의 \n위험도를 평균 혈당군에 비해 1.75배 증가시키는 수치로 결정되었다.\x13 ']",0.6666666666666666,0.9860130139602515,0.9999999999,1.0
